,Company name,Ticker,Date of Breach,Date Became Aware of Breach,Date of Disclosure,Number of Records,Information,Stock Price (0 months DoD),Stock Price (1 months DoD),Stock Price (2 months DoD),Stock Price (3 months DoD),Stock Price (4 months DoD),Stock Price (5 months DoD),Stock Price (6 months DoD),Stock Price (7 months DoD),Stock Price (8 months DoD),Stock Price (9 months DoD),Stock Price (10 months DoD),Stock Price (11 months DoD),Stock Price (12 months DoD),median stock forecast,mean stock forecast,count stock forecast,Financial (Type of Info),Intrusion (Type of Info),ND (Type of Info),Other (Type of Info),Personal (Type of Info),Exploit (Attack),Forged Cookies (Attack),Malware (Attack),Misconfiguration (Attack),ND (Attack),Phishing (Attack),Ransomware (Attack),SQLi (Attack),Spoofing (Attack),Unauthorized Access (Attack),Virus (Attack),rootkit (Attack),Construction (Industry),"Finance, Insurance, Real Estate (Industry)",Manufacturing (Industry),Mining (Industry),N/A (Industry),Retail Trade (Industry),Services (Industry),Transportation & Public Utilities (Industry),Wholesale Trade (Industry),Canada (Region),Foreign (Region),US Mid Atlantic (Region),US Midwest (Region),US New England (Region),US Southeast (Region),US Southwest (Region),US West (Region)
0,HUMANA INC,HUM,10/12/2020 - 12/16/2020,2020-12-22 00:00:00,2021-02-25,,SSN | Name | DoB | Address | Phone Number | Email | Other,381.3999938964844,414.6600036621094,,,,,,,,,,,,,,0,0,0,0,0,1,0,0,0,0,0,0,0,0,0,1,0,0,0,1,0,0,0,0,0,0,0,0,0,1,0,0,0,0,0
1,HERBALIFE NUTRITION LTD.,HLF,2020-10-01 00:00:00,,2021-02-23,,Name | Phone Number | Address | DOB | Membership ID | Username | Password ,45.27999877929688,46.29999923706055,,,,,,,,,,,,,,0,0,0,0,1,1,0,0,0,0,0,0,0,0,0,1,0,0,0,0,0,0,0,0,0,0,1,0,1,0,0,0,0,0,0
2,"Ultra Clean Holdings, Inc.",UCTT,,,2021-02-23,,SSN | Driver's License,48.369998931884766,55.09000015258789,,,,,,,,,,,,,,0,0,0,0,0,1,0,0,0,0,1,0,0,0,0,0,0,0,0,0,1,0,0,0,0,0,0,0,0,0,0,0,0,0,1
3,KROGER CO,KR,,2021-01-23 00:00:00,2021-02-19,,Name | Email | Phone Number | Address | DOB | SSN | Other,33.84000015258789,34.689998626708984,,,,,,,,,,,,,,0,0,0,0,0,1,0,0,0,0,0,0,0,0,0,1,0,0,0,0,0,0,0,1,0,0,0,0,0,0,1,0,0,0,0
4,CINTAS CORP,CTAS,9/16/2020 - 9/20/2020,2020-09-20 00:00:00,2021-02-15,,Name | Bank Account,345.1000061035156,351.6000061035156,350.0799865722656,,,,,,,,,,,,,0,1,0,0,0,1,0,0,0,0,0,0,0,0,0,1,0,0,0,0,1,0,0,0,0,0,0,0,0,0,1,0,0,0,0
5,"Blueknight Energy Partners, L.P.",BKEP,,2021-01-12 00:00:00,2021-02-12,,Name | SSN | Bank Account | Other,2.119999885559082,3.119999885559082,3.1700000762939453,,,,,,,,,,,,,0,1,0,0,0,0,0,0,0,0,1,0,0,0,0,0,0,0,0,0,0,0,0,0,0,1,0,0,0,0,0,0,0,1,0
6,SOUTH JERSEY INDUSTRIES INC,SJI,,,2021-02-11,,SSN | Account Number,23.479999542236328,28.799999237060547,24.6200008392334,,,,,,,,,,,,,0,0,0,0,0,1,0,0,0,0,1,0,0,0,0,0,0,0,0,0,0,0,0,0,0,1,0,0,0,1,0,0,0,0,0
7,"Globalstar, Inc.",GSAT,,,2021-02-10,,Account Number,2.0799999237060547,1.590000033378601,1.3300000429153442,,,,,,,,,,,,,0,1,0,0,0,1,0,0,0,0,1,0,0,0,0,0,0,0,0,0,0,0,0,0,0,1,0,0,0,0,0,0,1,0,0
8,WestRock Co,WRK,,2021-01-23 00:00:00,2021-02-08,,ND,42.720001220703125,53.18000030517578,52.790000915527344,,,,,,,,,,,,,0,0,0,1,0,0,0,0,0,0,0,0,1,0,0,0,0,0,0,0,1,0,0,0,0,0,0,0,0,0,0,0,1,0,0
9,CARVANA CO.,CVNA,,,2021-02-05,,Driver's License,284.5299987792969,269.989990234375,267.3299865722656,,,,,,,,,,,,,0,0,0,0,0,1,0,0,0,0,1,0,0,0,0,0,0,0,0,0,0,0,0,1,0,0,0,0,0,0,0,0,0,1,0
10,INDEPENDENT BANK CORP,INDB,,,2021-02-05,,Account Number,77.73999786376953,87.69999694824219,84.63999938964844,,,,,,,,,,,,,0,1,0,0,0,0,0,0,0,0,1,0,0,0,0,0,0,0,0,1,0,0,0,0,0,0,0,0,0,0,0,1,0,0,0
11,FORWARD AIR CORP,FWRD,2020-12-01 00:00:00,,2021-02-04,,ND,73.38999938964844,88.73999786376953,89.4000015258789,,,,,,,,,,,,,0,0,0,1,0,0,0,0,0,0,0,0,1,0,0,0,0,0,0,0,0,0,0,0,0,1,0,0,0,0,0,0,1,0,0
12,"Tesla, Inc.",TSLA,,,2021-02-03,,Intellectual property,872.7899780273438,686.4400024414062,661.75,,,,,,,,,,,,,0,0,0,0,1,0,0,0,0,0,1,0,0,0,0,0,0,0,0,0,1,0,0,0,0,0,0,0,0,0,0,0,0,0,1
13,INTEL CORP,INTC,2020-09-29 00:00:00,,2021-02-03,,SSN | Other | Bank Account | DOB | Driver's License,58.0,61.2400016784668,64.55000305175781,,,,,,,,,,,,,0,1,0,0,0,0,0,0,0,0,1,0,0,0,0,0,0,0,0,0,1,0,0,0,0,0,0,0,0,0,0,0,0,0,1
14,"CarParts.com, Inc.",PRTS,06/21/2020 - 06/28/2020,2020-06-28 00:00:00,2021-02-01,,Name | Address | SSN | Driver's License,16.489999771118164,19.170000076293945,14.279999732971191,,,,,,,,,,,,,0,0,0,0,0,1,0,0,1,0,0,0,0,0,0,0,0,0,0,0,0,0,0,1,0,0,0,0,0,0,0,0,0,0,1
15,UNITED STATES CELLULAR CORP,USM,,,2021-01-29,,Name | Addres | Phone Number | Other,31.86000061035156,29.770000457763672,35.630001068115234,,,,,,,,,,,,,0,0,0,0,0,1,0,0,0,0,0,0,0,0,0,1,0,0,0,0,0,0,0,0,0,1,0,0,0,0,1,0,0,0,0
16,JOHNSON & JOHNSON,JNJ,2020-03-01 00:00:00,,2021-01-27,,Name|SSN|Other|Bank Account,170.47999572753906,158.4600067138672,164.92999267578125,,,,,,,,,,,,,0,1,0,0,0,0,0,0,0,0,0,0,0,0,0,1,0,0,0,0,1,0,0,0,0,0,0,0,0,1,0,0,0,0,0
17,"Petco Health & Wellness Company, Inc.",WOOF,2/11/2020 - 8/9/2020,2020-10-02 00:00:00,2021-01-25,30000,Name | Address | Email | Passwords | Credit Card,27.0,21.809999465942383,21.709999084472656,,,,,,,,,,,,,0,1,0,0,0,0,0,0,0,0,0,0,0,0,0,1,0,0,0,0,0,0,0,1,0,0,0,0,0,0,0,0,0,0,1
18,"National Western Life Group, Inc.",NWLI,8/7/2020 - 8/10/2020,2020-08-15 00:00:00,2021-01-25,,Name | Other,200.72000122070312,212.5,236.0399932861328,,,,,,,,,,,,,0,0,0,0,0,1,0,0,1,0,0,0,0,0,0,0,0,0,0,1,0,0,0,0,0,0,0,0,0,0,0,0,0,1,0
19,TORONTO DOMINION BANK,TD,9/14/2020 - 10/29/2020,2020-12-21 00:00:00,2021-01-22,,Bank Account | Credit Card | Debit Card,58.959999084472656,60.95000076293945,65.58000183105469,,,,,,,,,,,,,0,1,0,0,0,0,0,0,0,0,1,0,0,0,0,0,0,0,0,1,0,0,0,0,0,0,0,1,0,0,0,0,0,0,0
20,Walmart Inc.,WMT,,,2021-01-22,7000000,Name | Phone Number | Credit Card | Password | Other,144.85000610351562,137.69000244140625,132.3699951171875,,,,,,,,,,,,,0,1,0,0,0,0,0,0,0,0,0,0,0,0,0,1,0,0,0,0,0,0,0,1,0,0,0,0,0,0,0,0,1,0,0
21,INTEL CORP,INTC,,,2021-01-22,,Earnings Data,62.459999084472656,60.709999084472656,65.62999725341797,,,,,,,,,,,,,0,1,0,0,0,0,0,0,0,0,1,0,0,0,0,0,0,0,0,0,1,0,0,0,0,0,0,0,0,0,0,0,0,0,1
22,Clarus Corp,CLAR,2020-10-04 00:00:00,,2021-01-22,1825,SSN | Driver's License,15.710000038146973,17.719999313354492,16.639999389648438,,,,,,,,,,,,,0,0,0,0,0,1,0,0,1,0,0,0,0,0,0,0,0,0,0,0,1,0,0,0,0,0,0,0,0,0,0,0,0,0,1
23,BioNTech SE,BNTX,2020-12-09 00:00:00,,2021-01-19,,Intellectual Property,104.6999969482422,112.6500015258789,103.6500015258789,,,,,,,,,,,,,0,0,0,0,1,0,0,0,0,0,0,0,0,0,0,1,0,0,0,0,1,0,0,0,0,0,0,0,1,0,0,0,0,0,0
24,PFIZER INC,PFE,2020-12-09 00:00:00,,2021-01-19,,Intellectual Property,36.72999954223633,34.560001373291016,35.77000045776367,,,,,,,,,,,,,0,0,0,0,1,0,0,0,0,0,0,0,0,0,0,1,0,0,0,0,1,0,0,0,0,0,0,0,0,1,0,0,0,0,0
25,UNITED PARCEL SERVICE INC,UPS,2021-01-08 00:00:00,,2021-01-17,3000,ND,156.27999877929688,161.75,162.82000732421875,179.7100067138672,,,,,,,,,,,,0,0,0,0,0,1,0,0,0,0,0,0,1,0,0,0,0,0,0,0,0,0,0,0,0,1,0,0,0,0,0,0,1,0,0
26,NORFOLK SOUTHERN CORP,NSC,2021-01-08 00:00:00,,2021-01-17,3000,ND,249.83999633789065,256.3999938964844,256.3900146484375,270.8599853515625,,,,,,,,,,,,0,0,0,0,0,1,0,0,0,0,0,0,1,0,0,0,0,0,0,0,0,0,0,0,0,1,0,0,0,1,0,0,0,0,0
27,"SHIFT TECHNOLOGIES, INC.",SFT,2020-09-17 00:00:00,2020-09-18 00:00:00,2021-01-14,,ND,8.5,10.149999618530272,10.149999618530272,8.204999923706055,,,,,,,,,,,,0,0,0,1,0,0,0,0,0,0,0,0,0,0,0,1,0,0,0,0,0,0,0,1,0,0,0,0,0,0,0,0,0,0,1
28,Ubiquiti Inc.,UI,,,2021-01-12,,Name | Address | Phone Number | Email | Password,257.45001220703125,356.5599975585937,336.2300109863281,275.17999267578125,,,,,,,,,,,,0,0,0,0,0,1,0,0,0,0,0,0,0,0,0,1,0,0,0,0,1,0,0,0,0,0,0,0,0,1,0,0,0,0,0
29,Mimecast Ltd,MIME,,,2021-01-12,3600,Other,51.400001525878906,42.88999938964844,42.59000015258789,41.06999969482422,,,,,,,,,,,,0,0,0,0,1,0,0,0,0,0,0,0,0,0,0,1,0,0,0,0,0,0,0,0,1,0,0,0,1,0,0,0,0,0,0
30,"Veritex Holdings, Inc.",VBTX,4/2/2020 - 4/27/2020,2020-05-08 00:00:00,2021-01-11,,ND,28.270000457763672,28.61000061035156,31.59000015258789,34.279998779296875,,,,,,,,,,,,0,0,0,1,0,0,0,0,0,0,0,0,0,0,0,1,0,0,0,1,0,0,0,0,0,0,0,0,0,0,0,0,0,1,0
31,AURORA CANNABIS INC,ACB,2020-12-25 00:00:00,,2021-01-04,,ND,9.520000457763672,13.75,10.460000038146973,9.140000343322754,,,,,,,,,,,,0,0,0,1,0,0,0,0,0,0,1,0,0,0,0,0,0,0,0,0,1,0,0,0,0,0,0,1,0,0,0,0,0,0,0
32,"Matson, Inc.",MATX,,2020-10-14 00:00:00,2021-01-04,,Name | SSN | Other,56.68999862670898,61.380001068115234,73.36000061035156,67.31999969482422,,,,,,,,,,,,0,0,0,0,0,1,0,0,0,0,1,0,0,0,0,0,0,0,0,0,0,0,0,0,0,1,0,0,0,0,0,0,0,0,1
33,"T-Mobile US, Inc.",TMUS,,,2020-12-30,200000,Phone Number | Other,133.13999938964844,126.08000183105467,123.56999969482422,123.45999908447266,,,,,,,,,,,,0,0,0,0,0,1,0,0,0,0,0,0,0,0,0,1,0,0,0,0,0,0,0,0,0,1,0,0,0,0,0,0,0,1,0
34,WHIRLPOOL CORP /DE/,WHR,,,2020-12-28,,Other,185.19000244140625,212.3999938964844,190.0800018310547,223.08999633789065,,,,,,,,,,,,0,0,0,0,0,1,0,0,0,0,0,0,1,0,0,0,0,0,0,0,1,0,0,0,0,0,0,0,0,0,1,0,0,0,0
35,Colfax CORP,CFX,11/8/2020 - 11/9/2020,2020-11-16 00:00:00,2020-12-23,,Name|SSN|Other|Bank Account,36.18999862670898,40.59999847412109,44.90999984741211,45.720001220703125,,,,,,,,,,,,0,1,0,0,0,0,0,0,0,0,0,0,0,0,0,1,0,0,0,0,1,0,0,0,0,0,0,0,0,1,0,0,0,0,0
36,"VMWARE, INC.",VMW,,,2020-12-21,,ND,142.22999572753906,132.6699981689453,144.67999267578125,145.97999572753906,,,,,,,,,,,,0,0,0,1,0,0,0,0,1,0,0,0,0,0,0,0,0,0,0,0,0,0,0,0,1,0,0,0,0,0,0,0,0,0,1
37,NVIDIA CORP,NVDA,,,2020-12-21,,ND,533.2899780273438,534.6300048828125,597.0599975585938,513.8300170898438,,,,,,,,,,,,0,0,0,1,0,0,0,0,1,0,0,0,0,0,0,0,0,0,0,0,1,0,0,0,0,0,0,0,0,0,0,0,0,0,1
38,INTEL CORP,INTC,,,2020-12-21,,ND,46.36000061035156,58.66999816894531,63.0099983215332,63.7599983215332,,,,,,,,,,,,0,0,0,1,0,0,0,0,1,0,0,0,0,0,0,0,0,0,0,0,1,0,0,0,0,0,0,0,0,0,0,0,0,0,1
39,"CISCO SYSTEMS, INC.",CSCO,,,2020-12-21,,ND,44.880001068115234,45.34000015258789,45.68000030517578,48.97999954223633,,,,,,,,,,,,0,0,0,1,0,0,0,0,1,0,0,0,0,0,0,0,0,0,0,0,1,0,0,0,0,0,0,0,0,0,0,0,0,0,1
40,MICROSOFT CORP,MSFT,,,2020-12-17,,Intellectual Property,219.27999877929688,212.6499938964844,243.6999969482422,237.7100067138672,260.739990234375,,,,,,,,,,,0,0,0,0,1,0,0,0,1,0,0,0,0,0,0,0,0,0,0,0,0,0,0,0,1,0,0,0,0,0,0,0,0,0,1
41,"MEDNAX, INC.",MD,,2020-06-19 00:00:00,2020-12-16,45,Name | Address | Email | DOB | SSN | Driver's License | Financial Account Information | Other,22.86000061035156,23.600000381469727,27.71999931335449,28.209999084472656,26.670000076293945,,,,,,,,,,,0,1,0,0,0,0,0,0,0,0,0,1,0,0,0,0,0,0,0,0,0,0,0,0,1,0,0,0,0,0,0,0,1,0,0
42,CLEAN HARBORS INC,CLH,,2020-09-02 00:00:00,2020-12-15,772,Name | SSN | Driver's License | Bank Account | Other,72.0999984741211,81.94999694824219,85.41999816894531,89.5,87.4000015258789,,,,,,,,,,,0,1,0,0,0,0,0,0,0,0,0,0,0,0,0,1,0,0,0,0,0,0,0,0,0,1,0,0,0,0,0,1,0,0,0
43,SolarWinds Corp,SWI,3/2020 - 6/2020,,2020-12-14,18000,ND,19.6200008392334,14.640000343322754,17.040000915527344,16.81999969482422,18.049999237060547,,,,,,,,,,,0,0,0,1,0,0,0,0,1,0,0,0,0,0,0,0,0,0,0,0,0,0,0,0,1,0,0,0,0,0,0,0,0,1,0
44,Spotify Technology S.A.,SPOT,,2020-11-12 00:00:00,2020-12-09,,Email | Username | Password | DOB | Other,332.8599853515625,353.1099853515625,323.7900085449219,258.3299865722656,280.94000244140625,,,,,,,,,,,0,0,0,0,0,1,0,0,0,1,0,0,0,0,0,0,0,0,0,0,0,0,0,0,0,1,0,0,1,0,0,0,0,0,0
45,"FireEye, Inc.",FEYE,,,2020-12-08,,Intellectual Property,15.40999984741211,22.770000457763672,21.459999084472656,19.06999969482422,19.690000534057617,,,,,,,,,,,0,0,0,0,1,0,0,0,0,0,1,0,0,0,0,0,0,0,0,0,1,0,0,0,0,0,0,0,0,0,0,0,0,0,1
46,II-VI INC,IIVI,,2020-11-19 00:00:00,2020-12-07,,Name | Address | DOB | SSN | Other,72.31999969482422,79.38999938964844,88.0,74.61000061035156,75.47000122070312,,,,,,,,,,,0,0,0,0,0,1,0,0,0,0,0,1,0,0,0,0,0,0,0,0,1,0,0,0,0,0,0,0,0,1,0,0,0,0,0
47,BERKSHIRE HATHAWAY INC,BRK.A,,2020-08-22 00:00:00,2020-12-01,,Name | Address | SSN | Other,343688.0,345095.0,344100.0,377755.0,390360.0,,,,,,,,,,,0,0,0,0,0,1,0,0,0,0,0,0,1,0,0,0,0,0,0,1,0,0,0,0,0,0,0,0,0,0,1,0,0,0,0
48,MINERALS TECHNOLOGIES INC,MTX,2020-10-20 00:00:00,2020-10-22 00:00:00,2020-11-30,,Name | Address | Phone Number | SSN | DOB | Email | Banking Info | Other,60.66999816894531,61.130001068115234,61.630001068115234,74.06999969482422,74.66999816894531,,,,,,,,,,,0,0,0,0,1,1,0,0,0,0,0,0,0,0,0,1,0,0,0,0,1,0,0,0,0,0,0,0,0,1,0,0,0,0,0
49,BELDEN INC.,BDC,,,2020-11-27,,ND,39.810001373291016,41.56999969482422,47.84999847412109,44.209999084472656,43.84000015258789,,,,,,,,,,,0,0,0,0,1,1,0,0,0,0,0,0,0,0,0,1,0,0,0,0,1,0,0,0,0,0,0,0,0,0,0,0,1,0,0
50,CANON INC,CAJ,7/20/2020 - 8/6/2020,2020-08-04 00:00:00,2020-11-25,,Name|Bank Account|Other,18.649999618530277,19.59000015258789,21.479999542236328,22.31999969482422,22.0,,,,,,,,,,,0,1,0,0,0,0,0,0,0,0,0,0,1,0,0,0,0,0,0,0,1,0,0,0,0,0,0,0,1,0,0,0,0,0,0
51,Manchester United plc,MANU,,,2020-11-20,,ND,15.539999961853027,16.5,16.030000686645508,16.290000915527344,17.530000686645508,,,,,,,,,,,0,0,0,1,0,0,0,0,0,0,1,0,0,0,0,0,0,0,0,0,0,0,0,0,1,0,0,0,1,0,0,0,0,0,0
52,"WINDSTREAM HOLDINGS, INC.",,7/11/2020 - 8/23/2020,,2020-11-18,,ND,13.479999542236328,14.149999618530272,14.0600004196167,14.229999542236328,14.020000457763672,14.4399995803833,,,,,,,,,,0,0,0,1,0,0,0,0,0,0,0,0,0,0,0,1,0,0,0,0,0,0,0,0,0,1,0,0,0,0,0,0,1,0,0
53,STEEL PARTNERS HOLDINGS L.P.,SPLP,,2020-05-29 00:00:00,2020-11-18,,Name | DOB | SSN | Other,8.130000114440918,8.819999694824219,13.380000114440918,13.779999732971191,14.0600004196167,19.0,,,,,,,,,,0,0,0,0,0,1,0,0,0,0,0,0,0,0,0,1,0,0,0,0,1,0,0,0,0,0,0,0,0,1,0,0,0,0,0
54,ViacomCBS Inc.,VIAC,,,2020-11-14,,Name | Email | Password | DOB | Other,30.200000762939453,34.66999816894531,43.119998931884766,58.310001373291016,94.94000244140624,40.4900016784668,,,,,,,,,,0,0,0,0,0,1,0,0,0,0,0,0,0,0,0,1,0,0,0,0,0,0,0,0,0,1,0,0,0,1,0,0,0,0,0
55,SEACHANGE INTERNATIONAL INC,SEAC,,2020-04-20 00:00:00,2020-11-12,,Name,0.7799999713897705,0.9300000071525574,1.2000000476837158,1.3700000047683716,1.2300000190734863,1.4700000286102295,,,,,,,,,,0,0,0,0,0,1,0,0,1,0,0,0,0,0,0,0,0,0,0,0,1,0,0,0,0,0,0,0,0,0,0,1,0,0,0
56,FORWARD AIR CORP,FWRD,6/20/2020-6/26/2020,2020-06-24 00:00:00,2020-11-11,,ND,73.01000213623047,73.4000015258789,79.22000122070312,84.66000366210938,91.08000183105467,89.08000183105469,,,,,,,,,,0,0,0,1,0,0,0,0,0,0,0,0,0,0,0,1,0,0,0,0,0,0,0,0,0,1,0,0,0,0,0,0,1,0,0
57,"Southeastern Grocers, Inc.",SEGR,"9/22/2020, 9,23,2020",2020-09-22 00:00:00,2020-11-11,4,Name | Phone Number | Email | Address | DOB | Username | Password | Other,,,,,,,,,,,,,,,,0,0,0,0,0,1,0,0,0,0,0,0,0,0,0,1,0,0,0,0,0,0,0,1,0,0,0,0,0,0,0,0,1,0,0
58,GEO GROUP INC,GEO,7/17/2020-8/19/2020,2020-08-19 00:00:00,2020-11-03,,Name | Address | DOB | SSN | Other,9.4399995803833,9.670000076293944,8.859999656677246,8.739999771118164,7.449999809265137,7.690000057220459,,,,,,,,,,0,0,0,0,0,1,0,0,0,0,0,0,1,0,0,0,0,0,0,1,0,0,0,0,0,0,0,0,0,0,0,0,1,0,0
59,"SiteOne Landscape Supply, Inc.",SITE,7/2/2020 - 7/14/2020,2020-07-14 00:00:00,2020-10-30,,Name|Address|SSN|Bank Account|Other,124.47000122070312,138.10000610351562,157.07000732421875,157.67999267578125,163.97999572753906,171.42999267578125,,,,,,,,,,0,1,0,0,0,0,0,0,0,0,0,0,0,0,0,1,0,0,0,0,0,0,0,0,0,0,1,0,0,0,0,0,1,0,0
60,"HOME DEPOT, INC.",HD,2020-10-28 00:00:00,,2020-10-30,,Name | Email | Address | Credit Card | Other,269.6300048828125,277.4100036621094,266.19000244140625,270.82000732421875,261.6199951171875,302.20001220703125,,,,,,,,,,0,1,0,0,0,0,0,0,0,1,0,0,0,0,0,0,0,0,0,0,0,0,0,1,0,0,0,0,0,0,0,0,1,0,0
61,TAILORED BRANDS INC,,10/10/2019-1/28/2020,2020-09-01 00:00:00,2020-10-26,11,Name | SSN,13.470000267028809,13.779999732971191,14.170000076293944,14.43000030517578,13.880000114440918,14.130000114440918,,,,,,,,,,0,0,0,0,0,1,0,0,0,0,0,1,0,0,0,0,0,0,0,0,0,0,0,1,0,0,0,0,0,0,0,0,0,1,0
62,"Ultra Clean Holdings, Inc.",UCTT,2020-08-03 00:00:00,2020-08-05 00:00:00,2020-10-23,6060,Financial Account Number | Credit Card Number,23.709999084472656,30.1200008392334,32.029998779296875,43.36000061035156,48.369998931884766,55.09000015258789,,,,,,,,,,0,1,0,0,0,0,0,0,0,0,0,1,0,0,0,0,0,0,0,0,1,0,0,0,0,0,0,0,0,0,0,0,0,0,1
63,DR REDDYS LABORATORIES LTD,RDY,2020-10-22 00:00:00,2020-10-22 00:00:00,2020-10-22,,ND,67.61000061035156,63.02000045776367,68.18000030517578,68.70999908447266,61.119998931884766,60.09000015258789,,,,,,,,,,0,0,0,1,0,0,0,0,0,0,0,0,1,0,0,0,0,0,0,0,1,0,0,0,0,0,0,0,1,0,0,0,0,0,0
64,BRIDGFORD FOODS CORP,BRID,2020-07-25 00:00:00,,2020-10-22,,Name | SSN | Address | DoB,18.149999618530277,18.700000762939453,18.75,17.5,15.640000343322754,15.31999969482422,,,,,,,,,,0,0,0,0,0,1,0,0,0,0,0,0,0,0,0,1,0,0,0,0,1,0,0,0,0,0,0,0,0,0,0,0,0,0,1
65,PFIZER INC,PFE,7/1/2020-9/23/2020,,2020-10-21,,Name | Address | Email | Phone Numbers | Other,35.56925964355469,36.70000076293945,37.380001068115234,36.5,34.439998626708984,35.529998779296875,,,,,,,,,,0,0,0,0,0,1,0,0,0,1,0,0,0,0,0,0,0,0,0,0,1,0,0,0,0,0,0,0,0,1,0,0,0,0,0
66,TERMINIX GLOBAL HOLDINGS INC,TMX,9/10/2020-9/22/2020,2020-09-26 00:00:00,2020-10-19,14708,Name | SSN | DoB  | Retirement Account | Other,46.959999084472656,48.79999923706055,51.66999816894531,52.06999969482422,49.90999984741211,49.18999862670898,,,,,,,,,,0,1,0,0,0,1,0,0,0,0,0,1,0,0,0,0,0,0,0,0,0,0,0,0,1,0,0,0,0,0,0,0,1,0,0
67,"T-Mobile US, Inc.",TMUS,2020-08-31 00:00:00,2020-09-01 00:00:00,2020-10-09,1,Name | Address | Phone Number | Account Number | Driver's License | Other,115.48999786376952,122.77999877929688,133.14999389648438,135.05999755859375,126.0999984741211,127.05999755859376,130.11000061035156,,,,,,,,,0,0,0,0,0,1,0,0,0,0,0,0,0,0,0,1,0,0,0,0,0,0,0,0,0,1,0,0,0,0,0,0,0,1,0
68,DXP ENTERPRISES INC,DXPE,,2020-08-22 00:00:00,2020-10-09,,Name | SSN,18.31999969482422,21.540000915527344,23.1200008392334,25.57999992370605,27.6299991607666,33.959999084472656,30.780000686645508,,,,,,,,,0,0,0,0,0,1,0,0,0,0,0,0,1,0,0,0,0,0,0,0,0,0,0,0,0,0,1,0,0,0,0,0,0,1,0
69,UNIVERSAL HEALTH SERVICES INC,UHS,9/27/2020-10/12/2020,,2020-10-05,,ND,111.54000091552734,112.27999877929688,135.17999267578125,135.27999877929688,131.6999969482422,127.12000274658205,136.3699951171875,,,,,,,,,0,0,0,1,0,0,0,0,0,0,0,0,1,0,0,0,0,0,0,0,0,0,0,0,1,0,0,0,0,1,0,0,0,0,0
70,SINCLAIR BROADCAST GROUP INC,SBGI,2020-05-01 00:00:00,2020-07-08 00:00:00,2020-10-05,,Name | Driver's License,18.690000534057617,18.100000381469727,28.90999984741211,31.729999542236328,32.0099983215332,35.65999984741211,29.75,,,,,,,,,0,0,0,0,0,1,0,0,0,0,1,0,0,0,0,0,0,0,0,0,0,0,0,0,0,1,0,0,0,1,0,0,0,0,0
71,Unum Group,UNM,12/5/2019-12/132019,2020-07-13 00:00:00,2020-10-02,,Name | SSN | Other,17.0,18.51000022888184,22.489999771118164,22.940000534057617,23.729999542236328,27.200000762939453,28.13999938964844,,,,,,,,,0,0,0,0,0,1,0,0,0,0,0,0,0,0,0,1,0,0,0,1,0,0,0,0,0,0,0,0,0,0,0,0,1,0,0
72,UNIVERSAL HEALTH SERVICES INC,UHS,2020-09-27 00:00:00,,2020-09-29,,ND,104.41000366210938,106.37000274658205,132.11000061035156,136.52999877929688,127.83999633789062,127.9000015258789,135.1300048828125,,,,,,,,,0,0,0,1,0,0,0,0,0,0,0,0,1,0,0,0,0,0,0,0,0,0,0,0,1,0,0,0,0,1,0,0,0,0,0
73,VOXX International Corp,VOXX,6/4/2020 - 7/7/2020,2020-07-07 00:00:00,2020-09-28,,Name | Address | Email | SSN | Bank Account | Other,7.949999809265137,13.31999969482422,12.829999923706056,13.130000114440918,19.030000686645508,20.729999542236328,19.350000381469727,,,,,,,,,0,1,0,0,0,0,0,0,0,0,0,0,1,0,0,0,0,0,0,0,0,0,0,0,0,0,1,0,0,1,0,0,0,0,0
74,TOWN SPORTS INTERNATIONAL HOLDINGS INC,CLUBQ,,,2020-09-23,665000,Name | Address | Email | Phone Number,0.25,0.0599999986588954,0.1400000005960464,0.1299999952316284,0.2800000011920929,0.3700000047683716,0.3400000035762787,,,,,,,,,0,0,0,0,0,1,0,0,0,1,0,0,0,0,0,0,0,0,0,0,0,0,0,0,1,0,0,0,0,1,0,0,0,0,0
75,TYLER TECHNOLOGIES INC,TYL,,2020-09-23 00:00:00,2020-09-23,2301,ND,344.0299987792969,399.010009765625,413.5199890136719,438.5199890136719,424.3999938964844,459.6199951171875,420.7000122070313,,,,,,,,,0,0,0,1,0,0,0,0,0,0,0,0,1,0,0,0,0,0,0,0,0,0,0,0,1,0,0,0,0,0,0,0,0,1,0
76,"RadNet, Inc.",RDNT,2020-07-18 00:00:00,,2020-09-21,,Name | SSN | Address | Other,14.84000015258789,16.190000534057617,18.270000457763672,17.934999465942383,20.26000022888184,18.440000534057617,23.31999969482422,,,,,,,,,0,0,0,0,0,1,0,0,0,0,0,0,0,0,0,1,0,0,0,0,0,0,0,0,1,0,0,0,0,0,0,0,0,0,1
77,"VACCINEX, INC.",VCNX,,,2020-09-14,,ND,5.210000038146973,2.059999942779541,1.9900000095367432,1.9800000190734863,2.4200000762939453,3.190000057220459,3.7100000381469727,2.539999961853028,,,,,,,,0,0,0,1,0,0,0,0,0,0,0,0,0,0,0,1,0,0,0,0,1,0,0,0,0,0,0,0,0,1,0,0,0,0,0
78,EQUINIX INC,EQIX,,,2020-09-09,,ND,741.0499877929688,824.4000244140625,743.2100219726562,695.280029296875,692.4600219726562,747.4099731445312,594.9199829101562,687.6900024414062,,,,,,,,0,0,0,1,0,0,0,0,0,0,0,0,1,0,0,0,0,0,0,1,0,0,0,0,0,0,0,0,0,0,0,0,0,0,1
79,"Fluent, Inc.",FLNT,7/23/2020 - 7/29/2020,2020-07-29 00:00:00,2020-09-04,,Name | Address | Email | Address | SSN | Phone Number | Other,3.180000066757202,2.509999990463257,2.690000057220459,3.869999885559082,5.25,5.829999923706055,6.900000095367432,4.460000038146973,,,,,,,,0,0,0,0,0,1,0,0,0,0,1,0,0,0,0,0,0,0,0,0,0,0,0,0,1,0,0,0,0,1,0,0,0,0,0
80,Warner Music Group Corp.,WMG,4/25/2020 - 8/5/2020,2020-08-05 00:00:00,2020-09-02,,Name | Email | Phone Number | Address | Credit Card | Other,29.8799991607666,28.170000076293945,26.239999771118164,29.299999237060547,37.9900016784668,35.5,37.40999984741211,34.02000045776367,,,,,,,,0,1,0,0,0,0,0,0,0,0,0,0,0,0,0,1,0,0,0,0,0,0,0,0,1,0,0,0,0,1,0,0,0,0,0
81,"Amphastar Pharmaceuticals, Inc.",AMPH,2020-05-02 00:00:00,2020-07-24 00:00:00,2020-08-28,,Name | SSN,20.309999465942383,18.51000022888184,19.8799991607666,18.1200008392334,19.020000457763672,18.82999992370605,17.530000686645508,18.040000915527344,,,,,,,,0,0,0,0,0,1,0,0,0,0,0,0,1,0,0,0,0,0,0,0,1,0,0,0,0,0,0,0,0,0,0,0,0,0,1
82,R1 RCM INC.,RCM,,,2020-08-24,,ND,14.5600004196167,15.020000457763672,17.469999313354492,20.32999992370605,23.530000686645508,26.530000686645508,27.959999084472656,25.15999984741211,,,,,,,,0,0,0,1,0,0,0,0,0,0,0,0,1,0,0,0,0,0,0,0,0,0,0,0,1,0,0,0,0,0,1,0,0,0,0
83,MARRIOTT INTERNATIONAL INC /MD/,MAR,,2020-08-12 00:00:00,2020-08-17,,ND,95.72000122070312,107.76000213623048,97.76000213623048,123.76000213623048,130.44000244140625,126.8000030517578,130.39999389648438,150.6300048828125,148.6300048828125,,,,,,,0,0,0,0,0,1,0,0,0,0,0,0,0,0,1,0,0,0,0,0,0,0,0,0,1,0,0,0,0,1,0,0,0,0,0
84,CARNIVAL CORP,CCL,,2020-08-15 00:00:00,2020-08-17,,Name|Address|Phone Number|Passport Number|DOB|Social|Other,14.68000030517578,16.459999084472656,14.079999923706056,17.56999969482422,21.76000022888184,20.790000915527344,22.46999931335449,28.25,27.030000686645508,,,,,,,0,0,0,0,0,1,0,0,0,0,0,0,1,0,0,0,0,0,0,0,0,0,0,0,0,1,0,0,0,0,0,0,1,0,0
85,BROWN FORMAN CORP,BF.B,,2020-07-01 00:00:00,2020-08-15,,ND,71.12999725341797,79.48999786376953,77.48999786376953,79.58000183105469,75.52999877929688,73.45999908447266,76.8499984741211,72.38999938964844,72.5,,,,,,,0,1,0,0,0,0,0,0,0,0,0,0,1,0,0,0,0,0,0,0,1,0,0,0,0,0,0,0,0,1,0,0,0,0,0
86,STERICYCLE INC,SRCL,10/2019 - 4/2020,2020-07-27 00:00:00,2020-08-14,,Name | SSN | Tax ID Number | Drivers License | Passport | Other (Financial) | Credit Card | Other,65.41999816894531,61.869998931884766,65.37999725341797,70.43000030517578,69.43000030517578,69.62000274658203,69.4000015258789,68.5,68.22000122070312,,,,,,,0,1,0,0,0,0,0,0,0,0,0,1,0,0,0,0,0,0,0,0,0,0,0,0,0,1,0,0,0,0,1,0,0,0,0
87,METROPOLITAN LIFE INSURANCE CO,,,2020-07-27 00:00:00,2020-08-10,,Name | SSN | Other ,14.130000114440918,13.800000190734863,13.640000343322754,13.5600004196167,14.220000267028809,14.09000015258789,14.539999961853027,14.010000228881836,14.380000114440918,,,,,,,0,0,0,0,0,1,0,0,0,0,1,0,0,0,0,0,0,0,0,1,0,0,0,0,0,0,0,0,0,1,0,0,0,0,0
88,INTEL CORP,INTC,,,2020-08-06,,Intellectual Property,48.91999816894531,50.08000183105469,51.68999862670898,45.68000030517578,51.9900016784668,50.61000061035156,58.18000030517578,60.7400016784668,66.54000091552734,,,,,,,0,0,0,0,1,0,0,0,0,0,1,0,0,0,0,0,0,0,0,0,1,0,0,0,0,0,0,0,0,0,0,0,0,0,1
89,CANON INC,CAJ,,2020-07-30 00:00:00,2020-08-04,,Other,16.719999313354492,16.31999969482422,16.3700008392334,18.09000015258789,18.90999984741211,18.209999084472656,22.15999984741211,21.68000030517578,22.88999938964844,,,,,,,0,0,0,0,0,1,0,0,0,0,0,0,1,0,0,0,0,0,0,0,1,0,0,0,0,0,0,0,1,0,0,0,0,0,0
90,DYNAVAX TECHNOLOGIES CORP,DVAX,2020-02-28 00:00:00,,2020-07-24,,ND,10.119999885559082,6.010000228881836,4.53000020980835,4.159999847412109,4.199999809265137,5.599999904632568,5.21999979019165,9.079999923706056,10.119999885559082,,,,,,,0,0,0,1,0,0,0,0,0,0,0,1,0,0,0,0,0,0,0,0,1,0,0,0,0,0,0,0,0,0,0,0,0,0,1
91,GARMIN LTD,GRMN,2020-07-23 00:00:00,2020-07-23 00:00:00,2020-07-23,,ND,101.3499984741211,102.43000030517578,95.13999938964844,99.04000091552734,114.66000366210938,119.13999938964844,123.83000183105467,127.6500015258789,127.58000183105467,,,,,,,0,0,0,1,0,0,0,0,0,0,0,0,1,0,0,0,0,0,0,0,1,0,0,0,0,0,0,0,1,0,0,0,0,0,0
92,BLACKBAUD INC,BLKB,May-2020,,2020-07-17,6073,Bank Account | SSN | Username | Password,53.43999862670898,63.209999084472656,56.97999954223633,58.060001373291016,52.29999923706055,57.380001068115234,63.709999084472656,72.91000366210938,71.76000213623047,71.75,,,,,,0,1,0,0,0,0,0,0,0,0,0,0,1,0,0,0,0,0,0,0,0,0,0,0,1,0,0,0,0,0,0,0,1,0,0
93,"TWITTER, INC.",TWTR,,2020-07-15 00:00:00,2020-07-15,,ND,34.380001068115234,37.900001525878906,38.77000045776367,45.97999954223633,43.47999954223633,52.02000045776367,45.790000915527344,71.9000015258789,70.27999877929688,69.73999786376953,,,,,,0,0,0,1,0,0,0,0,0,0,0,1,0,0,0,0,0,0,0,0,0,0,0,0,1,0,0,0,0,0,0,0,0,0,1
94,FORMFACTOR INC,FORM,6/21/2020 - 6/28/2020,2020-06-28 00:00:00,2020-07-08,,ND,31.020000457763672,28.34000015258789,22.57999992370605,26.5,33.79999923706055,44.34000015258789,45.47999954223633,46.25,40.790000915527344,49.68000030517578,,,,,,0,0,0,1,0,0,0,0,0,0,0,0,1,0,0,0,0,0,0,0,1,0,0,0,0,0,0,0,0,0,0,0,0,0,1
95,STEEL PARTNERS HOLDINGS L.P.,SPLP,4/18/2020 - 4/29/2020,,2020-07-01,,Name | SSN | Other,5.269999980926514,4.769999980926514,7.389999866485596,6.170000076293945,5.340000152587891,8.699999809265137,10.970000267028809,13.5,13.420000076293944,13.989999771118164,,,,,,0,0,0,0,0,1,0,0,0,0,0,0,0,0,0,1,0,0,0,0,1,0,0,0,0,0,0,0,0,1,0,0,0,0,0
96,"TWITTER, INC.",TWTR,,2020-05-20 00:00:00,2020-06-23,,Email | Phone Number | Other (Financial),33.470001220703125,36.93999862670898,39.2599983215332,42.72999954223633,50.27999877929688,44.93999862670898,54.90999984741211,48.060001373291016,70.48999786376953,65.20999908447266,,,,,,0,1,0,0,0,0,0,0,0,1,0,0,0,0,0,0,0,0,0,0,0,0,0,0,1,0,0,0,0,0,0,0,0,0,1
97,"UNIVERSAL LOGISTICS HOLDINGS, INC.",ULH,2020-06-08 00:00:00,,2020-06-18,,ND,15.619999885559082,18.149999618530277,19.26000022888184,21.36000061035156,22.520000457763672,23.100000381469727,22.030000686645508,22.700000762939453,24.5,26.56999969482422,26.280000686645508,,,,,0,0,0,1,0,0,0,0,0,0,0,0,1,0,0,0,0,0,0,0,0,0,0,0,0,1,0,0,0,0,1,0,0,0,0
98,MAXLINEAR INC,MXL,4/15/2020 - 5/24/2020,2020-05-24 00:00:00,2020-06-16,,Name | Email | Address | Bank Account | SSN | Other,19.649999618530277,25.229999542236328,25.84000015258789,23.729999542236328,24.700000762939453,27.309999465942383,31.520000457763672,35.81999969482422,38.25,36.790000915527344,37.54999923706055,,,,,0,1,0,0,0,0,0,0,0,0,0,0,1,0,0,0,0,0,0,0,1,0,0,0,0,0,0,0,0,0,0,0,0,0,1
99,AVON PRODUCTS INC,,,2020-06-09 00:00:00,2020-06-09,19000000,Name | Address | DOB | Email | Phone Number | Other,13.550000190734863,13.5,14.119999885559082,13.729999542236328,13.630000114440918,13.5600004196167,14.210000038146973,14.09000015258789,14.550000190734863,13.960000038146973,14.470000267028809,,,,,0,0,0,0,0,1,0,0,0,1,0,0,0,0,0,0,0,0,0,0,1,0,0,0,0,0,0,0,0,1,0,0,0,0,0
100,HONDA MOTOR CO LTD,HMC,2020-06-08 00:00:00,2020-06-08 00:00:00,2020-06-08,,ND,28.09000015258789,25.670000076293945,24.670000076293945,25.350000381469727,24.809999465942383,26.36000061035156,29.809999465942383,28.170000076293945,28.76000022888184,29.479999542236328,29.920000076293945,,,,,0,0,0,1,0,0,0,0,0,0,0,0,1,0,0,0,0,0,0,0,1,0,0,0,0,0,0,0,1,0,0,0,0,0,0
101,CONDUENT Inc,CNDT,2020-05-29 00:00:00,2020-05-29 00:00:00,2020-06-05,,ND,2.6600000858306885,2.369999885559082,2.240000009536743,3.694999933242798,3.369999885559082,3.740000009536743,4.53000020980835,4.675000190734863,5.099999904632568,6.139999866485596,7.0,,,,,0,0,0,1,0,0,0,0,0,0,0,0,1,0,0,0,0,0,0,0,0,0,0,0,1,0,0,0,0,1,0,0,0,0,0
102,Cosan Ltd.,CZZ,2020-03-11 00:00:00,,2020-05-28,,ND,13.649999618530272,14.829999923706056,18.739999771118164,18.34000015258789,14.770000457763672,14.970000267028809,18.239999771118164,18.010000228881836,17.56999969482422,18.43000030517578,20.290000915527344,20.290000915527344,20.290000915527344,,,0,0,0,1,0,0,0,0,0,0,0,0,1,0,0,0,0,0,0,0,1,0,0,0,0,0,0,0,1,0,0,0,0,0,0
103,ICAHN ENTERPRISES L.P.,IEP,3/13/2020 - 4/4/2020,2020-04-06 00:00:00,2020-05-27,56521,Name | Address | SSN | Other (Financial),49.95000076293945,47.0099983215332,49.970001220703125,49.40999984741211,48.02000045776367,50.02999877929688,50.0,50.9900016784668,56.86000061035156,63.880001068115234,54.72999954223633,,,,,0,1,0,0,0,0,0,0,0,0,0,0,0,0,0,1,0,0,0,0,1,0,0,0,0,0,0,0,0,0,0,0,1,0,0
104,Natura &Co Holding S.A.,,2020-03-26 00:00:00,2020-04-12 00:00:00,2020-05-20,250000,Name | Password (Encrypted) | Phone Number | Email | Address,12.729999542236328,13.350000381469728,13.710000038146973,13.920000076293944,13.670000076293944,13.739999771118164,13.539999961853027,14.18000030517578,14.050000190734863,14.0600004196167,14.100000381469728,,,,,0,0,0,0,0,1,0,0,1,0,0,0,0,0,0,0,0,0,0,0,1,0,0,0,0,0,0,0,1,0,0,0,0,0,0
105,GENWORTH FINANCIAL INC,GNW,,2020-04-20 00:00:00,2020-05-14,,Name | Address | SSN | Other,2.789999961853028,3.150000095367432,2.039999961853028,2.549999952316284,3.75,3.630000114440918,4.5,4.199999809265137,3.130000114440918,4.110000133514404,3.549999952316284,3.440000057220459,,,,0,0,0,0,0,1,0,0,0,0,0,0,0,0,0,1,0,0,0,1,0,0,0,0,0,0,0,0,0,1,0,0,0,0,0
106,MAGELLAN HEALTH INC,MGLN,4/6/2020 - 4/12/2020,2020-04-22 00:00:00,2020-05-12,364892,Name | Address | SSN | Other | Username | Password,69.2699966430664,67.54000091552734,69.58999633789062,75.81999969482422,74.77999877929688,78.9000015258789,80.83999633789062,79.94999694824219,94.41000366210938,93.23999786376952,93.3499984741211,93.86000061035156,,75.0,75.0,1,0,0,0,0,1,0,0,0,0,0,1,1,0,0,0,0,0,0,0,0,0,0,0,1,0,0,0,0,0,0,0,0,1,0
107,KROGER CO,KR,,,2020-05-09,8000000,Username | Password,33.34000015258789,33.0099983215332,32.41999816894531,35.2400016784668,34.619998931884766,34.290000915527344,31.01000022888184,31.299999237060547,31.6299991607666,33.279998779296875,34.7400016784668,37.22999954223633,,42.0,42.0,1,0,0,0,0,1,0,0,0,0,1,0,0,0,0,0,0,0,0,0,0,0,0,1,0,0,0,0,0,0,1,0,0,0,0
108,Spark Networks SE,LOV,2020-01-12 00:00:00,2020-05-11 00:00:00,2020-05-09,30000000,Username | Password,2.990000009536743,3.839999914169312,3.9600000381469727,5.46999979019165,4.380000114440918,4.690000057220459,4.5,4.670000076293945,5.480000019073486,7.769999980926514,4.860000133514404,7.579999923706055,,,,0,0,0,0,0,1,0,0,0,0,0,0,0,0,0,1,0,0,0,0,0,0,0,0,1,0,0,0,1,0,0,0,0,0,0
109,"GAIN Capital Holdings, Inc.",,2020-04-14 00:00:00,,2020-05-08,,Name | Bank Account | Other,13.039999961853027,13.550000190734863,13.529999732971191,14.119999885559082,13.729999542236328,13.510000228881836,13.59000015258789,14.130000114440918,14.09000015258789,14.550000190734863,13.960000038146973,14.380000114440918,,,,0,1,0,0,0,0,0,0,0,0,1,0,0,0,0,0,0,0,0,1,0,0,0,0,0,0,0,0,0,1,0,0,0,0,0
110,GoDaddy Inc.,GDDY,2019-10-19 00:00:00,,2020-05-05,28000,Username | Password,66.80999755859375,79.13999938964844,71.30000305175781,73.2300033569336,79.5199966430664,77.08999633789062,79.77999877929688,83.87000274658203,81.77999877929688,86.54000091552734,76.23999786376953,81.86000061035156,,82.0,82.22222222222223,9,0,0,0,0,1,0,0,0,0,0,0,0,0,0,1,0,0,0,0,0,0,0,0,1,0,0,0,0,0,0,0,0,1,0
111,"CHEGG, INC",CHGG,2020-04-09 00:00:00,2020-04-10 00:00:00,2020-04-28,700,Name | SSN,41.84999847412109,60.7400016784668,65.41999816894531,74.30000305175781,75.19999694824219,70.79000091552734,77.11000061035156,75.01000213623047,91.70999908447266,93.26000213623048,96.52999877929688,85.30000305175781,,58.0,57.1,10,0,0,0,0,1,0,0,0,0,0,0,0,0,0,1,0,0,0,0,0,0,0,0,1,0,0,0,0,0,0,0,0,0,1
112,PRINCIPAL FINANCIAL GROUP INC,PFG,2019-12-16 00:00:00,,2020-04-28,,Name | SSN | Other,31.690000534057617,40.9900016784668,39.13999938964844,44.709999084472656,44.34000015258789,40.09999847412109,39.34999847412109,51.400001525878906,48.68000030517578,51.209999084472656,56.58000183105469,60.630001068115234,,37.5,37.75,4,0,0,0,0,1,0,0,0,1,0,0,0,0,0,0,0,0,0,1,0,0,0,0,0,0,0,0,0,0,1,0,0,0,0
113,TUPPERWARE BRANDS CORP,TUP,3/19/2020 - 3/24/2020,2020-03-24 00:00:00,2020-04-21,4763,Name | Address | Phone Number | Email | Credit Card,1.9600000381469729,2.9100000858306885,4.909999847412109,7.199999809265137,13.960000038146973,25.61000061035156,20.700000762939453,35.2599983215332,31.81999969482422,31.3799991607666,33.45000076293945,26.68000030517578,,,,0,1,0,0,0,0,0,0,1,0,0,0,0,0,0,0,0,0,0,0,1,0,0,0,0,0,0,0,0,0,0,0,1,0,0
114,COGNIZANT TECHNOLOGY SOLUTIONS CORP,CTSH,4/9/2020 - 4/11/2020,2020-04-20 00:00:00,2020-04-18,,Name | Credit Card | Other,53.810001373291016,53.13999938964844,55.4900016784668,61.43000030517578,67.54000091552734,70.12000274658203,73.36000061035156,77.0,81.7300033569336,80.23999786376953,76.43000030517578,78.02999877929688,80.62000274658203,60.0,60.26470588235294,17,1,0,0,0,0,0,0,0,0,0,0,1,0,0,0,0,0,0,0,0,0,0,0,1,0,0,0,0,1,0,0,0,0,0
115,US XPRESS ENTERPRISES INC,USX,Sep-2019,2019-10-18 00:00:00,2020-04-10,17262,ND,3.839999914169312,4.130000114440918,5.889999866485596,6.199999809265137,9.890000343322754,9.520000457763672,9.9399995803833,7.300000190734863,6.989999771118164,7.230000019073486,9.489999771118164,10.640000343322754,11.640000343322754,5.0,5.0,2,0,0,1,0,0,0,0,1,0,0,0,0,0,0,0,0,0,0,0,0,0,0,0,0,1,0,0,0,0,0,0,1,0,0
116,"Gannett Co., Inc.",GCI,,,2020-04-03,14000000,Email | Address | Password (Encrypted) | Other,0.9700000286102296,1.100000023841858,1.409999966621399,1.2699999809265137,1.5700000524520874,1.7599999904632568,1.350000023841858,1.1399999856948853,2.650000095367432,3.359999895095825,4.579999923706055,5.460000038146973,5.329999923706055,0.75,0.75,1,0,0,0,0,1,0,0,0,1,0,0,0,0,0,0,0,0,0,0,1,0,0,0,0,0,0,0,0,1,0,0,0,0,0
117,"Zoom Video Communications, Inc.",ZM,,,2020-04-03,530000,Username | Password,121.93000030517578,138.55999755859375,208.0800018310547,261.739990234375,268.0,423.55999755859375,482.2300109863281,453.0,412.8599853515625,337.32000732421875,391.8399963378906,372.7900085449219,326.2300109863281,144.0,136.07142857142858,7,0,0,0,0,1,0,0,0,1,0,0,0,0,0,0,0,0,0,0,0,0,0,0,1,0,0,0,0,0,0,0,0,0,1
118,"10x Genomics, Inc.",TXG,Mar-2020,Mar-2020,2020-04-01,,ND,62.31999969482422,79.87000274658203,81.94999694824219,89.30999755859375,98.37000274658205,114.62000274658205,124.68000030517578,136.89999389648438,153.11000061035156,141.60000610351562,176.8300018310547,186.75,181.0,20.1725,35.41441666666667,12,0,0,0,1,0,0,0,0,0,0,0,1,0,0,0,0,0,0,0,1,0,0,0,0,0,0,0,0,0,0,0,0,0,1
119,GoDaddy Inc.,GDDY,,,2020-03-31,,ND,59.15999984741211,69.43000030517578,77.25,73.33000183105469,68.88999938964844,83.68000030517578,75.97000122070312,70.73999786376953,79.54000091552734,83.31999969482422,78.58000183105469,84.77999877929688,75.94999694824219,73.0,76.9,10,0,0,0,1,0,0,0,0,0,0,1,0,0,0,0,0,0,0,0,0,0,0,0,1,0,0,0,0,0,0,0,0,1,0
120,MARRIOTT INTERNATIONAL INC /MD/,MAR,Mid-Jan 2020 - Late-Feb 2020,,2020-03-31,5200000,Other,76.16000366210938,90.94000244140624,88.5,85.7300033569336,85.51000213623047,102.91000366210938,92.58000183105467,92.87999725341795,126.87000274658205,130.47000122070312,116.30999755859376,148.47000122070312,148.22999572753906,88.5,93.08333333333331,12,0,0,0,0,1,0,0,0,0,0,0,0,0,0,1,0,0,0,0,0,0,0,0,1,0,0,0,0,1,0,0,0,0,0
121,Chubb Ltd,CB,,,2020-03-26,,ND,101.8000030517578,104.0199966430664,118.31999969482422,128.55999755859375,134.91000366210938,125.91000366210938,113.8499984741211,125.98999786376952,152.52999877929688,150.8300018310547,152.69000244140625,164.94000244140625,158.91000366210938,139.0,139.42857142857142,21,0,0,1,0,0,0,0,0,0,0,0,1,0,0,0,0,0,0,1,0,0,0,0,0,0,0,0,1,0,0,0,0,0,0
122,CANON INC,CAJ,2/3/2020 - 2/14/2020,,2020-03-24,,Name | Bank Account | Address | SSN | Other,20.21999931335449,19.6299991607666,19.8700008392334,21.40999984741211,19.790000915527344,17.299999237060547,16.209999084472656,16.450000762939453,18.690000534057617,19.559999465942383,21.170000076293945,22.030000686645508,22.1200008392334,0.2515,3.5283333333333338,6,1,0,0,0,0,0,0,0,0,0,1,0,0,0,0,0,0,0,0,1,0,0,0,0,0,0,0,1,0,0,0,0,0,0
123,WEIBO Corp,WB,,,2020-03-23,172000000,Name | Other,34.08000183105469,35.939998626708984,29.8799991607666,33.900001525878906,33.880001068115234,33.790000915527344,35.97999954223633,39.90999984741211,44.5099983215332,45.93999862670898,42.959999084472656,58.29999923706055,52.459999084472656,40.0,39.833333333333336,3,0,0,0,0,1,0,0,0,0,1,0,0,0,0,0,0,0,0,0,0,0,0,0,1,0,0,0,1,0,0,0,0,0,0
124,Norwegian Cruise Line Holdings Ltd.,NCLH,,2020-03-13 00:00:00,2020-03-20,29969,Email | Password | Other,8.229999542236328,11.489999771118164,12.43000030517578,18.21999931335449,14.890000343322754,15.68000030517578,16.25,16.450000762939453,21.020000457763672,25.18000030517578,25.299999237060547,26.850000381469727,29.700000762939453,20.0,22.0,7,0,0,0,0,1,0,0,0,1,0,0,0,0,0,0,0,0,0,0,0,0,0,0,0,1,0,0,0,0,0,0,1,0,0
125,ROGERS COMMUNICATIONS INC,RCI,,2020-02-26 00:00:00,2020-03-19,,Name | Address | Email | Phone Number | Other,37.91999816894531,42.959999084472656,39.97999954223633,42.02000045776367,42.16999816894531,42.61000061035156,39.27000045776367,40.0,45.34000015258789,46.66999816894531,47.31999969482422,44.380001068115234,48.93999862670898,69.0,68.57142857142857,7,0,0,0,0,1,0,0,0,1,0,0,0,0,0,0,0,0,0,0,0,0,0,0,0,1,0,1,0,0,0,0,0,0,0
126,TELUS CORP,TU,2020-02-13 00:00:00,,2020-03-18,,Phone Number,15.529999732971191,16.229999542236328,16.219999313354492,17.09000015258789,17.56999969482422,18.229999542236328,18.15999984741211,18.200000762939453,18.950000762939453,19.959999084472656,20.84000015258789,20.729999542236328,20.93000030517578,16.45,18.753125,16,0,0,0,0,1,0,0,0,0,0,0,0,0,0,1,0,0,0,0,0,0,0,0,0,1,0,1,0,0,0,0,0,0,0
127,TANDEM DIABETES CARE INC,TNDM,1/17/2020 - 1/20/2020,2020-01-17 00:00:00,2020-03-17,,SSN | Other,48.0099983215332,71.87000274658203,88.19999694824219,81.38999938964844,98.6500015258789,101.77999877929688,108.41000366210938,118.73999786376952,95.75,86.4000015258789,91.72000122070312,103.12000274658205,86.81999969482422,72.0,72.0,4,0,0,0,0,1,0,0,0,0,0,0,0,0,0,1,0,0,0,0,1,0,0,0,0,0,0,0,0,0,0,0,0,0,1
128,CARNIVAL CORP,CCL,4/11/2019 - 7/23/2019,Late May-2019,2020-03-13,372500,Name | Address | SSN | Credit Card | Other (Financial),14.970000267028809,11.5,13.1899995803833,19.979999542236328,15.279999732971191,15.1899995803833,17.690000534057617,15.210000038146973,14.93000030517578,21.31999969482422,20.1299991607666,20.600000381469727,28.459999084472656,13.0,25.41119047619048,21,1,0,0,0,0,0,0,0,0,0,0,0,0,0,1,0,0,0,0,0,0,0,0,0,1,0,0,0,0,0,0,1,0,0
129,ENTERCOM COMMUNICATIONS CORP,ETM,2019-08-04 00:00:00,Sep-2019,2020-03-06,,Name | Username | Password,3.319999933242798,0.8100000023841858,1.059999942779541,2.390000104904175,1.5299999713897705,1.4199999570846558,1.590000033378601,1.5399999618530271,1.7100000381469729,2.859999895095825,2.700000047683716,5.389999866485596,5.019999980926514,1.0,2.1666666666666665,3,0,0,0,0,1,0,0,0,0,0,0,0,0,0,1,0,0,0,0,0,0,0,0,0,1,0,0,0,1,0,0,0,0,0
130,Liberty Global plc,LBTYB,Apr-2019,,2020-03-05,900000,Other,21.190000534057617,17.510000228881836,41.09999847412109,22.21999931335449,23.0,23.38999938964844,23.38999938964844,21.399999618530277,20.59000015258789,22.709999084472656,24.100000381469727,24.0,22.57999992370605,,,0,0,0,0,0,1,0,0,0,0,1,0,0,0,0,0,0,0,0,0,0,0,0,0,0,1,0,0,1,0,0,0,0,0,0
131,"T-Mobile US, Inc.",TMUS,,,2020-03-04,1027,Name | Address | Phone Number | Other,89.37000274658203,81.9800033569336,88.95999908447266,101.20999908447266,106.01000213623048,106.87999725341795,114.83999633789062,113.41000366210938,111.12000274658205,131.19000244140625,132.42999267578125,129.3699951171875,118.83999633789062,110.0,106.85714285714286,7,0,0,0,0,1,0,0,0,0,0,0,0,0,0,1,0,0,0,0,0,0,0,0,0,1,0,0,0,0,0,0,0,1,0
132,CIRCOR INTERNATIONAL INC,CIR,,,2020-03-02,,ND,37.72999954223633,9.630000114440918,12.59000015258789,20.93000030517578,24.5,26.21999931335449,30.040000915527344,27.600000381469727,28.780000686645508,34.16999816894531,38.43999862670898,32.43000030517578,39.36000061035156,0.69,17.453333333333333,3,0,0,1,0,0,0,0,0,0,1,0,0,0,0,0,0,0,0,0,1,0,0,0,0,0,0,0,0,0,0,1,0,0,0
133,"Walgreens Boots Alliance, Inc.",WBA,1/9/2020 - 1/15/2020,2020-01-15 00:00:00,2020-02-28,,Name | Address | Other,46.2400016784668,44.0,44.43000030517578,42.970001220703125,41.16999816894531,39.84000015258789,39.34000015258789,36.06999969482422,36.0,39.0,39.65999984741211,51.18000030517578,47.93000030517578,51.0,51.0,2,0,0,0,0,1,0,0,0,1,0,0,0,0,0,0,0,0,0,0,0,0,0,1,0,0,0,0,0,0,1,0,0,0,0
134,CRYOLIFE INC,CRY,,2019-11-01 00:00:00,2020-02-19,,Money,27.149999618530277,20.5,19.8700008392334,22.450000762939453,17.3799991607666,18.959999084472656,20.51000022888184,17.3799991607666,18.670000076293945,20.06999969482422,21.920000076293945,24.18000030517578,25.0,,,0,0,0,0,1,0,0,0,0,0,0,1,0,0,0,0,0,0,0,0,1,0,0,0,0,0,0,0,0,0,0,0,1,0,0
135,MGM Resorts International,MGM,,,2020-02-19,10683188,Email | Phone Number | Address | Other,32.02000045776367,7.139999866485596,14.079999923706056,15.3100004196167,18.57999992370605,16.809999465942383,20.950000762939453,22.020000457763672,20.799999237060547,26.90999984741211,31.670000076293945,30.530000686645508,35.040000915527344,30.0,24.571428571428573,7,0,0,0,0,1,0,0,0,0,0,0,0,0,0,1,0,0,0,0,0,0,0,0,1,0,0,0,0,0,0,0,0,0,1
136,ESTEE LAUDER COMPANIES INC,EL,,,2020-02-11,,Email,208.67999267578125,187.3800048828125,164.8300018310547,169.9499969482422,200.42999267578125,189.69000244140625,204.4900054931641,214.6000061035156,224.6000061035156,247.3500061035156,246.52999877929688,258.1099853515625,284.3999938964844,142.0,150.33333333333334,15,0,0,0,0,1,0,0,0,1,0,0,0,0,0,0,0,0,0,0,1,0,0,0,0,0,0,0,0,1,0,0,0,0,0
137,"Altice USA, Inc.",ATUS,2019-11-04 00:00:00,Jan-2020,2020-02-06,52846,Name | SSN | Address,27.790000915527344,26.440000534057617,23.200000762939453,23.530000686645508,25.8700008392334,24.239999771118164,28.020000457763672,26.649999618530277,26.809999465942383,29.3700008392334,34.709999084472656,36.810001373291016,36.869998931884766,35.0,35.42857142857143,7,0,0,0,0,1,0,0,0,0,0,1,0,0,0,0,0,0,0,0,0,0,0,0,0,1,0,0,0,1,0,0,0,0,0
138,Alphabet Inc.,GOOGL,11/21/2019 - 11/25/2019,,2020-02-04,,ND,1482.5999755859375,1337.719970703125,1092.699951171875,1322.9000244140625,1439.25,1469.9300537109375,1482.760009765625,1629.510009765625,1455.5999755859375,1645.6600341796875,1821.8399658203125,1726.1300048828125,2058.8798828125,1600.0,1612.75,20,0,0,0,1,0,0,0,0,1,0,0,0,0,0,0,0,0,0,0,0,0,0,0,1,0,0,0,0,0,0,0,0,0,1
139,Public Storage,PSA,,,2020-01-30,,ND,222.0800018310547,209.1199951171875,201.6300048828125,186.72000122070312,202.7400054931641,191.1000061035156,196.83999633789065,213.44000244140625,220.91000366210935,230.8600006103516,224.4600067138672,227.8000030517578,227.6199951171875,229.0,233.33333333333331,3,0,0,0,1,0,0,0,0,0,1,0,0,0,0,0,0,0,0,1,0,0,0,0,0,0,0,0,0,0,0,0,0,0,1
140,UNITEDHEALTH GROUP INC,UNH,7/30/2019 - 11/13/2019,2019-12-10 00:00:00,2020-01-22,36,Name | Other,300.5299987792969,301.42999267578125,206.58999633789065,274.19000244140625,286.9100036621094,292.6700134277344,305.1099853515625,314.1400146484375,299.19000244140625,322.7900085449219,334.70001220703125,336.0799865722656,355.0,362.0,362.0,1,0,0,0,0,1,0,0,0,0,0,0,0,0,0,1,0,0,0,1,0,0,0,0,0,0,0,0,0,0,1,0,0,0,0
141,MICROSOFT CORP,MSFT,12/5/2019 - 12/31/2019,2019-12-31 00:00:00,2020-01-22,,ND,166.5,178.58999633789062,137.35000610351562,167.82000732421875,183.42999267578125,200.57000732421875,208.75,213.0200042724609,202.5399932861328,214.8000030517578,210.38999938964844,222.58999633789065,224.97000122070312,200.0,197.59259259259255,27,0,0,0,0,1,0,0,0,1,0,0,0,0,0,0,0,0,0,0,0,0,0,0,1,0,0,0,0,0,0,0,0,0,1
142,MEXICAN PETROLEUM,,,2019-11-10 00:00:00,2020-01-21,,ND,14.399999618530272,14.609999656677246,11.420000076293944,13.010000228881836,12.869999885559082,13.350000381469728,13.710000038146973,13.869999885559082,13.609999656677246,13.850000381469728,13.579999923706056,14.130000114440918,14.210000038146973,,,0,0,0,0,1,0,0,0,1,0,0,0,0,0,0,0,0,0,0,0,0,1,0,0,0,0,0,0,1,0,0,0,0,0,0
143,UNITED PARCEL SERVICE INC,UPS,9/29/2019 - 1/13/2020,,2020-01-20,17094,Name | Other,117.38999938964844,106.76000213623048,96.25,101.1999969482422,96.43000030517578,107.7699966430664,118.3499984741211,160.33999633789062,159.66000366210938,172.10000610351562,166.47999572753906,175.17999267578125,156.27999877929688,124.5,122.66666666666669,18,0,0,0,0,1,0,0,0,0,0,1,0,0,0,0,0,0,0,0,0,0,0,0,0,1,0,0,0,0,0,0,1,0,0
144,"AutoWeb, Inc.",AUTO,,2020-01-09 00:00:00,2020-01-13,,ND,2.5,2.130000114440918,1.940000057220459,0.7400000095367432,0.8799999952316284,1.0800000429153442,1.190000057220459,2.2100000381469727,3.609999895095825,4.5,2.400000095367432,2.720000028610229,2.950000047683716,582.5,524.6,10,0,0,0,1,0,0,0,1,0,0,0,0,0,0,0,0,0,0,0,0,0,0,0,1,0,0,0,0,0,0,0,1,0,0
145,"SMITH & WESSON BRANDS, INC.",SWBI,11/27/2019 - 12/3/2019,2019-12-16 00:00:00,2020-01-09,780,Credit Card,7.317448139190674,7.578785419464111,4.8501152992248535,5.841660499572754,7.432744026184082,11.821675300598145,17.271329879760742,20.23827743530273,17.350000381469727,16.690000534057617,15.8100004196167,15.479999542236328,19.270000457763672,,,0,1,0,0,0,0,0,0,1,0,0,0,0,0,0,0,0,0,0,0,1,0,0,0,0,0,0,0,0,0,0,1,0,0,0
146,Cigna Corp,CI,,2019-12-10 00:00:00,2020-01-09,,Name | Address | Other,211.41000366210935,208.9199981689453,181.6000061035156,186.22000122070312,189.2700042724609,215.83999633789065,180.0800018310547,178.19000244140625,173.97999572753906,177.8699951171875,211.1999969482422,218.6699981689453,220.8000030517578,255.0,250.53333333333333,15,0,0,0,0,1,0,0,0,1,0,0,0,0,0,0,0,0,0,1,0,0,0,0,0,0,0,0,0,0,0,1,0,0,0
147,"PayPal Holdings, Inc.",PYPL,,2019-11-06 00:00:00,2020-01-09,,Name| Address | Phone Number | Email | Credit Card,111.81999969482422,118.87999725341795,101.62999725341795,105.05999755859376,144.9600067138672,156.08999633789062,181.57000732421875,198.6300048828125,185.9499969482422,193.05999755859372,184.72000122070312,216.94000244140625,242.4600067138672,132.0,132.5,18,1,0,0,0,0,0,0,0,0,0,1,0,0,0,0,0,0,0,0,0,0,0,0,1,0,0,0,0,0,0,0,0,0,1
148,"Ollie's Bargain Outlet Holdings, Inc.",OLLI,10/9/2019 - 10/10/2019,2019-11-15 00:00:00,2019-12-31,,Name | SSN,65.58000183105469,55.369998931884766,50.869998931884766,45.790000915527344,67.91000366210938,91.4499969482422,97.6500015258789,106.8000030517578,95.54000091552734,87.3499984741211,87.08999633789062,88.05999755859375,83.05999755859375,65.0,64.33333333333333,3,0,0,0,0,1,0,0,0,0,0,1,0,0,0,0,0,0,0,0,0,0,0,1,0,0,0,0,0,1,0,0,0,0,0
149,Waitr Holdings Inc.,WTRH,1/18/2019 - 10/17/2019,,2019-12-31,,Name | Credit Card | Other,0.3000000119209289,0.3490000069141388,0.3589999973773956,1.2799999713897705,1.340000033378601,2.470000028610229,2.630000114440918,5.320000171661377,4.03000020980835,3.220000028610229,2.549999952316284,3.319999933242798,2.9800000190734863,,,0,1,0,0,0,0,0,0,1,0,0,0,0,0,0,0,0,0,0,0,0,0,0,0,1,0,0,0,0,0,0,0,1,0,0
150,GLOBAL PAYMENTS INC,GPN,10/1/2019 - 11/13/2019,,2019-12-30,,Name | Credit Card | Other,181.3500061035156,199.2700042724609,183.97000122070312,151.22999572753906,169.82000732421875,179.49000549316406,166.57000732421875,177.36000061035156,177.27000427246094,177.5,156.1699981689453,195.19000244140625,209.7700042724609,216.0,219.33333333333331,15,1,0,0,0,0,0,0,0,0,0,0,0,0,0,1,0,0,0,0,0,0,0,0,1,0,0,0,0,0,0,0,1,0,0
151,"AVID TECHNOLOGY, INC.",AVID,10/8/2018 - 10/12/2018,2018-09-24 00:00:00,2019-12-24,,ND,8.359999656677246,8.949999809265137,8.470000267028809,5.809999942779541,6.900000095367432,5.940000057220459,7.400000095367432,8.220000267028809,8.0600004196167,7.800000190734863,9.350000381469728,12.06999969482422,13.800000190734863,,,0,0,0,0,0,1,0,0,0,0,0,0,0,0,0,1,0,0,0,0,0,0,0,0,1,0,0,0,0,0,0,1,0,0,0
152,"TWITTER, INC.",TWTR,,,2019-12-21,,ND,32.130001068115234,34.09000015258789,39.04999923706055,23.950000762939453,27.01000022888184,32.22999954223633,33.40999984741211,37.060001373291016,38.959999084472656,39.900001525878906,46.34999847412109,44.68000030517578,54.63999938964844,35.0,33.5,4,0,0,0,1,0,0,0,1,0,0,0,0,0,0,0,0,0,0,0,0,0,0,0,1,0,0,0,0,0,0,0,0,0,1
153,Unum Group,UNM,10/1/2019 - 10/10/2019,2019-10-10 00:00:00,2019-12-20,2927,Name | Address | SSN | Other,29.34000015258789,29.3700008392334,29.700000762939453,10.81999969482422,15.149999618530272,14.470000267028809,16.479999542236328,17.09000015258789,18.21999931335449,18.26000022888184,18.450000762939453,21.440000534057617,21.6299991607666,32.0,31.0,4,0,0,0,0,1,0,0,0,0,0,0,0,0,0,1,0,0,0,1,0,0,0,0,0,0,0,0,0,0,0,0,1,0,0
154,HONDA MOTOR CO LTD,HMC,12/4/2019 - 12/12/2019,2019-12-12 00:00:00,2019-12-18,,Name | Address |Phone Number | Address | Other,29.18000030517578,27.780000686645508,27.049999237060547,21.280000686645508,22.6299991607666,23.8700008392334,27.21999931335449,26.229999542236328,25.739999771118164,24.93000030517578,24.239999771118164,29.190000534057617,29.31999969482422,,,0,0,0,0,0,1,0,0,0,1,0,0,0,0,0,0,0,0,0,0,1,0,0,0,0,0,0,0,1,0,0,0,0,0,0
155,NOVO NORDISK A S,NVO,,,2019-12-13,,ND,56.5,58.970001220703125,63.34000015258789,53.41999816894531,58.84000015258789,62.540000915527344,64.61000061035156,65.1500015258789,67.08999633789062,66.44999694824219,73.62000274658203,68.22000122070312,69.54000091552734,,,0,0,0,0,1,0,0,0,0,0,1,0,0,0,0,0,0,0,0,0,1,0,0,0,0,0,0,0,1,0,0,0,0,0,0
156,AT&T INC.,T,2019-12-02 00:00:00,2019-12-02 00:00:00,2019-12-11,,Name | Email | Phone Number | Address | Credit Card,38.060001373291016,38.56999969482422,38.34000015258789,35.849998474121094,30.729999542236328,29.3799991607666,32.13999938964844,30.1299991607666,30.200000762939453,28.90999984741211,28.31999969482422,28.850000381469727,30.690000534057617,29.875,29.875,2,1,0,0,0,0,0,0,1,0,0,0,0,0,0,0,0,0,0,0,0,0,0,0,0,1,0,0,0,0,0,0,0,1,0
157,"BIO-RAD LABORATORIES, INC.",BIO,,2019-12-05 00:00:00,2019-12-06,,ND,369.0199890136719,372.0299987792969,371.1900024414063,386.6799926757813,381.2900085449219,443.0,452.5199890136719,465.4599914550781,527.2999877929688,484.2300109863281,530.6599731445312,630.5700073242188,559.4000244140625,,,0,0,0,0,1,0,0,0,0,0,0,0,1,0,0,0,0,0,0,0,1,0,0,0,0,0,0,0,0,0,0,0,0,0,1
158,StoneX Group Inc.,SNEX,,2019-05-08 00:00:00,2019-12-06,,Name | Address | SSN | Other,41.27000045776367,48.52000045776367,49.11000061035156,43.58000183105469,36.25,39.54999923706055,56.09000015258789,59.220001220703125,56.52999877929688,55.77000045776367,52.41999816894531,56.04999923706055,64.19999694824219,,,0,0,0,0,0,1,0,0,0,0,0,1,0,0,0,0,0,0,0,1,0,0,0,0,0,0,0,0,0,1,0,0,0,0,0
159,MAGELLAN HEALTH INC,MGLN,2019-05-28 00:00:00,2019-07-05 00:00:00,2019-12-04,,Name | SSN | Other,78.5,75.97000122070312,71.69000244140625,56.02999877929688,41.72999954223633,62.4900016784668,73.12999725341797,73.0,72.5999984741211,74.86000061035156,77.83000183105469,76.29000091552734,77.66999816894531,,,0,0,0,0,0,1,0,0,0,0,0,1,0,0,0,0,0,0,0,0,0,0,0,0,1,0,0,0,0,0,0,0,0,1,0
160,"Primerica, Inc.",PRI,,,2019-12-04,,ND,130.47999572753906,131.7100067138672,121.11000061035156,113.0199966430664,80.69000244140625,101.62000274658205,117.83000183105467,113.11000061035156,121.48999786376952,125.5199966430664,112.66999816894533,113.44000244140624,135.0800018310547,,,0,0,0,0,0,1,0,0,0,0,1,0,0,0,0,0,0,0,0,1,0,0,0,0,0,0,0,0,0,0,0,0,1,0,0
161,CHOICE HOTELS INTERNATIONAL INC /DE,CHH,6/1/2015 - 11/12/2019,2019-11-12 00:00:00,2019-11-29,88295,Name | Email | Credit Card | Other,97.25,104.8499984741211,100.2300033569336,91.27999877929688,63.81999969482422,74.56999969482422,81.87000274658203,78.4000015258789,84.3499984741211,101.19000244140624,88.31999969482422,84.05000305175781,102.4499969482422,99.0,98.0,3,1,0,0,0,0,0,0,0,1,0,0,0,0,0,0,0,0,0,0,0,0,0,0,1,0,0,0,0,1,0,0,0,0,0
162,Palo Alto Networks Inc,PANW,,,2019-11-28,7,Name | SSN | Other,222.2700042724609,233.2700042724609,237.8500061035156,187.55999755859372,162.5399932861328,196.8800048828125,231.7899932861328,225.38999938964844,247.66000366210935,255.3699951171875,245.94000244140625,231.5399932861328,295.3099975585937,,,0,0,0,0,0,1,0,0,0,1,0,0,0,0,0,0,0,0,0,0,1,0,0,0,0,0,0,0,0,0,0,0,0,0,1
163,ADOBE INC.,ADBE,,2019-11-21 00:00:00,2019-11-28,,Email | Address | Phone Number | Other,309.0599975585937,330.7900085449219,346.8999938964844,337.5199890136719,305.8299865722656,348.5,375.1700134277344,426.9200134277344,437.1000061035156,510.3200073242188,488.510009765625,478.55999755859375,477.0299987792969,350.0,343.3809523809524,21,0,0,0,0,1,0,0,0,0,1,0,0,0,0,0,0,0,0,0,0,0,0,0,1,0,0,0,0,0,0,0,0,0,1
164,UNITED PARCEL SERVICE INC,UPS,10/11/2019 - 10/22/2019,,2019-11-27,6400,Name | Other,121.1999969482422,119.04000091552734,114.91999816894533,93.7300033569336,99.77999877929688,102.5500030517578,97.06999969482422,107.31999969482422,121.01000213623048,158.89999389648438,166.1199951171875,168.0,170.5,128.0,121.6,5,0,0,0,0,1,0,0,0,0,0,0,0,0,0,1,0,0,0,0,0,0,0,0,0,1,0,0,0,0,0,0,1,0,0
165,"T-Mobile US, Inc.",TMUS,,Early November 2019,2019-11-21,,Name | Address | Phone Number | Other,77.63999938964844,77.4000015258789,82.02999877929688,99.5,74.55000305175781,89.94000244140625,98.13999938964844,106.9000015258789,106.13999938964844,115.4000015258789,110.56999969482422,113.06999969482422,129.67999267578125,101.0,102.0,3,0,0,0,0,1,0,0,0,0,1,0,0,0,0,0,0,0,0,0,0,0,0,0,0,1,0,0,0,0,0,0,0,1,0
166,Ingredion Inc,INGR,,,2019-11-19,,ND,82.9000015258789,89.9800033569336,92.58000183105467,96.33999633789062,60.79999923706055,80.69000244140625,79.98999786376953,86.18000030517578,85.61000061035156,79.08000183105469,81.30999755859375,78.55999755859375,76.7699966430664,,,0,0,0,0,0,1,0,0,1,0,0,0,0,0,0,0,0,0,0,0,1,0,0,0,0,0,0,0,0,0,1,0,0,0,0
167,"Wayside Technology Group, Inc.",WSTG,,2019-06-20 00:00:00,2019-11-15,1228,Name | SSN | Bank Account | Other,13.970000267028809,15.75,16.18000030517578,15.25,13.75,14.239999771118164,18.399999618530277,23.649999618530277,23.51000022888184,22.100000381469727,25.09000015258789,23.190000534057617,20.31999969482422,,,0,1,0,0,0,0,0,0,0,0,0,0,0,0,0,1,0,0,0,0,0,0,0,0,0,0,1,0,0,1,0,0,0,0,0
168,US XPRESS ENTERPRISES INC,USX,Jul-2019,2019-08-08 00:00:00,2019-11-14,400,Name | SSN | Other,4.980000019073486,4.949999809265137,5.389999866485596,6.300000190734863,3.559999942779541,3.630000114440918,3.569999933242798,5.429999828338623,6.150000095367432,10.6899995803833,8.149999618530273,10.350000381469728,7.760000228881836,6.0,6.0,1,0,0,0,0,1,0,0,0,0,0,1,0,0,0,0,0,0,0,0,0,0,0,0,0,1,0,0,0,0,0,0,1,0,0
169,"Macy's, Inc.",M,10/7/2019 - 10/15/2019,2019-10-15 00:00:00,2019-11-14,135152,Name | Phone Number | Address | Credit Card | Other,16.06999969482422,15.18000030517578,17.8799991607666,16.739999771118164,8.029999732971191,6.159999847412109,5.019999980926514,7.300000190734863,6.570000171661377,6.96999979019165,7.199999809265137,6.130000114440918,7.360000133514404,15.5,17.75,12,1,0,0,0,0,0,0,1,0,0,0,0,0,0,0,0,0,0,0,0,0,0,1,0,0,0,0,0,1,0,0,0,0,0
170,"HASBRO, INC.",HAS,,2019-11-14 00:00:00,2019-11-14,452000,Name | Email | Password,94.0,103.91999816894533,104.86000061035156,96.98999786376952,55.02000045776367,74.22000122070312,62.84000015258789,74.30000305175781,73.61000061035156,78.94000244140625,77.18000030517578,86.88999938964844,87.72000122070312,163.0,153.6,5,0,0,0,0,1,0,0,0,1,0,0,0,0,0,0,0,0,0,0,1,0,0,0,0,0,0,0,0,0,0,1,0,0,0
171,"HELIUS MEDICAL TECHNOLOGIES, INC.",HSDT,,Oct-19,2019-11-12,,ND,36.71500015258789,16.135000228881836,33.25,34.82500076293945,18.899999618530277,9.204999923706056,14.875,16.344999313354492,16.800016403198242,18.445018768310547,14.7000150680542,15.155014991760254,14.699999809265137,,,0,0,0,0,1,0,0,0,0,0,0,1,0,0,0,0,0,0,0,0,1,0,0,0,0,0,0,0,0,1,0,0,0,0,0
172,"T2 Biosystems, Inc.",TTOO,,,2019-11-12,,ND,2.700000047683716,1.190000057220459,1.1799999475479126,0.8190000057220459,0.4950000047683716,0.4860000014305115,0.550000011920929,1.3899999856948853,1.3799999952316284,1.870000004768372,1.3200000524520874,1.3600000143051147,1.2000000476837158,3.0,3.0,3,0,0,0,1,0,0,0,0,0,0,0,1,0,0,0,0,0,0,0,1,0,0,0,0,0,0,0,0,0,0,1,0,0,0
173,"GOLDEN ENTERTAINMENT, INC.",GDEN,5/30/2019 - 7/31/2019,2019-10-08 00:00:00,2019-11-07,5815,Name | SSN | Bank Accounting | Other,15.329999923706056,18.170000076293945,19.18000030517578,19.600000381469727,12.270000457763672,6.239999771118164,7.340000152587891,13.880000114440918,8.90999984741211,10.489999771118164,13.229999542236328,13.779999732971191,16.170000076293945,23.0,21.666666666666668,3,1,0,0,0,0,0,0,0,0,0,1,0,0,0,0,0,0,0,0,0,0,0,0,1,0,0,0,0,0,0,0,0,0,1
174,"ICHOR HOLDINGS, LTD.",ICHR,,,2019-11-06,,ND,31.440000534057617,30.950000762939453,32.56999969482422,35.689998626708984,29.65999984741211,20.225000381469727,22.3700008392334,26.489999771118164,27.709999084472656,32.0,23.43000030517578,22.809999465942383,27.36000061035156,37.0,37.66666666666666,3,0,0,0,1,0,0,0,0,0,0,1,0,0,0,0,0,0,0,0,1,0,0,0,0,0,0,0,0,0,0,0,0,0,1
175,HESKA CORP,HSKA,,,2019-11-06,,ND,94.3000030517578,94.45999908447266,95.66000366210938,100.58000183105467,95.37000274658205,56.02999877929688,69.7300033569336,91.02999877929688,92.16999816894533,107.61000061035156,97.69000244140624,98.58000183105467,121.91000366210938,121.1,121.1,2,0,0,0,1,0,0,0,0,0,1,0,0,0,0,0,0,0,0,0,1,0,0,0,0,0,0,0,0,0,0,0,0,0,1
176,MARRIOTT INTERNATIONAL INC /MD/,MAR,,2019-09-04 00:00:00,2019-10-30,2589,Name | Address | SSN,126.52999877929688,140.36000061035156,151.8699951171875,142.61000061035156,124.0,76.16000366210938,95.98999786376952,88.5,86.5999984741211,87.13999938964844,106.26000213623048,93.22000122070312,93.33000183105467,133.0,139.33333333333334,9,0,0,0,0,1,0,0,0,0,0,0,0,0,0,1,0,0,0,0,0,0,0,0,1,0,0,0,0,1,0,0,0,0,0
177,PRICE T ROWE GROUP INC,TROW,,2019-10-06 00:00:00,2019-10-29,,Name | Email | Phone Number | SSN | Other,117.08000183105467,123.70999908447266,122.81999969482422,131.3000030517578,118.01000213623048,98.43000030517578,113.88999938964844,120.66000366210938,120.81999969482422,133.92999267578125,139.11000061035156,128.5500030517578,137.13999938964844,131.0,131.0,2,0,0,0,0,1,0,0,0,1,0,0,0,0,0,0,0,0,0,1,0,0,0,0,0,0,0,0,0,1,0,0,0,0,0
178,BED BATH & BEYOND INC,BBBY,9/4/2019 - 9/27/2019,,2019-10-29,346,Email | Password,14.779999732971191,14.65999984741211,17.079999923706055,16.1200008392334,10.8100004196167,4.650000095367432,6.650000095367432,7.46999979019165,10.81999969482422,10.350000381469728,12.09000015258789,14.880000114440918,21.100000381469727,,,0,0,0,0,0,1,0,0,0,0,0,0,0,0,0,1,0,0,0,0,0,0,0,1,0,0,0,0,0,1,0,0,0,0,0
179,ADOBE INC.,ADBE,,2019-10-19 00:00:00,2019-10-25,7500000,Email | Other,269.70001220703125,305.2799987792969,329.6400146484375,351.3699951171875,357.4100036621094,310.0,344.1000061035156,385.260009765625,431.6799926757813,430.30999755859375,476.2999877929688,467.6700134277344,488.5,330.0,324.55555555555554,9,0,0,0,0,1,0,0,0,0,0,0,0,0,0,1,0,0,0,0,0,0,0,0,1,0,0,0,0,0,0,0,0,0,1
180,HENRY JACK & ASSOCIATES INC,JKHY,,,2019-10-24,,ND,138.49000549316406,149.4499969482422,146.32000732421875,152.41000366210938,167.92999267578125,129.61000061035156,156.1999969482422,186.9199981689453,182.1199951171875,181.7700042724609,164.72999572753906,159.41000366210938,158.30999755859375,152.5,152.5,2,0,0,0,0,1,0,0,0,0,0,0,0,0,0,1,0,0,0,0,0,0,0,0,1,0,0,0,0,0,0,0,1,0,0
181,PATRICK INDUSTRIES INC,PATK,,,2019-10-24,,ND,46.27000045776367,49.97999954223633,53.13999938964844,54.59999847412109,59.77999877929688,20.149999618530277,31.93000030517578,53.31999969482422,60.97999954223633,64.91999816894531,62.52000045776367,52.790000915527344,57.09999847412109,54.0,57.333333333333336,3,0,0,0,1,0,0,0,1,0,0,0,0,0,0,0,0,0,0,0,1,0,0,0,0,0,0,0,0,0,1,0,0,0,0
182,FERRO CORP,FOE,5/29/2019 - 8/19/2019,,2019-10-23,,ND,11.270000457763672,12.710000038146973,15.0,14.350000381469728,14.670000076293944,8.229999542236328,8.930000305175781,11.779999732971191,11.460000038146973,12.010000228881836,12.539999961853027,11.649999618530272,13.670000076293944,15.0,14.666666666666666,3,0,0,0,0,1,0,0,0,0,0,1,0,0,0,0,0,0,0,0,1,0,0,0,0,0,0,0,0,0,1,0,0,0,0
183,TETRAPHASE PHARMACEUTICALS INC,,,,2019-10-22,,ND,14.050000190734863,13.93000030517578,14.199999809265137,14.399999618530272,14.550000190734863,11.420000076293944,12.9399995803833,12.90999984741211,13.380000114440918,13.68000030517578,13.920000076293944,13.609999656677246,13.6899995803833,,,0,0,0,0,1,0,0,0,0,0,1,0,0,0,0,0,0,0,0,0,1,0,0,0,0,0,0,0,0,0,0,1,0,0,0
184,"Lumen Technologies, Inc.",LUMN,11/17/2018 - 9/17/2019,2019-09-15 00:00:00,2019-10-18,2800000,Name | Address | Email | Phone Number,10.100000381469728,10.100000381469728,10.100000381469728,10.100000381469728,10.100000381469728,10.100000381469728,10.25,9.6899995803833,10.220000267028809,9.800000190734863,10.800000190734863,11.0,9.859999656677246,,,0,0,0,0,0,1,0,0,0,1,0,0,0,0,0,0,0,0,0,0,0,0,0,0,0,1,0,0,0,0,0,0,1,0,0
185,Tribune Publishing Co,TPCO,,,2019-10-18,3476,ND,8.130000114440918,9.5600004196167,13.210000038146973,13.029999732971191,12.899999618530272,6.260000228881836,7.880000114440918,9.380000114440918,9.8100004196167,10.050000190734863,10.920000076293944,12.199999809265137,12.800000190734863,12.5,12.5,1,0,0,0,1,0,0,0,0,0,1,0,0,0,0,0,0,0,0,0,1,0,0,0,0,0,0,0,0,0,1,0,0,0,0
186,Ingredion Inc,INGR,,,2019-10-15,,ND,80.19999694824219,83.31999969482422,87.69000244140625,92.0,97.33999633789062,73.1500015258789,81.55000305175781,78.1500015258789,83.0199966430664,82.75,81.6500015258789,80.16000366210938,78.05999755859375,90.5,90.5,2,0,0,0,1,0,0,0,1,0,0,0,0,0,0,0,0,0,0,0,1,0,0,0,0,0,0,0,0,0,1,0,0,0,0
187,PITNEY BOWES INC /DE/,PBI,2019-10-12 00:00:00,,2019-10-14,,ND,4.460000038146973,4.920000076293945,4.239999771118164,3.950000047683716,3.940000057220459,2.640000104904175,2.2100000381469727,2.200000047683716,2.759999990463257,2.490000009536743,6.110000133514404,5.559999942779541,6.010000228881836,6.0,6.0,2,0,0,0,1,0,0,0,1,0,0,0,0,0,0,0,0,0,0,0,1,0,0,0,0,0,0,0,0,0,0,1,0,0,0
188,WHIRLPOOL CORP /DE/,WHR,,,2019-10-12,28151181,Other,158.22000122070312,155.94000244140625,146.1999969482422,149.67999267578125,151.97999572753906,110.48999786376952,104.75,108.66999816894533,122.4800033569336,135.63999938964844,176.3300018310547,172.8000030517578,200.91000366210935,142.0,148.75,4,0,0,0,0,1,0,0,0,1,0,0,0,0,0,0,0,0,0,0,1,0,0,0,0,0,0,0,0,0,1,0,0,0,0
189,Walmart Inc.,WMT,7/5/2019 - 8/26/2019,2019-09-12 00:00:00,2019-10-11,,Name | Address | Phone Number | Email | Bank Account | SSN | Other,119.61000061035156,119.04000091552734,119.13999938964844,116.37999725341795,115.25,119.79000091552734,121.8000030517578,123.66999816894533,121.16000366210938,130.67999267578125,131.8800048828125,136.80999755859375,142.77999877929688,130.0,131.57142857142858,7,1,0,0,0,0,0,0,0,0,0,0,0,0,0,1,0,0,0,0,0,0,0,1,0,0,0,0,0,0,0,0,1,0,0
190,Aptevo Therapeutics Inc.,APVO,,2019-09-13 00:00:00,2019-10-10,,Name | Address | SSN,7.980000019073486,9.170000076293944,8.581999778747559,9.477999687194824,7.027999877929688,4.760000228881836,3.839999914169312,6.289999961853027,6.440000057220459,8.40999984741211,8.279999732971191,7.760000228881836,7.170000076293945,,,0,0,0,0,0,1,0,0,0,0,0,0,0,0,0,1,0,0,0,0,1,0,0,0,0,0,0,0,0,0,0,0,0,0,1
191,TransUnion,TRU,,,2019-10-09,37000,Name | Addres | Other,79.16000366210938,80.62000274658203,85.33999633789062,90.0199966430664,94.93000030517578,81.41000366210938,69.5,79.11000061035156,93.11000061035156,87.02999877929688,87.37999725341797,83.0199966430664,88.54000091552734,83.0,77.95333333333333,15,0,0,0,0,1,0,0,0,0,0,0,0,0,0,1,0,0,0,0,0,0,0,0,1,0,0,0,0,0,1,0,0,0,0
192,Cronos Group Inc.,CRON,,,2019-10-07,,ND,8.869999885559082,8.329999923706055,6.710000038146973,6.789999961853027,7.010000228881836,5.809999942779541,5.769999980926514,5.570000171661377,6.599999904632568,6.449999809265137,5.869999885559082,5.389999866485596,5.039999961853027,14.0,13.887200000000002,10,0,0,0,0,1,0,0,0,0,1,0,0,0,0,0,0,0,0,0,1,0,0,0,0,0,0,1,0,0,0,0,0,0,0
193,ELECTRONIC ARTS INC.,EA,2019-10-03 00:00:00,2019-10-03 00:00:00,2019-10-03,1600,ND,94.25,95.3000030517578,100.4000015258789,107.33999633789062,105.04000091552734,106.88999938964844,102.29000091552734,113.2699966430664,122.36000061035156,133.83999633789062,142.36000061035156,139.55999755859375,129.07000732421875,110.0,106.75,16,0,0,0,0,1,0,0,0,1,0,0,0,0,0,0,0,0,0,0,0,0,0,0,1,0,0,0,0,0,0,0,0,0,1
194,"Zendesk, Inc.",ZEN,2016-11-01 00:00:00,2019-09-24 00:00:00,2019-10-02,22000,Email | Name | Phone Number | Password (Hashed),72.70999908447266,72.2300033569336,74.6500015258789,76.62999725341797,86.4000015258789,78.47000122070312,62.4900016784668,72.55000305175781,87.55999755859375,89.23999786376953,91.1500015258789,103.0999984741211,104.36000061035156,95.0,91.54545454545456,11,0,0,0,0,1,0,0,0,0,0,0,0,0,0,1,0,0,0,0,0,0,0,0,1,0,0,0,0,0,0,0,0,0,1
195,PAR TECHNOLOGY CORP,PAR,4/19/2019 - 6/20/2019,2019-05-31 00:00:00,2019-09-19,918,Name | SSN | Bank Account,24.6299991607666,22.709999084472656,30.920000076293945,30.309999465942383,30.149999618530277,31.530000686645508,10.720000267028809,15.029999732971191,24.88999938964844,30.190000534057617,28.71999931335449,34.880001068115234,43.27000045776367,3.503,3.503,1,1,0,0,0,0,0,0,0,0,0,0,0,0,0,1,0,0,0,0,1,0,0,0,0,0,0,0,0,1,0,0,0,0,0
196,"CHEGG, INC",CHGG,Apr-2018,,2019-09-19,40000000,Name | Email | Address | Password (Encrypted),34.25,32.369998931884766,36.88999938964844,38.4900016784668,43.33000183105469,40.720001220703125,27.709999084472656,36.75,62.20000076293945,63.11000061035156,73.0,78.22000122070312,64.0999984741211,35.0,35.0,1,0,0,0,0,1,0,0,0,0,0,0,0,0,0,1,0,0,0,0,0,0,0,0,1,0,0,0,0,0,0,0,0,0,1
197,MAGELLAN HEALTH INC,MGLN,5/28/2019,2019-07-05 00:00:00,2019-09-17,589,Name | SSN,63.220001220703125,61.20000076293945,72.5999984741211,77.25,77.91000366210938,72.79000091552734,38.7599983215332,51.79999923706055,68.5999984741211,73.30000305175781,75.62999725341797,75.73999786376953,75.37000274658203,65.0,65.0,1,0,0,0,0,1,0,0,0,0,0,1,0,0,0,0,0,0,0,0,0,0,0,0,1,0,0,0,0,0,0,0,0,1,0
198,MAGELLAN HEALTH INC,MGLN,6/6/2019,2019-07-12 00:00:00,2019-09-17,55637,Name | SSN,63.220001220703125,61.20000076293945,72.5999984741211,77.25,77.91000366210938,72.79000091552734,38.7599983215332,51.79999923706055,68.5999984741211,73.30000305175781,75.62999725341797,75.73999786376953,75.37000274658203,65.0,65.0,1,0,0,0,0,1,0,0,0,0,0,1,0,0,0,0,0,0,0,0,0,0,0,0,1,0,0,0,0,0,0,0,0,1,0
199,Park Hotels & Resorts Inc.,PK,,2019-07-30 00:00:00,2019-09-16,469,Name | Address | SSN | Bank Account | Credit Card | Other,26.11000061035156,23.350000381469727,22.6200008392334,24.940000534057617,24.559999465942383,23.6299991607666,6.889999866485596,7.900000095367432,7.309999942779541,11.550000190734863,10.15999984741211,9.460000038146973,11.15999984741211,28.5,27.5,6,1,0,0,0,0,0,0,0,0,0,1,0,0,0,0,0,0,0,0,0,0,0,0,1,0,0,0,0,1,0,0,0,0,0
200,BERKSHIRE HATHAWAY INC,BRK.A,2019-08-12 00:00:00,,2019-09-16,837,ND,315807.0,314250.0,329405.0,340380.0,342550.0,340224.0,268000.0,283750.0,253501.0,271956.0,285520.0,316251.0,328804.0,333100.0,333100.0,1,0,0,0,0,1,0,0,0,0,1,0,0,0,0,0,0,0,0,1,0,0,0,0,0,0,0,0,0,0,1,0,0,0,0
201,"Forterra, Inc.",FRTA,,2019-07-30 00:00:00,2019-09-13,18,Name | Address | Other,7.28000020980835,7.590000152587891,11.029999732971191,10.56999969482422,12.0,14.130000114440918,7.320000171661377,6.559999942779541,7.840000152587891,9.109999656677246,10.795000076293944,15.510000228881836,16.469999313354492,,,0,0,0,0,0,1,0,0,0,0,0,0,0,0,0,1,0,0,0,0,1,0,0,0,0,0,0,0,0,0,0,0,0,1,0
202,ZYNGA INC,ZNGA,,2019-08-31 00:00:00,2019-09-12,218000000,Username | Password,5.760000228881836,6.139999866485596,6.309999942779541,6.139999866485596,6.619999885559082,6.739999771118164,6.690000057220459,6.909999847412109,7.940000057220459,9.18000030517578,10.380000114440918,9.010000228881836,8.350000381469727,8.0,8.0,1,0,0,0,0,1,0,0,0,0,1,0,0,0,0,0,0,0,0,0,0,0,0,0,1,0,0,0,0,0,0,0,0,0,1
203,"Cornerstone Building Brands, Inc.",CNR,4/1/2019 - 4/2/2019,2019-06-26 00:00:00,2019-09-11,7213,ND,4.989999771118164,6.159999847412109,6.78000020980835,7.869999885559082,8.380000114440918,8.949999809265137,6.119999885559082,4.690000057220459,4.769999980926514,6.099999904632568,4.940000057220459,7.239999771118164,7.570000171661377,123.7235,117.37058333333334,12,0,0,0,0,1,0,0,0,0,0,0,0,0,0,1,0,0,0,0,1,0,0,0,0,0,0,0,0,0,0,0,1,0,0
204,Brixmor Property Group Inc.,BRX,2019-05-26 00:00:00,,2019-09-09,,Name | Other,19.51000022888184,20.440000534057617,21.56999969482422,21.8799991607666,20.459999084472656,20.8799991607666,16.5,9.760000228881836,11.359999656677246,16.040000915527344,12.25,12.18000030517578,12.68000030517578,21.25,21.25,6,0,0,0,0,1,0,0,0,0,0,0,0,0,0,1,0,0,0,1,0,0,0,0,0,0,0,0,0,1,0,0,0,0,0
205,CHASE CORP,CCF,,,2019-09-06,,Name | Other,101.37000274658205,104.56999969482422,123.9800033569336,120.25,111.38999938964844,100.01000213623048,87.16999816894531,83.80000305175781,90.97000122070312,107.5999984741211,101.73999786376952,101.76000213623048,99.44000244140624,,,0,0,0,0,0,1,0,0,0,1,0,0,0,0,0,0,0,0,0,0,1,0,0,0,0,0,0,0,0,0,0,1,0,0,0
206,MGM Resorts International,MGM,2019-07-07 00:00:00,,2019-09-04,46542,Name | Address | Phone Number | Other,27.09000015258789,27.25,29.770000457763672,31.6200008392334,33.290000915527344,31.209999084472656,23.299999237060547,10.579999923706056,14.779999732971191,20.26000022888184,16.860000610351562,16.31999969482422,23.06999969482422,35.0,32.38857142857143,7,0,0,0,0,1,0,0,0,0,0,0,0,0,0,1,0,0,0,0,0,0,0,0,1,0,0,0,0,0,0,0,0,0,1
207,ENTERCOM COMMUNICATIONS CORP,ETM,,,2019-09-04,,ND,3.400000095367432,3.200000047683716,3.5899999141693115,4.78000020980835,4.559999942779541,4.269999980926514,3.5,0.8299999833106995,1.0399999618530271,1.8899999856948853,1.5399999618530271,1.4299999475479126,1.5,4.0,4.0,1,0,0,0,1,0,0,0,1,0,0,0,0,0,0,0,0,0,0,0,0,0,0,0,0,1,0,0,0,1,0,0,0,0,0
208,DELUXE CORP,DLX,,,2019-08-29,153,ND,44.41999816894531,48.880001068115234,53.75,52.15999984741211,50.06999969482422,48.619998931884766,33.29999923706055,25.209999084472656,28.82999992370605,25.559999465942383,24.049999237060547,20.729999542236328,29.350000381469727,7.75,7.75,2,0,0,0,0,1,0,0,0,0,1,0,0,0,0,0,0,0,0,0,1,0,0,0,0,0,0,0,0,0,1,0,0,0,0
209,"Lumber Liquidators Holdings, Inc.",LL,,2019-08-21 00:00:00,2019-08-27,,ND,8.930000305175781,9.4399995803833,9.59000015258789,8.829999923706055,9.989999771118164,7.199999809265137,10.5,5.789999961853027,6.289999961853027,8.760000228881836,13.3100004196167,23.1200008392334,26.8799991607666,14.0,14.0,1,0,0,0,1,0,0,0,1,0,0,0,0,0,0,0,0,0,0,0,0,0,0,1,0,0,0,0,0,1,0,0,0,0,0
210,Mastercard Inc,MA,,2019-08-20 00:00:00,2019-08-22,89338,Name | Credit Card | Email | Address | Phone Number | Other,282.010009765625,271.1700134277344,274.29998779296875,284.45001220703125,298.57000732421875,321.92999267578125,339.70001220703125,211.4199981689453,245.3500061035156,294.260009765625,304.44000244140625,307.6000061035156,337.1000061035156,315.0,313.0,5,0,0,0,0,1,0,0,0,0,1,0,0,0,0,0,0,0,0,0,0,0,0,0,1,0,0,0,0,1,0,0,0,0,0
211,Helios & Matheson Analytics Inc.,HMNY,,,2019-08-20,161000000,Name | Address | Credit Card | Email,0.001700000022538,0.0024000001139938,0.003000000026077,0.0027000000700354,0.0026499999221414,0.0024500000290572,0.0003000000142492,0.0003000000142492,0.0001999999949475,0.001300000003539,0.0010000000474974,0.0006999999750405,0.0005499999970197,,,0,1,0,0,0,0,0,0,0,1,0,0,0,0,0,0,0,0,0,0,0,0,0,0,1,0,0,0,0,1,0,0,0,0,0
212,"Cable One, Inc.",CABO,2019-03-19 00:00:00,May-2019,2019-08-16,7375,Name | Address | SSN | Bank Account | Other,1242.4200439453125,1238.81005859375,1282.5400390625,1475.4599609375,1516.280029296875,1669.6099853515625,1774.0,1185.510009765625,1700.1400146484375,1835.239990234375,1737.969970703125,1776.1300048828125,1870.1700439453125,1441.0,1441.0,2,1,0,0,0,0,0,0,0,0,0,1,0,0,0,0,0,0,0,0,0,0,0,0,0,1,0,0,0,0,0,0,0,1,0
213,CHOICE HOTELS INTERNATIONAL INC /DE,CHH,2019-07-02 00:00:00,,2019-08-15,700000,Name | Email | Address | Phone Number,87.69999694824219,94.37999725341795,87.88999938964844,91.29000091552734,101.3499984741211,99.9000015258789,104.5999984741211,74.12999725341797,72.97000122070312,70.4000015258789,83.80000305175781,81.4000015258789,94.76000213623048,81.0,59.53333333333333,3,0,0,0,0,1,0,0,0,1,0,0,0,0,0,0,0,0,0,0,0,0,0,0,1,0,0,0,0,1,0,0,0,0,0
214,"AzurRx BioPharma, Inc.",AZRX,,2019-08-08 00:00:00,2019-08-13,,Money,0.9900000095367432,1.1299999952316284,0.488999992609024,0.6499999761581421,0.7889999747276306,1.690000057220459,0.9340000152587892,0.5120000243186951,0.6449999809265137,0.9100000262260436,0.9279999732971193,0.8389999866485596,1.1299999952316284,,,0,0,0,0,1,0,0,0,0,0,0,1,0,0,0,0,0,0,0,0,1,0,0,0,0,0,0,0,0,0,0,0,1,0,0
215,AMARIN CORP PLC\UK,AMRN,5/2/2019 - 6/20/2019,2019-06-20 00:00:00,2019-08-05,78000,Name | Address | Email | Phone Number | Other,16.799999237060547,16.139999389648438,14.369999885559082,17.450000762939453,22.780000686645508,20.950000762939453,18.82999992370605,16.020000457763672,4.78000020980835,7.619999885559082,6.760000228881836,6.920000076293945,7.03000020980835,26.0,26.0,1,0,0,0,0,1,0,0,0,1,0,0,0,0,0,0,0,0,0,0,1,0,0,0,0,0,0,0,1,0,0,0,0,0,0
216,Atlassian Corp Plc,TEAM,,,2019-08-02,,ND,143.9199981689453,134.50999450683594,124.2699966430664,122.36000061035156,120.83999633789062,120.33999633789062,147.0,146.82000732421875,134.0500030517578,154.58999633789062,188.32000732421875,185.6100006103516,176.64999389648438,,,0,0,0,0,0,1,0,0,0,1,0,0,0,0,0,0,0,0,0,0,0,0,0,0,1,0,0,0,0,0,0,0,0,0,1
217,Covia Holdings Corp,,2019-04-12 00:00:00,,2019-08-01,5151,ND,14.119999885559082,14.25,14.260000228881836,14.06999969482422,14.1899995803833,14.199999809265137,14.489999771118164,14.43000030517578,13.130000114440918,12.609999656677246,13.460000038146973,13.489999771118164,14.149999618530272,,,0,0,0,0,0,1,0,0,0,0,1,0,0,0,0,0,0,0,0,0,0,1,0,0,0,0,0,0,0,0,1,0,0,0,0
218,HONDA MOTOR CO LTD,HMC,7/4/2019 - 7/6/2019,2019-07-06 00:00:00,2019-07-31,,Name | Email | Other,25.31999969482422,23.65999984741211,26.07999992370605,27.420000076293945,28.1200008392334,28.270000457763672,26.40999984741211,25.65999984741211,23.40999984741211,24.049999237060547,26.049999237060547,25.559999465942383,25.309999465942383,27.633,27.633,2,0,0,0,0,1,0,0,0,1,0,0,0,0,0,0,0,0,0,0,1,0,0,0,0,0,0,0,1,0,0,0,0,0,0
219,PEARSON PLC,PSO,2018-11-01 00:00:00,Mar-2019,2019-07-31,,Name | Email,10.84000015258789,10.09000015258789,9.039999961853027,8.84000015258789,8.359999656677246,8.460000038146973,7.409999847412109,7.199999809265137,7.010000228881836,5.860000133514404,5.800000190734863,7.230000019073486,7.130000114440918,,,0,0,0,0,0,1,0,0,0,0,1,0,0,0,0,0,0,0,0,0,1,0,0,0,0,0,0,0,1,0,0,0,0,0,0
220,CORVEL CORP,CRVL,,,2019-07-30,,ND,93.0,86.08999633789062,75.69999694824219,79.52999877929688,82.51000213623047,87.20999908447266,93.51000213623048,68.94000244140625,55.0099983215332,54.52999877929688,67.88999938964844,72.55000305175781,79.06999969482422,,,0,0,0,1,0,0,0,0,0,0,1,0,0,0,0,0,0,0,0,1,0,0,0,0,0,0,0,0,0,0,0,0,0,0,1
221,CAPITAL ONE FINANCIAL CORP,COF,2019-03-22 00:00:00,2019-07-19 00:00:00,2019-07-29,114385,Name | Address | Phone Number | Email | SSN|Bank Account | Other,96.91999816894533,84.58999633789062,91.33999633789062,95.16999816894533,100.25,103.0,102.04000091552734,88.26000213623047,55.29999923706055,63.75,68.54000091552734,62.380001068115234,64.0999984741211,99.0,67.51666666666667,3,1,0,0,0,0,1,0,0,0,0,0,0,0,0,0,0,0,0,1,0,0,0,0,0,0,0,0,0,1,0,0,0,0,0
222,"ZIONS BANCORPORATION, NATIONAL ASSOCIATION /UT/",ZION,,2019-06-01 00:00:00,2019-07-27,,Name | Email | Bank Account,45.15999984741211,40.20000076293945,43.959999084472656,47.95000076293945,49.65999984741211,51.65999984741211,46.459999084472656,41.81999969482422,27.3700008392334,30.790000915527344,32.93000030517578,32.290000915527344,32.40999984741211,45.0,46.0,5,1,0,0,0,0,0,0,0,0,0,0,0,0,0,1,0,0,0,1,0,0,0,0,0,0,0,0,0,0,0,0,0,0,1
223,"Fossil Group, Inc.",FOSL,5/14/2019 - 6/18/2019,2019-06-18 00:00:00,2019-07-18,1393,Name | Address | Phone Number | Email | Credit Card,11.029999732971191,9.420000076293944,12.510000228881836,11.380000114440918,7.309999942779541,7.53000020980835,8.319999694824219,6.119999885559082,3.150000095367432,3.5,3.240000009536743,4.840000152587891,4.130000114440918,12.0,12.0,1,1,0,0,0,0,0,0,0,0,0,0,0,0,0,1,0,0,0,0,1,0,0,0,0,0,0,0,0,0,0,0,0,1,0
224,Medico International Inc.,,,2019-06-21 00:00:00,2019-07-17,14000,Name | Address | Bank Account | SSN | Other,13.989999771118164,14.149999618530272,13.720000267028809,14.119999885559082,13.989999771118164,14.0600004196167,14.329999923706056,14.5600004196167,12.270000457763672,13.039999961853027,12.779999732971191,13.359999656677246,13.520000457763672,,,0,1,0,0,0,0,0,0,0,1,0,0,0,0,0,0,0,0,0,0,0,0,0,0,1,0,0,0,0,0,0,0,0,0,1
225,SPRINT Corp,,6/8/2019 - 6/22/2019,2019-06-22 00:00:00,2019-07-16,1930,Name | Address | Phone Number | Other,13.979999542236328,14.210000038146973,13.720000267028809,14.15999984741211,13.989999771118164,14.0600004196167,14.350000381469728,14.5600004196167,12.270000457763672,13.15999984741211,12.779999732971191,13.3100004196167,13.529999732971191,,,0,0,0,0,0,1,0,0,0,0,0,0,0,0,0,1,0,0,0,0,0,0,0,0,0,1,0,0,0,0,1,0,0,0,0
226,TransUnion,TRU,Jul-2019,Jul-2019,2019-07-12,,Money,74.9800033569336,81.45999908447266,79.83000183105469,80.52999877929688,81.6500015258789,84.55000305175781,91.0199966430664,95.06999969482422,80.0,71.48999786376953,77.91000366210938,87.23999786376953,83.05000305175781,89.0,83.74285714285715,14,0,0,0,1,0,0,0,0,0,0,1,0,0,0,0,0,0,0,0,0,0,0,0,1,0,0,0,0,0,1,0,0,0,0
227,Bluegreen Vacations Holding Corp,BVH,3/26/2019 - 3/28/2019,2019-03-27 00:00:00,2019-07-03,980,Name | Address | SSN | Bank Account,22.799999237060547,20.100000381469727,20.700000762939453,23.549999237060547,23.049999237060547,22.25,22.950000762939453,19.850000381469727,17.700000762939453,10.550000190734863,9.399999618530272,9.850000381469728,11.899999618530272,,,0,1,0,0,0,0,0,0,1,0,0,0,0,0,0,0,0,0,0,1,0,0,0,0,0,0,0,0,0,0,0,0,1,0,0
228,INNOSPEC INC.,IOSP,2019-06-27 00:00:00,,2019-07-01,,ND,92.6500015258789,94.29000091552734,83.18000030517578,89.13999938964844,91.5500030517578,98.4000015258789,103.29000091552734,104.5500030517578,86.54000091552734,68.88999938964844,72.5199966430664,77.08999633789062,77.25,,,0,0,0,0,1,0,0,0,1,0,0,0,0,0,0,0,0,0,0,0,1,0,0,0,0,0,0,0,0,0,0,0,0,0,1
229,"TripAdvisor, Inc.",TRIP,,,2019-06-22,,Email | Password,47.29999923706055,44.59999847412109,38.52000045776367,39.130001068115234,37.790000915527344,28.059999465942383,30.059999465942383,30.489999771118164,28.290000915527344,15.84000015258789,17.360000610351562,19.479999542236328,18.18000030517578,,,0,0,0,0,0,1,0,0,0,0,1,0,0,0,0,0,0,0,0,0,0,0,0,0,1,0,0,0,0,0,0,1,0,0,0
230,"PCM, INC.",,,May-2019,2019-06-19,,ND,13.899999618530272,13.989999771118164,14.170000076293944,13.9399995803833,14.06999969482422,13.979999542236328,14.15999984741211,14.31999969482422,14.59000015258789,11.010000228881836,13.050000190734863,12.770000457763672,13.350000381469728,,,0,0,0,0,1,0,0,0,0,0,0,0,0,0,0,1,0,0,0,0,0,0,0,1,0,0,0,0,0,0,0,0,0,0,1
231,TECH DATA CORP,,6/2/2019 - 6/4/2019,2019-06-04 00:00:00,2019-06-19,,Bank Account | Username | Password (Clear) | Name | Email | Address | Phone Number | Other,13.899999618530272,13.989999771118164,14.170000076293944,13.9399995803833,14.06999969482422,13.979999542236328,14.15999984741211,14.31999969482422,14.59000015258789,11.010000228881836,13.050000190734863,12.770000457763672,13.350000381469728,,,0,1,0,0,0,0,0,0,0,1,0,0,0,0,0,0,0,0,0,0,0,0,0,0,0,0,1,0,0,0,0,0,1,0,0
232,"PayPal Holdings, Inc.",PYPL,,,2019-06-16,,Other,117.16000366210938,120.9000015258789,104.9499969482422,106.5199966430664,103.58999633789062,104.1999969482422,109.56999969482422,114.8499984741211,122.98999786376952,92.72000122070312,107.9499969482422,145.50999450683594,157.5500030517578,129.0,130.14285714285714,7,0,0,0,0,1,0,0,0,0,1,0,0,0,0,0,0,0,0,0,0,0,0,0,1,0,0,0,0,0,0,0,0,0,1
233,Liberty Media Corp,LSXMA,2/22/2019 - 4/15/2019,2019-04-15 00:00:00,2019-06-11,10000000,Name | Username | Password | Phone Number | Address,35.585052490234375,38.9478874206543,40.0,40.934120178222656,41.41592788696289,46.06686401367188,46.59783554077149,46.804325103759766,48.18092346191406,41.62241744995117,31.514257431030277,32.32054901123047,37.540000915527344,43.0,43.0,1,0,0,0,0,1,0,0,0,0,1,0,0,0,0,0,0,0,0,0,0,0,0,0,0,1,0,0,0,0,0,0,0,0,1
234,"AVALARA, INC.",AVLR,5/22/2019,2019-05-22 00:00:00,2019-06-07,,Name | SSN | Other,72.75,79.55999755859375,79.33000183105469,81.0999984741211,70.58000183105469,72.30000305175781,75.58999633789062,80.06999969482422,88.63999938964844,77.0999984741211,71.0,93.11000061035156,99.0999984741211,,,0,0,0,0,0,1,0,0,0,1,0,0,0,0,0,0,0,0,0,0,0,0,0,0,1,0,0,0,0,0,0,0,0,0,1
235,PRUDENTIAL PLC,PUK,2019-04-01 00:00:00,,2019-05-31,31170,Name | Address | Phone Number | Email | Other,40.880001068115234,44.540000915527344,41.959999084472656,33.38999938964844,36.38999938964844,40.540000915527344,35.47999954223633,37.77000045776367,36.33000183105469,33.08000183105469,24.739999771118164,28.26000022888184,25.68000030517578,,,0,0,0,0,0,1,0,0,0,0,0,0,0,0,0,1,0,0,0,1,0,0,0,0,0,0,0,0,1,0,0,0,0,0,0
236,MICROCHIP TECHNOLOGY INC,MCHP,,,2019-05-31,,ND,81.33999633789062,91.4000015258789,96.98999786376952,86.33000183105469,92.91000366210938,95.4000015258789,94.54000091552734,104.98999786376952,101.55999755859376,90.70999908447266,68.98999786376953,87.7300033569336,96.0199966430664,100.5,100.5,2,0,0,0,1,0,0,0,1,0,0,0,0,0,0,0,0,0,0,0,1,0,0,0,0,0,0,0,0,0,0,0,0,1,0
237,Xperi Corp,,3/11/2019 - 3/15/2019,,2019-05-31,502,Name | SSN | Other,13.65999984741211,13.93000030517578,14.09000015258789,14.25,14.260000228881836,13.979999542236328,14.1899995803833,14.199999809265137,14.510000228881836,14.43000030517578,13.0,12.609999656677246,13.449999809265137,,,0,0,0,0,0,1,0,0,0,0,0,0,0,0,0,1,0,0,0,0,1,0,0,0,0,0,0,0,0,0,0,0,0,0,1
238,RYDER SYSTEM INC,R,3/21/2019 - 4/17/2019,2019-05-07 00:00:00,2019-05-28,729,Name | SSN | Other,53.27000045776367,56.4900016784668,59.09000015258789,45.119998931884766,50.86000061035156,55.119998931884766,53.31999969482422,53.880001068115234,49.720001220703125,36.900001525878906,26.489999771118164,30.3700008392334,34.939998626708984,69.0,69.0,1,0,0,0,0,1,0,0,0,0,0,0,0,0,0,1,0,0,0,0,0,0,0,0,1,0,0,0,0,0,0,0,1,0,0
239,First American Financial Corp,FAF,,,2019-05-24,885000000,Bank Account | SSN | Other,54.880001068115234,55.02999877929688,55.61000061035156,57.66999816894531,59.09000015258789,60.45000076293945,62.61000061035156,58.27999877929688,61.209999084472656,63.790000915527344,34.72999954223633,42.2599983215332,49.470001220703125,29.15,32.21666666666667,6,1,0,0,0,0,0,0,0,1,0,0,0,0,0,0,0,0,0,1,0,0,0,0,0,0,0,0,0,0,0,0,0,0,1
240,Facebook Inc,FB,,,2019-05-20,49000000,Email | Phone Number,182.72000122070312,187.47999572753903,198.3600006103516,186.1699981689453,190.13999938964844,185.8500061035156,199.32000732421875,206.05999755859372,222.13999938964844,217.4900054931641,153.1300048828125,178.24000549316406,216.8800048828125,119.0,148.1142857142857,7,0,0,0,0,1,0,0,0,1,0,0,0,0,0,0,0,0,0,0,0,0,0,0,1,0,0,0,0,0,0,0,0,0,1
241,Facebook Inc,FB,,,2019-05-14,,ND,181.5399932861328,177.47000122070312,204.8699951171875,188.4499969482422,187.19000244140625,183.27999877929688,193.19000244140625,194.1100006103516,221.91000366210935,213.13999938964844,170.27999877929688,174.7899932861328,205.1000061035156,125.0,148.97142857142856,7,0,0,0,0,1,0,0,1,0,0,0,0,0,0,0,0,0,0,0,0,0,0,0,1,0,0,0,0,0,0,0,0,0,1
242,"URBAN ONE, INC.",UONE,Feb-2019 - Mar-2019,,2019-05-10,18012,ND,1.8899999856948853,2.930000066757202,2.309999942779541,2.049999952316284,1.9700000286102293,1.9800000190734863,2.2100000381469727,2.0,2.2100000381469727,2.119999885559082,1.9299999475479128,1.190000057220459,1.2999999523162842,,,0,0,0,0,1,0,0,0,0,0,0,0,0,0,0,1,0,0,0,0,0,0,0,0,0,1,0,0,0,1,0,0,0,0,0
243,SPRINT Corp,,2019-03-14 00:00:00,,2019-05-09,25909,ND,13.65999984741211,13.630000114440918,13.789999961853027,14.0600004196167,14.100000381469728,14.18000030517578,14.039999961853027,14.239999771118164,14.350000381469728,14.550000190734863,14.300000190734863,12.9399995803833,13.170000076293944,,,0,0,0,0,0,1,0,0,0,0,0,0,0,0,0,1,0,0,0,0,0,0,0,0,0,1,0,0,0,0,1,0,0,0,0
244,"BERRY GLOBAL GROUP, INC.",BERY,Jan-2019,2019-04-04 00:00:00,2019-05-09,1461,Address | SSN | Bank Account | Other,51.470001220703125,50.31999969482422,54.310001373291016,42.47999954223633,38.209999084472656,37.52000045776367,41.91999816894531,47.20000076293945,44.77000045776367,41.95000076293945,31.82999992370605,35.970001220703125,43.86000061035156,61.5,61.5,2,1,0,0,0,0,0,0,0,0,0,1,0,0,0,0,0,0,0,0,1,0,0,0,0,0,0,0,0,0,1,0,0,0,0
245,SHAW COMMUNICATIONS INC,SJR,,2019-04-17 00:00:00,2019-05-08,15000,Email | Phone Number | Credit Card | Other,20.280000686645508,20.86000061035156,20.25,19.43000030517578,19.86000061035156,19.690000534057617,20.1200008392334,20.36000061035156,20.6200008392334,19.82999992370605,17.8700008392334,16.3799991607666,16.1299991607666,32.5,32.5,1,1,0,0,0,0,0,0,0,0,1,0,0,0,0,0,0,0,0,0,0,0,0,0,0,1,0,1,0,0,0,0,0,0,0
246,Eaton Corp plc,ETN,4/1/2019,2019-04-10 00:00:00,2019-05-08,,Name | SSN | Address | Email | Bank Account | Other,81.02999877929688,79.08000183105469,81.26000213623047,78.08999633789062,83.25,78.30000305175781,90.9000015258789,93.08000183105467,94.83999633789062,101.95999908447266,92.7699966430664,76.16000366210938,80.26000213623047,81.0,82.75,4,1,0,0,0,0,0,0,0,0,0,0,0,0,0,1,0,0,0,0,1,0,0,0,0,0,0,0,1,0,0,0,0,0,0
247,AMC Networks Inc.,AMCX,,,2019-05-03,1600000,Name | Email | Other | Other (financial),57.36000061035156,54.380001068115234,55.060001373291016,53.18000030517578,46.7400016784668,47.93999862670898,43.08000183105469,37.470001220703125,39.150001525878906,36.560001373291016,31.06999969482422,22.299999237060547,24.040000915527344,52.0,52.0,1,1,0,0,0,0,0,0,0,1,0,0,0,0,0,0,0,0,0,0,0,0,0,0,0,1,0,0,0,1,0,0,0,0,0
248,"CHARLES RIVER LABORATORIES INTERNATIONAL, INC.",CRL,,Mar-2019,2019-04-30,,ND,142.52000427246094,125.5199966430664,141.89999389648438,139.7899932861328,131.02999877929688,132.3699951171875,132.4199981689453,145.25,151.83999633789062,157.7100067138672,155.57000732421875,129.99000549316406,145.9600067138672,146.5,126.833,6,0,0,0,0,1,0,0,0,0,0,0,0,0,0,1,0,0,0,0,0,0,0,0,1,0,0,0,0,0,0,1,0,0,0
249,Care.com Inc,,1/26/2019 - 1/28/2019,2019-01-28 00:00:00,2019-04-24,,Name | SSN,13.220000267028809,13.619999885559082,13.899999618530272,13.970000267028809,14.15999984741211,14.140000343322754,14.0600004196167,13.960000038146973,14.15999984741211,14.40999984741211,14.600000381469728,11.029999732971191,12.760000228881836,,,0,0,0,0,0,1,0,0,0,0,0,0,0,0,0,1,0,0,0,0,0,0,0,0,1,0,0,0,0,0,0,1,0,0,0
250,"Liberty Expedia Holdings, Inc.",,Jul-2018 - Feb-2019,2019-04-12 00:00:00,2019-04-19,4001,Name | Email | Address | Other,13.31999969482422,13.649999618530272,13.899999618530272,13.989999771118164,14.170000076293944,13.9399995803833,14.06999969482422,13.979999542236328,14.15999984741211,14.31999969482422,14.59000015258789,11.010000228881836,13.050000190734863,,,0,0,0,0,0,1,0,0,0,0,0,1,0,0,0,0,0,0,0,0,0,0,0,1,0,0,0,0,0,0,0,0,0,0,1
251,MICROSOFT CORP,MSFT,,,2019-04-18,60000000,Email | Other,121.7699966430664,128.07000732421875,132.85000610351562,136.27000427246094,136.1300048828125,137.38999938964844,139.69000244140625,150.33999633789062,154.69000244140625,167.10000610351562,187.22999572753903,146.57000732421875,178.60000610351562,145.0,141.0,30,0,0,0,0,1,0,0,0,1,0,0,0,0,0,0,0,0,0,0,0,0,0,0,1,0,0,0,0,0,0,0,0,0,1
252,WIPRO LTD,WIT,,,2019-04-17,,ND,4.239999771118164,4.5,4.5,4.170000076293945,3.799999952316284,3.670000076293945,3.7799999713897705,3.869999885559082,3.759999990463257,3.799999952316284,3.799999952316284,2.759999990463257,3.059999942779541,4.5,4.5,1,0,0,0,1,0,0,0,0,0,0,1,0,0,0,0,0,0,0,0,0,0,0,0,1,0,0,0,1,0,0,0,0,0,0
253,MICROSOFT CORP,MSFT,1/1/2019 - 3/29/2019,,2019-04-13,,Email | Other,120.9499969482422,123.3499984741211,131.49000549316406,138.89999389648438,135.7899932861328,137.52000427246094,139.67999267578125,147.07000732421875,153.24000549316406,163.27999877929688,184.7100067138672,139.05999755859375,165.50999450683594,145.0,140.35294117647058,34,0,0,0,0,1,0,0,0,0,1,0,0,0,0,0,0,0,0,0,0,0,0,0,1,0,0,0,0,0,0,0,0,0,1
254,CORNING INC /NY,GLW,1/29/2019,2019-03-12 00:00:00,2019-04-12,,Name | Address | Email | SSN,34.599998474121094,30.790000915527344,30.959999084472656,32.54999923706055,27.75,29.979999542236328,29.059999465942383,29.940000534057617,28.020000457763672,30.11000061035156,28.040000915527344,23.149999618530277,21.18000030517578,38.1,37.8,4,0,0,0,0,1,0,0,0,0,0,0,0,0,1,0,0,0,0,0,1,0,0,0,0,0,0,0,0,1,0,0,0,0,0
255,HUMANA INC,HUM,1/15/2016 - 2/21/2018,2019-02-14 00:00:00,2019-04-08,522,Name | Other,273.5599975585937,245.27999877929688,248.8699951171875,264.1499938964844,293.8900146484375,273.510009765625,255.2400054931641,315.1400146484375,348.1400146484375,366.8699951171875,353.260009765625,367.010009765625,320.04998779296875,314.0,316.75,16,0,0,0,0,1,0,0,0,0,0,0,0,0,1,0,0,0,0,1,0,0,0,0,0,0,0,0,0,1,0,0,0,0,0
256,"URBAN ONE, INC.",UONE,,2019-02-28 00:00:00,2019-04-05,18012,Name | Address | SSN | Password | Other,2.049999952316284,2.259999990463257,1.9800000190734863,2.259999990463257,2.109999895095825,1.7799999713897705,2.059999942779541,2.1600000858306885,2.009999990463257,1.9600000381469729,1.950000047683716,1.909999966621399,1.2699999809265137,,,0,0,0,0,0,1,0,0,0,0,0,0,0,0,0,1,0,0,0,0,0,0,0,0,0,1,0,0,0,1,0,0,0,0,0
257,"RAVE RESTAURANT GROUP, INC.",RAVE,9/6/2018 - 12/2/2018,,2019-04-05,,Name | Credit Card | Other,1.5,1.6299999952316284,2.509999990463257,2.9800000190734863,2.549999952316284,2.4200000762939453,2.5,2.619999885559082,1.7100000381469729,1.8200000524520876,1.590000033378601,1.25,0.5899999737739563,,,0,1,0,0,0,0,0,0,1,0,0,0,0,0,0,0,0,0,0,0,0,0,0,0,0,0,1,0,0,0,0,0,0,1,0
258,"AeroGrow International, Inc.",AERO,10/29/2018 - 3/4/2019,2019-03-04 00:00:00,2019-04-04,27488,Credit Card | Other,1.5499999523162842,1.6699999570846558,1.149999976158142,1.5800000429153442,1.2999999523162842,1.1299999952316284,0.9399999976158142,0.8999999761581421,1.0199999809265137,0.9700000286102296,1.1799999475479126,1.309999942779541,1.340000033378601,,,0,1,0,0,0,0,0,0,1,0,0,0,0,0,0,0,0,0,0,0,0,0,0,1,0,0,0,0,0,0,0,0,0,0,1
259,Facebook Inc,FB,,,2019-04-04,540000000,Name | Other,173.5399932861328,195.47000122070312,164.14999389648438,197.1999969482422,189.0200042724609,182.38999938964844,179.3800048828125,194.72000122070312,198.82000732421875,208.6699981689453,204.19000244140625,185.88999938964844,154.17999267578125,220.0,212.02380952380952,42,0,0,0,0,1,0,0,0,1,0,0,0,0,0,0,0,0,0,0,0,0,0,0,1,0,0,0,0,0,0,0,0,0,1
260,"Forterra, Inc.",FRTA,1/17/2018 - 10/31/2018,2018-01-31 00:00:00,2019-04-02,763,Name,4.099999904632568,4.659999847412109,4.78000020980835,5.199999809265137,6.559999942779541,5.980000019073486,7.039999961853027,8.40999984741211,10.960000038146973,11.5600004196167,12.949999809265137,13.859999656677246,5.71999979019165,,,0,0,0,0,0,1,0,0,0,0,0,1,0,0,0,0,0,0,0,0,1,0,0,0,0,0,0,0,0,0,0,0,0,1,0
261,"SANUWAVE Health, Inc.",SNWV,,,2019-04-01,,ND,0.2000000029802322,0.1800000071525573,0.1599999964237213,0.1400000005960464,0.1299999952316284,0.1800000071525573,0.1500000059604644,0.1400000005960464,0.1599999964237213,0.1599999964237213,0.1899999976158142,0.270000010728836,0.2000000029802322,,,0,0,0,0,1,0,0,0,0,0,0,1,0,0,0,0,0,0,0,0,1,0,0,0,0,0,0,0,0,0,0,0,1,0,0
262,TOYOTA MOTOR CORP/,TM,Feb-2019,,2019-03-29,3100000,ND,119.06999969482422,123.80999755859376,119.4000015258789,123.98999786376952,131.72999572753906,130.2899932861328,136.27999877929688,138.33999633789062,141.66000366210938,141.27999877929688,142.5800018310547,130.75,127.23999786376952,75.215,75.215,2,0,0,0,0,1,0,0,0,0,1,0,0,0,0,0,0,0,0,0,1,0,0,0,0,0,0,0,1,0,0,0,0,0,0
263,HEXION INC.,HXOH,,,2019-03-22,,ND,,,,,,,,,,,,,,,,0,0,0,0,1,0,0,0,0,0,0,0,1,0,0,0,0,0,0,0,1,0,0,0,0,0,0,0,0,0,1,0,0,0,0
264,Momentive Performance Materials Inc.,,,,2019-03-22,,ND,13.369999885559082,13.229999542236328,13.6899995803833,13.880000114440918,13.970000267028809,14.220000267028809,14.0600004196167,14.050000190734863,13.93000030517578,14.199999809265137,14.399999618530272,14.550000190734863,11.420000076293944,,,0,0,0,0,1,0,0,0,0,0,0,0,1,0,0,0,0,0,0,0,1,0,0,0,0,0,0,0,0,1,0,0,0,0,0
265,MPM Holdings Inc.,,,,2019-03-22,,ND,13.369999885559082,13.229999542236328,13.6899995803833,13.880000114440918,13.970000267028809,14.220000267028809,14.0600004196167,14.050000190734863,13.93000030517578,14.199999809265137,14.399999618530272,14.550000190734863,11.420000076293944,,,0,0,0,0,1,0,0,0,0,0,0,0,1,0,0,0,0,0,0,0,1,0,0,0,0,0,0,0,0,1,0,0,0,0,0
266,FirstService Corp,FSV,,Jan-2019,2019-03-22,,Name | SSN,85.37000274658203,87.41999816894531,86.29000091552734,96.4800033569336,97.08999633789062,102.63999938964844,103.9499969482422,105.4499969482422,92.0,94.58999633789062,99.83000183105467,108.4499969482422,67.33000183105469,,,0,0,0,0,0,1,0,0,0,0,1,0,0,0,0,0,0,0,0,1,0,0,0,0,0,0,0,1,0,0,0,0,0,0,0
267,Apple Inc.,AAPL,12/22/2018,12/23/2018,2019-03-21,,Name | Address | Phone Number | Email | Credit Card | Other,47.040000915527344,50.96500015258789,45.772499084472656,49.8650016784668,50.647499084472656,52.59000015258789,54.432498931884766,60.12749862670898,65.79750061035156,69.86000061035156,79.14250183105469,80.07499694824219,57.310001373291016,212.0,208.375,16,1,0,0,0,0,0,0,0,0,0,0,0,0,0,1,0,0,0,0,1,0,0,0,0,0,0,0,0,0,0,0,0,0,1
268,SHENANDOAH TELECOMMUNICATIONS CO/VA/,SHEN,Jun-2015 - Jan-2019,2019-01-18 00:00:00,2019-03-19,,Name | Address | Phone Number | Email | SSN | Other,46.58000183105469,42.29999923706055,41.93000030517578,39.4900016784668,38.5,32.79999923706055,32.90999984741211,30.770000457763672,36.04999923706055,38.869998931884766,44.060001373291016,48.34999847412109,47.540000915527344,,,0,0,0,0,0,1,0,0,0,1,0,0,0,0,0,0,0,0,0,0,0,0,0,0,0,1,0,0,0,1,0,0,0,0,0
269,"OneMain Holdings, Inc.",OMF,7/21/2012,,2019-03-14,465,Name | SSN,33.40999984741211,33.41999816894531,32.59000015258789,31.56999969482422,34.59000015258789,39.060001373291016,38.810001373291016,35.369998931884766,41.060001373291016,43.380001068115234,42.09000015258789,46.9900016784668,31.57999992370605,44.0,44.0,1,0,0,0,0,1,0,0,0,0,0,0,0,0,0,1,0,0,0,1,0,0,0,0,0,0,0,0,0,0,1,0,0,0,0
270,ABM INDUSTRIES INC /DE/,ABM,1/8/2018 - 8/7/2018,2018-06-14 00:00:00,2019-03-12,42366,SSN | Bank Account | Credit Card | Other,33.5,37.0,38.31999969482422,39.619998931884766,40.810001373291016,39.77999877929688,36.54999923706055,36.119998931884766,37.68000030517578,38.130001068115234,38.65999984741211,38.97999954223633,29.40999984741211,1.4,1.4,1,1,0,0,0,0,0,0,0,0,0,1,0,0,0,0,0,0,0,0,0,0,0,0,1,0,0,0,0,1,0,0,0,0,0
271,CITRIX SYSTEMS INC,CTXS,10/13/2018 - 3/8/2019,2019-03-06 00:00:00,2019-03-08,15820,Name | SSN | Bank Account,102.87000274658205,100.93000030517578,97.54000091552734,95.86000061035156,98.9800033569336,91.4000015258789,94.41000366210938,96.8000030517578,110.11000061035156,110.62000274658205,112.41000366210938,121.08000183105467,117.91000366210938,123.0,123.0,1,1,0,0,0,0,0,0,0,0,0,0,0,0,0,1,0,0,0,0,0,0,0,0,1,0,0,0,0,0,0,0,1,0,0
272,Tribune Publishing Co,TPCO,11/1/2018,Dec-2018,2019-03-07,242,Username | Password | Bank Account,11.520000457763672,12.149999618530272,11.100000381469728,9.649999618530272,8.289999961853027,8.0,7.670000076293945,8.579999923706055,9.399999618530272,12.289999961853027,12.970000267028809,12.520000457763672,10.020000457763672,12.0,12.0,1,1,0,0,0,0,0,0,0,0,0,0,0,0,0,1,0,0,0,0,1,0,0,0,0,0,0,0,0,0,1,0,0,0,0
273,"Walker & Dunlop, Inc.",WD,,2018-11-05 00:00:00,2019-03-06,,Name | Address | SSN | Other,54.88999938964844,51.36000061035156,55.290000915527344,51.900001525878906,55.65999984741211,54.95000076293945,57.33000183105469,55.52999877929688,63.400001525878906,64.91999816894531,63.540000915527344,74.9800033569336,66.77999877929688,70.0,70.0,1,0,0,0,0,1,0,0,0,0,0,0,0,0,0,1,0,0,0,1,0,0,0,0,0,0,0,0,0,1,0,0,0,0,0
274,Protective Insurance Corp,PTVCA,,2018-09-17 00:00:00,2019-03-01,,Name | Other,20.770000457763672,19.5,16.450000762939453,15.859999656677246,16.5,16.399999618530273,15.5,15.890000343322754,15.399999618530272,15.0,15.550000190734863,15.0,15.09000015258789,,,0,0,0,0,0,1,0,0,0,0,0,0,0,0,0,1,0,0,0,1,0,0,0,0,0,0,0,0,0,0,1,0,0,0,0
275,"TWENTY-FIRST CENTURY FOX, INC.",,,,2019-02-28,2400000,Name | Address | Other,12.949999809265137,13.399999618530272,13.369999885559082,13.520000457763672,13.979999542236328,14.06999969482422,14.18000030517578,14.170000076293944,13.9399995803833,14.09000015258789,14.210000038146973,14.479999542236328,14.470000267028809,,,0,0,0,0,0,1,0,0,0,1,0,0,0,0,0,0,0,0,0,0,0,0,0,0,0,1,0,0,0,1,0,0,0,0,0
276,TOYOTA MOTOR CORP/,TM,,,2019-02-21,,ND,122.79000091552734,119.66999816894533,125.16000366210938,118.11000061035156,125.8000030517578,130.1699981689453,129.02999877929688,136.55999755859375,136.32000732421875,141.3699951171875,141.97000122070312,142.3800048828125,139.11000061035156,2.904,10.44,19,0,0,0,0,1,0,0,0,0,1,0,0,0,0,0,0,0,0,0,1,0,0,0,0,0,0,0,1,0,0,0,0,0,0
277,"Del Taco Restaurants, Inc.",TACO,,2019-01-28 00:00:00,2019-02-21,,Name | SSN | Other,10.90999984741211,9.90999984741211,10.09000015258789,11.619999885559082,11.90999984741211,12.460000038146973,11.510000228881836,10.470000267028809,9.68000030517578,7.349999904632568,7.730000019073486,8.0,7.800000190734863,14.0,13.6,5,0,0,0,0,1,0,0,0,0,0,1,0,0,0,0,0,0,0,0,0,0,0,1,0,0,0,0,0,0,0,0,0,0,1
278,"VOLT INFORMATION SCIENCES, INC.",VOLT,8/6/2018 - 10/4/2018,2018-10-16 00:00:00,2019-02-15,9064,Name | SSN,3.920000076293945,4.309999942779541,5.0,4.289999961853027,4.320000171661377,4.539999961853027,3.9600000381469727,3.1700000762939453,3.0,2.859999895095825,2.380000114440918,2.470000028610229,2.0999999046325684,,,0,0,0,0,0,1,0,0,0,0,0,0,0,0,0,1,0,0,0,0,0,0,0,0,1,0,0,0,0,0,0,0,0,0,1
279,"FIVE BELOW, INC",FIVE,11/13/2018 - 1/11/2019,2019-01-11 00:00:00,2019-02-14,56102,Name | Address | Credit Card,130.6699981689453,116.91999816894533,134.97000122070312,127.79000091552734,132.1999969482422,128.25999450683594,111.5500030517578,133.47000122070312,129.36000061035156,122.77999877929688,123.86000061035156,107.45999908447266,114.93000030517578,143.5,702.25775,4,1,0,0,0,0,0,0,0,0,0,0,0,0,0,1,0,0,0,0,0,0,0,1,0,0,0,0,0,1,0,0,0,0,0
280,"Coeur Mining, Inc.",CDE,12/14/2018 - 12/17/2018,2018-12-17 00:00:00,2019-02-14,,Name | SSN | Bank Account | Other,4.960000038146973,4.889999866485596,3.940000057220459,3.220000028610229,3.490000009536743,4.630000114440918,5.289999961853027,4.519999980926514,4.670000076293945,6.369999885559082,7.269999980926514,6.429999828338623,6.110000133514404,6.375,6.375,4,1,0,0,0,0,0,0,0,0,0,1,0,0,0,0,0,0,0,0,0,1,0,0,0,0,0,0,0,0,1,0,0,0,0
281,FLANIGANS ENTERPRISES INC,BDL,,,2019-02-12,,Money,24.61000061035156,24.8700008392334,23.649999618530277,25.0,23.5,22.84000015258789,21.68000030517578,22.3700008392334,22.46999931335449,23.09000015258789,22.940000534057617,22.31999969482422,20.600000381469727,,,0,0,0,0,1,0,0,0,0,0,0,1,0,0,0,0,0,0,0,0,0,0,0,1,0,0,0,0,0,0,0,0,1,0,0
282,Facebook Inc,FB,,,2019-02-08,14526602,Name | Other,166.3800048828125,169.1300048828125,174.92999267578125,189.7700042724609,173.35000610351562,195.75999450683597,185.1499938964844,187.4900054931641,179.67999267578125,190.4199981689453,201.0500030517578,213.05999755859372,212.3300018310547,192.475,192.475,2,0,0,0,0,1,0,0,0,1,0,0,0,0,0,0,0,0,0,0,0,0,0,0,1,0,0,0,0,0,0,0,0,0,1
