Company name,Ticker,Date of Breach,Date Became Aware of Breach,Date of Disclosure,Number of Records,Type of Info,Information,Attack,Stock Price (0 months DoD),Stock Price (1 months DoD),Stock Price (2 months DoD),Stock Price (3 months DoD),Stock Price (4 months DoD),Stock Price (5 months DoD),Stock Price (6 months DoD),Stock Price (7 months DoD),Stock Price (8 months DoD),Stock Price (9 months DoD),Stock Price (10 months DoD),Stock Price (11 months DoD),Stock Price (12 months DoD),median stock forecast,mean stock forecast,SIC Code,Region
HUMANA INC,HUM,10/12/2020 - 12/16/2020,2020-12-22 00:00:00,2021-02-25,,Personal,SSN | Name | DoB | Address | Phone Number | Email | Other,Unauthorized Access,381.3999938964844,414.6600036621094,,,,,,,,,,,,,,"Finance, Insurance, Real Estate",US Mid Atlantic
HERBALIFE NUTRITION LTD.,HLF,2020-10-01 00:00:00,,2021-02-23,,Personal | Other,Name | Phone Number | Address | DOB | Membership ID | Username | Password ,Unauthorized Access,45.27999877929688,46.29999923706055,,,,,,,,,,,,,,Wholesale Trade,Foreign
"Ultra Clean Holdings, Inc.",UCTT,,,2021-02-23,,Personal,SSN | Driver's License,ND,48.36999893188477,55.09000015258789,,,,,,,,,,,,,,Manufacturing,US West
KROGER CO,KR,,2021-01-23 00:00:00,2021-02-19,,Personal,Name | Email | Phone Number | Address | DOB | SSN | Other,Unauthorized Access,33.84000015258789,34.689998626708984,,,,,,,,,,,,,,Retail Trade,US Midwest
CINTAS CORP,CTAS,9/16/2020 - 9/20/2020,2020-09-20 00:00:00,2021-02-15,,Financial | Personal,Name | Bank Account,Unauthorized Access,345.1000061035156,351.6000061035156,,,,,,,,,,,,,,Manufacturing,US Midwest
"Blueknight Energy Partners, L.P.",BKEP,,2021-01-12 00:00:00,2021-02-12,,Financial,Name | SSN | Bank Account | Other,ND,2.1199998855590816,3.119999885559082,,,,,,,,,,,,,,Transportation & Public Utilities,US Southwest
SOUTH JERSEY INDUSTRIES INC,SJI,,,2021-02-11,,Personal,SSN | Account Number,ND,23.479999542236328,28.79999923706055,,,,,,,,,,,,,,Transportation & Public Utilities,US Mid Atlantic
"Globalstar, Inc.",GSAT,,,2021-02-10,,Financial | Personal,Account Number,ND,2.0799999237060547,1.5900000333786009,,,,,,,,,,,,,,Transportation & Public Utilities,US Southeast
WestRock Co,WRK,,2021-01-23 00:00:00,2021-02-08,,ND,ND,Ransomware,42.72000122070313,53.18000030517578,,,,,,,,,,,,,,Manufacturing,US Southeast
CARVANA CO.,CVNA,,,2021-02-05,,Personal,Driver's License,ND,284.5299987792969,269.989990234375,,,,,,,,,,,,,,Retail Trade,US Southwest
INDEPENDENT BANK CORP,INDB,,,2021-02-05,,Financial,Account Number,ND,77.73999786376953,87.69999694824219,,,,,,,,,,,,,,"Finance, Insurance, Real Estate",US New England
FORWARD AIR CORP,FWRD,2020-12-01 00:00:00,,2021-02-04,,ND,ND,Ransomware,73.38999938964844,88.73999786376953,89.4000015258789,,,,,,,,,,,,,Transportation & Public Utilities,US Southeast
"Tesla, Inc.",TSLA,,,2021-02-03,,Other,Intellectual property,ND,872.7899780273438,686.4400024414062,661.75,,,,,,,,,,,,,Manufacturing,US West
INTEL CORP,INTC,2020-09-29 00:00:00,,2021-02-03,,Financial,SSN | Other | Bank Account | DOB | Driver's License,ND,58.0,61.2400016784668,64.55000305175781,,,,,,,,,,,,,Manufacturing,US West
"CarParts.com, Inc.",PRTS,06/21/2020 - 06/28/2020,2020-06-28 00:00:00,2021-02-01,,Personal,Name | Address | SSN | Driver's License,Malware,16.489999771118164,19.170000076293945,14.279999732971193,,,,,,,,,,,,,Retail Trade,US West
UNITED STATES CELLULAR CORP,USM,,,2021-01-29,,Personal,Name | Addres | Phone Number | Other,Unauthorized Access,31.86000061035156,29.770000457763672,35.630001068115234,,,,,,,,,,,,,Transportation & Public Utilities,US Midwest
JOHNSON & JOHNSON,JNJ,2020-03-01 00:00:00,,2021-01-27,,Financial,Name|SSN|Other|Bank Account,Unauthorized Access,170.47999572753906,158.4600067138672,164.92999267578125,,,,,,,,,,,,,Manufacturing,US Mid Atlantic
"Petco Health & Wellness Company, Inc.",WOOF,2/11/2020 - 8/9/2020,2020-10-02 00:00:00,2021-01-25,30000,Financial,Name | Address | Email | Passwords | Credit Card,Unauthorized Access,27.0,21.809999465942386,21.709999084472656,,,,,,,,,,,,,Retail Trade,US West
"National Western Life Group, Inc.",NWLI,8/7/2020 - 8/10/2020,2020-08-15 00:00:00,2021-01-25,,Personal,Name | Other,Malware,200.72000122070312,212.5,236.0399932861328,,,,,,,,,,,,,"Finance, Insurance, Real Estate",US Southwest
TORONTO DOMINION BANK,TD,9/14/2020 - 10/29/2020,2020-12-21 00:00:00,2021-01-22,,Financial,Bank Account | Credit Card | Debit Card,ND,58.959999084472656,60.95000076293945,65.58000183105469,,,,,,,,,,,,,"Finance, Insurance, Real Estate",Canada
Walmart Inc.,WMT,,,2021-01-22,7000000,Financial,Name | Phone Number | Credit Card | Password | Other,Unauthorized Access,144.85000610351562,137.69000244140622,132.3699951171875,,,,,,,,,,,,,Retail Trade,US Southeast
INTEL CORP,INTC,,,2021-01-22,,Financial,Earnings Data,ND,62.459999084472656,60.709999084472656,65.62999725341797,,,,,,,,,,,,,Manufacturing,US West
Clarus Corp,CLAR,2020-10-04 00:00:00,,2021-01-22,1825,Personal,SSN | Driver's License,Malware,15.710000038146973,17.719999313354492,16.639999389648438,,,,,,,,,,,,,Manufacturing,US West
BioNTech SE,BNTX,2020-12-09 00:00:00,,2021-01-19,,Other,Intellectual Property,Unauthorized Access,104.6999969482422,112.6500015258789,103.6500015258789,,,,,,,,,,,,,Manufacturing,Foreign
PFIZER INC,PFE,2020-12-09 00:00:00,,2021-01-19,,Other,Intellectual Property,Unauthorized Access,36.72999954223633,34.560001373291016,35.77000045776367,,,,,,,,,,,,,Manufacturing,US Mid Atlantic
UNITED PARCEL SERVICE INC,UPS,2021-01-08 00:00:00,,2021-01-17,3000,Personal,ND,Ransomware,156.27999877929688,161.75,162.82000732421875,,,,,,,,,,,,,Transportation & Public Utilities,US Southeast
NORFOLK SOUTHERN CORP,NSC,2021-01-08 00:00:00,,2021-01-17,3000,Personal,ND,Ransomware,249.83999633789062,256.39999389648443,256.3900146484375,,,,,,,,,,,,,Transportation & Public Utilities,US Mid Atlantic
"SHIFT TECHNOLOGIES, INC.",SFT,2020-09-17 00:00:00,2020-09-18 00:00:00,2021-01-14,,ND,ND,Unauthorized Access,8.5,10.149999618530273,10.149999618530273,,,,,,,,,,,,,Retail Trade,US West
Ubiquiti Inc.,UI,,,2021-01-12,,Personal,Name | Address | Phone Number | Email | Password,Unauthorized Access,257.45001220703125,356.55999755859375,336.2300109863281,,,,,,,,,,,,,Manufacturing,US Mid Atlantic
Mimecast Ltd,MIME,,,2021-01-12,3600,Other,Other,Unauthorized Access,51.4000015258789,42.88999938964844,42.59000015258789,,,,,,,,,,,,,Services,Foreign
"Veritex Holdings, Inc.",VBTX,4/2/2020 - 4/27/2020,2020-05-08 00:00:00,2021-01-11,,ND,ND,Unauthorized Access,28.270000457763672,28.61000061035156,31.59000015258789,,,,,,,,,,,,,"Finance, Insurance, Real Estate",US Southwest
AURORA CANNABIS INC,ACB,2020-12-25 00:00:00,,2021-01-04,,ND,ND,ND,9.520000457763672,13.75,10.460000038146973,9.140000343322754,,,,,,,,,,,,Manufacturing,Canada
"Matson, Inc.",MATX,,2020-10-14 00:00:00,2021-01-04,,Personal,Name | SSN | Other,ND,56.68999862670898,61.38000106811523,73.36000061035156,67.31999969482422,,,,,,,,,,,,Transportation & Public Utilities,US West
"T-Mobile US, Inc.",TMUS,,,2020-12-30,200000,Personal,Phone Number | Other,Unauthorized Access,133.13999938964844,126.08000183105469,123.56999969482422,123.45999908447266,,,,,,,,,,,,Transportation & Public Utilities,US Southwest
WHIRLPOOL CORP /DE/,WHR,,,2020-12-28,,Personal,Other,Ransomware,185.19000244140625,212.3999938964844,190.0800018310547,223.08999633789062,,,,,,,,,,,,Manufacturing,US Midwest
Colfax CORP,CFX,11/8/2020 - 11/9/2020,2020-11-16 00:00:00,2020-12-23,,Financial,Name|SSN|Other|Bank Account,Unauthorized Access,36.18999862670898,40.599998474121094,44.90999984741211,45.72000122070313,,,,,,,,,,,,Manufacturing,US Mid Atlantic
"VMWARE, INC.",VMW,,,2020-12-21,,ND,ND,Malware,142.22999572753906,132.66999816894528,144.67999267578125,145.97999572753906,,,,,,,,,,,,Services,US West
NVIDIA CORP,NVDA,,,2020-12-21,,ND,ND,Malware,533.2899780273439,534.6300048828125,597.0599975585938,513.8300170898439,,,,,,,,,,,,Manufacturing,US West
INTEL CORP,INTC,,,2020-12-21,,ND,ND,Malware,46.36000061035156,58.66999816894531,63.0099983215332,63.7599983215332,,,,,,,,,,,,Manufacturing,US West
"CISCO SYSTEMS, INC.",CSCO,,,2020-12-21,,ND,ND,Malware,44.88000106811523,45.34000015258789,45.68000030517578,48.97999954223633,,,,,,,,,,,,Manufacturing,US West
MICROSOFT CORP,MSFT,,,2020-12-17,,Other,Intellectual Property,Malware,219.27999877929688,212.6499938964844,243.6999969482422,237.7100067138672,,,,,,,,,,,,Services,US West
"MEDNAX, INC.",MD,,2020-06-19 00:00:00,2020-12-16,45,Financial,Name | Address | Email | DOB | SSN | Driver's License | Financial Account Information | Other,Phishing,22.86000061035156,23.60000038146973,27.71999931335449,28.209999084472656,,,,,,,,,,,,Services,US Southeast
CLEAN HARBORS INC,CLH,,2020-09-02 00:00:00,2020-12-15,772,Financial,Name | SSN | Driver's License | Bank Account | Other,Unauthorized Access,72.0999984741211,81.94999694824219,85.41999816894531,89.5,,,,,,,,,,,,Transportation & Public Utilities,US New England
SolarWinds Corp,SWI,3/2020 - 6/2020,,2020-12-14,18000,ND,ND,Malware,19.6200008392334,14.640000343322756,17.040000915527347,16.819999694824222,,,,,,,,,,,,Services,US Southwest
Spotify Technology S.A.,SPOT,,2020-11-12 00:00:00,2020-12-09,,Personal,Email | Username | Password | DOB | Other,Misconfiguration,332.8599853515625,353.1099853515625,323.7900085449219,258.32998657226557,,,,,,,,,,,,Transportation & Public Utilities,Foreign
"FireEye, Inc.",FEYE,,,2020-12-08,,Other,Intellectual Property,ND,15.40999984741211,22.770000457763672,21.459999084472656,19.06999969482422,,,,,,,,,,,,Manufacturing,US West
II-VI INC,IIVI,,2020-11-19 00:00:00,2020-12-07,,Personal,Name | Address | DOB | SSN | Other,Phishing,72.31999969482422,79.38999938964844,88.0,74.61000061035156,,,,,,,,,,,,Manufacturing,US Mid Atlantic
BERKSHIRE HATHAWAY INC,BRK.A,,2020-08-22 00:00:00,2020-12-01,,Personal,Name | Address | SSN | Other,Ransomware,,,,,,,,,,,,,,,,"Finance, Insurance, Real Estate",US Midwest
MINERALS TECHNOLOGIES INC,MTX,2020-10-20 00:00:00,2020-10-22 00:00:00,2020-11-30,,Personal | Other,Name | Address | Phone Number | SSN | DOB | Email | Banking Info | Other,Unauthorized Access,60.66999816894531,61.13000106811523,61.63000106811523,74.06999969482422,74.66999816894531,,,,,,,,,,,Manufacturing,US Mid Atlantic
BELDEN INC.,BDC,,,2020-11-27,,Personal | Other,ND,Unauthorized Access,39.810001373291016,41.56999969482422,47.849998474121094,44.209999084472656,43.84000015258789,,,,,,,,,,,Manufacturing,US Southeast
CANON INC,CAJ,7/20/2020 - 8/6/2020,2020-08-04 00:00:00,2020-11-25,,Financial,Name|Bank Account|Other,Ransomware,18.649999618530273,19.59000015258789,21.479999542236328,22.31999969482422,22.0,,,,,,,,,,,Manufacturing,Foreign
Manchester United plc,MANU,,,2020-11-20,,ND,ND,ND,15.539999961853027,16.5,16.030000686645508,16.290000915527347,17.530000686645508,,,,,,,,,,,Services,Foreign
STEEL PARTNERS HOLDINGS L.P.,SPLP,,2020-05-29 00:00:00,2020-11-18,,Personal,Name | DOB | SSN | Other,Unauthorized Access,8.130000114440918,8.819999694824219,13.380000114440918,13.779999732971193,14.0600004196167,,,,,,,,,,,Manufacturing,US Mid Atlantic
ViacomCBS Inc.,VIAC,,,2020-11-14,,Personal,Name | Email | Password | DOB | Other,Unauthorized Access,30.20000076293945,34.669998168945305,43.11999893188477,58.31000137329102,94.94000244140624,,,,,,,,,,,Transportation & Public Utilities,US Mid Atlantic
SEACHANGE INTERNATIONAL INC,SEAC,,2020-04-20 00:00:00,2020-11-12,,Personal,Name,Malware,0.7799999713897705,0.9300000071525574,1.2000000476837158,1.3700000047683716,1.2300000190734863,,,,,,,,,,,Manufacturing,US New England
FORWARD AIR CORP,FWRD,6/20/2020-6/26/2020,2020-06-24 00:00:00,2020-11-11,,ND,ND,Unauthorized Access,73.01000213623047,73.4000015258789,79.22000122070312,84.66000366210938,91.08000183105469,,,,,,,,,,,Transportation & Public Utilities,US Southeast
"Southeastern Grocers, Inc.",SEGR,"9/22/2020, 9,23,2020",2020-09-22 00:00:00,2020-11-11,4,Personal,Name | Phone Number | Email | Address | DOB | Username | Password | Other,Unauthorized Access,,,,,,,,,,,,,,,,Retail Trade,US Southeast
GEO GROUP INC,GEO,7/17/2020-8/19/2020,2020-08-19 00:00:00,2020-11-03,,Personal,Name | Address | DOB | SSN | Other,Ransomware,9.4399995803833,9.670000076293944,8.859999656677246,8.739999771118164,7.449999809265138,7.690000057220459,,,,,,,,,,"Finance, Insurance, Real Estate",US Southeast
"SiteOne Landscape Supply, Inc.",SITE,7/2/2020 - 7/14/2020,2020-07-14 00:00:00,2020-10-30,,Financial,Name|Address|SSN|Bank Account|Other,Unauthorized Access,124.47000122070312,138.10000610351562,157.07000732421875,157.67999267578125,163.97999572753906,171.42999267578125,,,,,,,,,,Wholesale Trade,US Southeast
"HOME DEPOT, INC.",HD,2020-10-28 00:00:00,,2020-10-30,,Financial,Name | Email | Address | Credit Card | Other,Misconfiguration,269.6300048828125,277.41000366210943,266.19000244140625,270.82000732421875,261.6199951171875,302.20001220703125,,,,,,,,,,Retail Trade,US Southeast
"Ultra Clean Holdings, Inc.",UCTT,2020-08-03 00:00:00,2020-08-05 00:00:00,2020-10-23,6060,Financial,Financial Account Number | Credit Card Number,Phishing,23.709999084472656,30.1200008392334,32.029998779296875,43.36000061035156,48.36999893188477,55.09000015258789,,,,,,,,,,Manufacturing,US West
DR REDDYS LABORATORIES LTD,RDY,2020-10-22 00:00:00,2020-10-22 00:00:00,2020-10-22,,ND,ND,Ransomware,67.61000061035156,63.02000045776367,68.18000030517578,68.70999908447266,61.11999893188477,60.09000015258789,,,,,,,,,,Manufacturing,Foreign
BRIDGFORD FOODS CORP,BRID,2020-07-25 00:00:00,,2020-10-22,,Personal,Name | SSN | Address | DoB,Unauthorized Access,18.149999618530273,18.700000762939453,18.75,17.5,15.640000343322756,15.31999969482422,,,,,,,,,,Manufacturing,US West
PFIZER INC,PFE,7/1/2020-9/23/2020,,2020-10-21,,Personal,Name | Address | Email | Phone Numbers | Other,Misconfiguration,35.56925964355469,36.70000076293945,37.38000106811523,36.5,34.439998626708984,35.529998779296875,,,,,,,,,,Manufacturing,US Mid Atlantic
TERMINIX GLOBAL HOLDINGS INC,TMX,9/10/2020-9/22/2020,2020-09-26 00:00:00,2020-10-19,14708,Personal | Financial,Name | SSN | DoB  | Retirement Account | Other,Phishing,46.959999084472656,48.79999923706055,51.66999816894531,52.06999969482422,49.90999984741211,49.18999862670898,,,,,,,,,,Services,US Southeast
"T-Mobile US, Inc.",TMUS,2020-08-31 00:00:00,2020-09-01 00:00:00,2020-10-09,1,Personal,Name | Address | Phone Number | Account Number | Driver's License | Other,Unauthorized Access,115.48999786376952,122.77999877929688,133.14999389648438,135.05999755859378,126.0999984741211,127.05999755859376,,,,,,,,,,Transportation & Public Utilities,US Southwest
DXP ENTERPRISES INC,DXPE,,2020-08-22 00:00:00,2020-10-09,,Personal,Name | SSN,Ransomware,18.31999969482422,21.540000915527344,23.1200008392334,25.57999992370605,27.6299991607666,33.959999084472656,,,,,,,,,,Wholesale Trade,US Southwest
UNIVERSAL HEALTH SERVICES INC,UHS,9/27/2020-10/12/2020,,2020-10-05,,ND,ND,Ransomware,111.54000091552734,112.27999877929688,135.17999267578122,135.27999877929688,131.69999694824222,127.12000274658205,,,,,,,,,,Services,US Mid Atlantic
SINCLAIR BROADCAST GROUP INC,SBGI,2020-05-01 00:00:00,2020-07-08 00:00:00,2020-10-05,,Personal,Name | Driver's License,ND,18.690000534057614,18.100000381469727,28.90999984741211,31.729999542236328,32.009998321533196,35.65999984741211,,,,,,,,,,Transportation & Public Utilities,US Mid Atlantic
Unum Group,UNM,12/5/2019-12/132019,2020-07-13 00:00:00,2020-10-02,,Personal,Name | SSN | Other,Unauthorized Access,17.0,18.51000022888184,22.489999771118164,22.940000534057607,23.729999542236328,27.20000076293945,28.13999938964844,,,,,,,,,"Finance, Insurance, Real Estate",US Southeast
UNIVERSAL HEALTH SERVICES INC,UHS,2020-09-27 00:00:00,,2020-09-29,,ND,ND,Ransomware,104.41000366210938,106.37000274658205,132.11000061035156,136.52999877929688,127.83999633789062,127.9000015258789,135.1300048828125,,,,,,,,,Services,US Mid Atlantic
VOXX International Corp,VOXX,6/4/2020 - 7/7/2020,2020-07-07 00:00:00,2020-09-28,,Financial,Name | Address | Email | SSN | Bank Account | Other,Ransomware,7.949999809265138,13.31999969482422,12.829999923706055,13.130000114440918,19.030000686645508,20.729999542236328,19.350000381469727,,,,,,,,,Wholesale Trade,US Mid Atlantic
TOWN SPORTS INTERNATIONAL HOLDINGS INC,CLUBQ,,,2020-09-23,665000,Personal,Name | Address | Email | Phone Number,Misconfiguration,0.25,0.059999998658895486,0.14000000059604645,0.12999999523162842,0.2800000011920929,0.3700000047683716,0.3400000035762787,,,,,,,,,Services,US Mid Atlantic
TYLER TECHNOLOGIES INC,TYL,,2020-09-23 00:00:00,2020-09-23,2301,ND,ND,Ransomware,344.0299987792969,399.010009765625,413.5199890136719,438.5199890136719,424.3999938964844,459.6199951171875,420.70001220703125,,,,,,,,,Services,US Southwest
"RadNet, Inc.",RDNT,2020-07-18 00:00:00,,2020-09-21,,Personal,Name | SSN | Address | Other,Unauthorized Access,14.84000015258789,16.190000534057614,18.270000457763672,17.934999465942386,20.26000022888184,18.440000534057614,23.31999969482422,,,,,,,,,Services,US West
"VACCINEX, INC.",VCNX,,,2020-09-14,,ND,ND,Unauthorized Access,5.210000038146973,2.059999942779541,1.9900000095367432,1.9800000190734863,2.4200000762939453,3.190000057220459,3.7100000381469727,,,,,,,,,Manufacturing,US Mid Atlantic
EQUINIX INC,EQIX,,,2020-09-09,,ND,ND,Ransomware,741.0499877929688,824.4000244140625,743.2100219726562,695.280029296875,692.4600219726562,747.4099731445312,594.9199829101562,,,,,,,,,"Finance, Insurance, Real Estate",US West
"Fluent, Inc.",FLNT,7/23/2020 - 7/29/2020,2020-07-29 00:00:00,2020-09-04,,Personal,Name | Address | Email | Address | SSN | Phone Number | Other,ND,3.1800000667572017,2.509999990463257,2.690000057220459,3.869999885559082,5.25,5.829999923706055,6.9000000953674325,4.460000038146973,,,,,,,,Services,US Mid Atlantic
Warner Music Group Corp.,WMG,4/25/2020 - 8/5/2020,2020-08-05 00:00:00,2020-09-02,,Financial,Name | Email | Phone Number | Address | Credit Card | Other,Unauthorized Access,29.8799991607666,28.170000076293945,26.239999771118164,29.29999923706055,37.9900016784668,35.5,37.40999984741211,34.02000045776367,,,,,,,,Services,US Mid Atlantic
"Amphastar Pharmaceuticals, Inc.",AMPH,2020-05-02 00:00:00,2020-07-24 00:00:00,2020-08-28,,Personal,Name | SSN,Ransomware,20.309999465942386,18.51000022888184,19.8799991607666,18.1200008392334,19.020000457763672,18.82999992370605,17.530000686645508,18.040000915527344,,,,,,,,Manufacturing,US West
R1 RCM INC.,RCM,,,2020-08-24,,ND,ND,Ransomware,14.5600004196167,15.020000457763672,17.469999313354492,20.32999992370605,23.53000068664551,26.53000068664551,27.959999084472656,25.15999984741211,,,,,,,,Services,US Midwest
MARRIOTT INTERNATIONAL INC /MD/,MAR,,2020-08-12 00:00:00,2020-08-17,,Personal,ND,Spoofing,95.72000122070312,107.76000213623048,97.76000213623048,123.76000213623048,130.44000244140622,126.8000030517578,130.39999389648438,150.6300048828125,,,,,,,,Services,US Mid Atlantic
CARNIVAL CORP,CCL,,2020-08-15 00:00:00,2020-08-17,,Personal,Name|Address|Phone Number|Passport Number|DOB|Social|Other,Ransomware,14.68000030517578,16.459999084472653,14.079999923706055,17.569999694824222,21.76000022888184,20.790000915527344,22.46999931335449,28.25,,,,,,,,Transportation & Public Utilities,US Southeast
BROWN FORMAN CORP,BF.B,,2020-07-01 00:00:00,2020-08-15,,Financial,ND,Ransomware,,,,,,,,,,,,,,,,Manufacturing,US Mid Atlantic
STERICYCLE INC,SRCL,10/2019 - 4/2020,2020-07-27 00:00:00,2020-08-14,,Financial,Name | SSN | Tax ID Number | Drivers License | Passport | Other (Financial) | Credit Card | Other,Phishing,65.41999816894531,61.86999893188477,65.37999725341797,70.43000030517578,69.43000030517578,69.62000274658203,69.40000152587889,68.5,,,,,,,,Transportation & Public Utilities,US Midwest
INTEL CORP,INTC,,,2020-08-06,,Other,Intellectual Property,ND,48.91999816894531,50.08000183105469,51.68999862670898,45.68000030517578,51.9900016784668,50.61000061035156,58.18000030517578,60.7400016784668,,,,,,,,Manufacturing,US West
CANON INC,CAJ,,2020-07-30 00:00:00,2020-08-04,,Personal,Other,Ransomware,16.719999313354492,16.319999694824222,16.370000839233402,18.09000015258789,18.90999984741211,18.209999084472656,22.15999984741211,21.68000030517578,22.88999938964844,,,,,,,Manufacturing,Foreign
DYNAVAX TECHNOLOGIES CORP,DVAX,2020-02-28 00:00:00,,2020-07-24,,ND,ND,Phishing,10.119999885559082,6.010000228881836,4.53000020980835,4.1599998474121085,4.199999809265137,5.599999904632568,5.21999979019165,9.079999923706056,10.119999885559082,,,,,,,Manufacturing,US West
GARMIN LTD,GRMN,2020-07-23 00:00:00,2020-07-23 00:00:00,2020-07-23,,ND,ND,Ransomware,101.3499984741211,102.43000030517578,95.13999938964844,99.04000091552734,114.66000366210938,119.13999938964844,123.83000183105469,127.6500015258789,127.58000183105469,,,,,,,Manufacturing,Foreign
BLACKBAUD INC,BLKB,May-2020,,2020-07-17,6073,Financial,Bank Account | SSN | Username | Password,Ransomware,53.43999862670898,63.209999084472656,56.97999954223633,58.06000137329102,52.29999923706055,57.38000106811523,63.709999084472656,72.91000366210938,71.76000213623047,,,,,,,Services,US Southeast
"TWITTER, INC.",TWTR,,2020-07-15 00:00:00,2020-07-15,,ND,ND,Phishing,34.380001068115234,37.900001525878906,38.77000045776367,45.97999954223633,43.47999954223633,52.02000045776367,45.790000915527344,71.9000015258789,70.27999877929689,,,,,,,Services,US West
FORMFACTOR INC,FORM,6/21/2020 - 6/28/2020,2020-06-28 00:00:00,2020-07-08,,ND,ND,Ransomware,31.020000457763672,28.34000015258789,22.57999992370605,26.5,33.799999237060554,44.34000015258789,45.47999954223633,46.25,40.790000915527344,,,,,,,Manufacturing,US West
STEEL PARTNERS HOLDINGS L.P.,SPLP,4/18/2020 - 4/29/2020,,2020-07-01,,Personal,Name | SSN | Other,Unauthorized Access,5.269999980926514,4.769999980926514,7.389999866485598,6.170000076293945,5.3400001525878915,8.699999809265138,10.970000267028807,13.5,13.420000076293945,13.989999771118164,,,,,,Manufacturing,US Mid Atlantic
"TWITTER, INC.",TWTR,,2020-05-20 00:00:00,2020-06-23,,Financial,Email | Phone Number | Other (Financial),Misconfiguration,33.470001220703125,36.93999862670898,39.2599983215332,42.72999954223633,50.27999877929688,44.93999862670898,54.90999984741211,48.06000137329102,70.48999786376953,65.20999908447266,,,,,,Services,US West
"UNIVERSAL LOGISTICS HOLDINGS, INC.",ULH,2020-06-08 00:00:00,,2020-06-18,,ND,ND,Ransomware,15.619999885559082,18.149999618530273,19.26000022888184,21.36000061035156,22.520000457763672,23.10000038146973,22.030000686645508,22.70000076293945,24.5,26.56999969482422,,,,,,Transportation & Public Utilities,US Midwest
MAXLINEAR INC,MXL,4/15/2020 - 5/24/2020,2020-05-24 00:00:00,2020-06-16,,Financial,Name | Email | Address | Bank Account | SSN | Other,Ransomware,19.649999618530273,25.229999542236328,25.84000015258789,23.729999542236328,24.70000076293945,27.309999465942386,31.520000457763672,35.81999969482422,38.25,36.790000915527344,,,,,,Manufacturing,US West
HONDA MOTOR CO LTD,HMC,2020-06-08 00:00:00,2020-06-08 00:00:00,2020-06-08,,ND,ND,Ransomware,28.09000015258789,25.670000076293945,24.670000076293945,25.35000038146973,24.809999465942386,26.36000061035156,29.809999465942386,28.170000076293945,28.76000022888184,29.479999542236328,,,,,,Manufacturing,Foreign
CONDUENT Inc,CNDT,2020-05-29 00:00:00,2020-05-29 00:00:00,2020-06-05,,ND,ND,Ransomware,2.6600000858306885,2.369999885559082,2.240000009536743,3.6949999332427983,3.369999885559082,3.740000009536743,4.53000020980835,4.675000190734863,5.099999904632568,6.139999866485598,,,,,,Services,US Mid Atlantic
Cosan Ltd.,CZZ,2020-03-11 00:00:00,,2020-05-28,,ND,ND,Ransomware,13.649999618530273,14.829999923706055,18.739999771118164,18.34000015258789,14.770000457763672,14.970000267028807,18.239999771118164,18.010000228881836,17.569999694824222,18.43000030517578,20.290000915527344,20.290000915527344,20.290000915527344,,,Manufacturing,Foreign
ICAHN ENTERPRISES L.P.,IEP,3/13/2020 - 4/4/2020,2020-04-06 00:00:00,2020-05-27,56521,Financial,Name | Address | SSN | Other (Financial),Unauthorized Access,49.95000076293945,47.0099983215332,49.97000122070313,49.40999984741211,48.02000045776367,50.02999877929688,50.0,50.9900016784668,56.86000061035156,63.88000106811523,54.72999954223633,,,,,Manufacturing,US Southeast
GENWORTH FINANCIAL INC,GNW,,2020-04-20 00:00:00,2020-05-14,,Personal,Name | Address | SSN | Other,Unauthorized Access,2.7899999618530287,3.150000095367432,2.039999961853028,2.549999952316284,3.75,3.630000114440918,4.5,4.199999809265137,3.130000114440918,4.110000133514403,3.5499999523162837,,,,,"Finance, Insurance, Real Estate",US Mid Atlantic
MAGELLAN HEALTH INC,MGLN,4/6/2020 - 4/12/2020,2020-04-22 00:00:00,2020-05-12,364892,Personal,Name | Address | SSN | Other | Username | Password,Phishing|Ransomware,69.26999664306639,67.54000091552734,69.58999633789061,75.81999969482422,74.77999877929688,78.9000015258789,80.83999633789062,79.94999694824219,94.41000366210938,93.23999786376952,93.3499984741211,,,75.0,75.0,Services,US Southwest
KROGER CO,KR,,,2020-05-09,8000000,Personal,Username | Password,ND,33.34000015258789,33.009998321533196,32.419998168945305,35.2400016784668,34.61999893188477,34.290000915527344,31.01000022888184,31.29999923706055,31.6299991607666,33.279998779296875,34.740001678466804,,,42.0,42.0,Retail Trade,US Midwest
Spark Networks SE,LOV,2020-01-12 00:00:00,2020-05-11 00:00:00,2020-05-09,30000000,Personal,Username | Password,Unauthorized Access,2.990000009536743,3.839999914169312,3.9600000381469727,5.46999979019165,4.380000114440918,4.690000057220459,4.5,4.670000076293945,5.480000019073486,7.769999980926514,4.860000133514403,,,,,Services,Foreign
GoDaddy Inc.,GDDY,2019-10-19 00:00:00,,2020-05-05,28000,Personal,Username | Password,Unauthorized Access,66.80999755859375,79.13999938964844,71.30000305175781,73.2300033569336,79.5199966430664,77.08999633789062,79.77999877929688,83.87000274658203,81.77999877929688,86.54000091552734,76.23999786376953,,,82.0,82.22222222222223,Services,US Southwest
"CHEGG, INC",CHGG,2020-04-09 00:00:00,2020-04-10 00:00:00,2020-04-28,700,Personal,Name | SSN,Unauthorized Access,41.849998474121094,60.7400016784668,65.41999816894531,74.30000305175781,75.19999694824219,70.79000091552734,77.11000061035156,75.01000213623047,91.70999908447266,93.26000213623048,96.52999877929688,85.30000305175781,,58.0,57.1,Services,US West
PRINCIPAL FINANCIAL GROUP INC,PFG,2019-12-16 00:00:00,,2020-04-28,,Personal,Name | SSN | Other,Misconfiguration,31.690000534057607,40.9900016784668,39.13999938964844,44.709999084472656,44.34000015258789,40.099998474121094,39.349998474121094,51.4000015258789,48.68000030517578,51.209999084472656,56.58000183105469,60.63000106811523,,37.5,37.75,"Finance, Insurance, Real Estate",US Midwest
TUPPERWARE BRANDS CORP,TUP,3/19/2020 - 3/24/2020,2020-03-24 00:00:00,2020-04-21,4763,Financial,Name | Address | Phone Number | Email | Credit Card,Malware,1.9600000381469729,2.9100000858306885,4.9099998474121085,7.199999809265138,13.960000038146973,25.61000061035156,20.700000762939453,35.2599983215332,31.81999969482422,31.3799991607666,33.450000762939446,26.68000030517578,,,,Manufacturing,US Southeast
COGNIZANT TECHNOLOGY SOLUTIONS CORP,CTSH,4/9/2020 - 4/11/2020,2020-04-20 00:00:00,2020-04-18,,Financial,Name | Credit Card | Other,Ransomware,53.81000137329102,53.13999938964844,55.4900016784668,61.43000030517578,67.54000091552734,70.12000274658203,73.36000061035156,77.0,81.7300033569336,80.23999786376953,76.43000030517578,78.02999877929688,,60.0,60.264705882352935,Services,US Mid Atlantic
US XPRESS ENTERPRISES INC,USX,Sep-2019,2019-10-18 00:00:00,2020-04-10,17262,ND,ND,Malware,3.839999914169312,4.130000114440918,5.889999866485598,6.199999809265138,9.890000343322754,9.520000457763672,9.9399995803833,7.300000190734862,6.989999771118164,7.230000019073486,9.489999771118164,10.640000343322754,,5.0,5.0,Transportation & Public Utilities,US Southeast
"Gannett Co., Inc.",GCI,,,2020-04-03,14000000,Personal,Email | Address | Password (Encrypted) | Other,Misconfiguration,0.9700000286102296,1.100000023841858,1.4099999666213991,1.2699999809265137,1.5700000524520874,1.7599999904632568,1.350000023841858,1.1399999856948853,2.650000095367432,3.359999895095825,4.579999923706055,5.460000038146973,5.329999923706055,0.75,0.75,Manufacturing,US Mid Atlantic
"Zoom Video Communications, Inc.",ZM,,,2020-04-03,530000,Personal,Username | Password,Misconfiguration,121.93000030517578,138.55999755859378,208.0800018310547,261.739990234375,268.0,423.55999755859375,482.2300109863281,453.0,412.8599853515625,337.32000732421875,391.8399963378906,372.7900085449219,326.2300109863281,144.0,136.07142857142858,Services,US West
"10x Genomics, Inc.",TXG,Mar-2020,Mar-2020,2020-04-01,,Other,ND,Ransomware,62.31999969482422,79.87000274658203,81.94999694824219,89.30999755859375,98.37000274658205,114.62000274658205,124.68000030517578,136.89999389648438,153.11000061035156,141.60000610351562,176.8300018310547,186.75,181.0,20.1725,35.41441666666667,Manufacturing,US West
GoDaddy Inc.,GDDY,,,2020-03-31,,Other,ND,Phishing,59.15999984741211,69.43000030517578,77.25,73.33000183105469,68.88999938964844,83.68000030517578,75.97000122070312,70.73999786376953,79.54000091552734,83.31999969482422,78.58000183105469,84.77999877929688,75.94999694824219,73.0,76.9,Services,US Southwest
MARRIOTT INTERNATIONAL INC /MD/,MAR,Mid-Jan 2020 - Late-Feb 2020,,2020-03-31,5200000,Personal,Other,Unauthorized Access,76.16000366210938,90.94000244140624,88.5,85.7300033569336,85.51000213623047,102.91000366210938,92.58000183105469,92.87999725341795,126.87000274658205,130.47000122070312,116.30999755859376,148.47000122070312,148.22999572753906,88.5,93.08333333333331,Services,US Mid Atlantic
Chubb Ltd,CB,,,2020-03-26,,ND,ND,Ransomware,101.8000030517578,104.0199966430664,118.31999969482422,128.55999755859378,134.91000366210938,125.91000366210938,113.8499984741211,125.98999786376952,152.52999877929688,150.8300018310547,152.69000244140625,164.94000244140625,158.91000366210938,139.0,139.42857142857142,"Finance, Insurance, Real Estate",Foreign
CANON INC,CAJ,2/3/2020 - 2/14/2020,,2020-03-24,,Financial,Name | Bank Account | Address | SSN | Other,Phishing,20.21999931335449,19.6299991607666,19.8700008392334,21.40999984741211,19.790000915527344,17.299999237060547,16.209999084472653,16.450000762939453,18.690000534057614,19.559999465942386,21.170000076293945,22.030000686645508,22.1200008392334,0.2515,3.5283333333333338,Manufacturing,Foreign
WEIBO Corp,WB,,,2020-03-23,172000000,Personal,Name | Other,ND,34.080001831054695,35.939998626708984,29.8799991607666,33.900001525878906,33.880001068115234,33.790000915527344,35.97999954223633,39.90999984741211,44.5099983215332,45.93999862670898,42.959999084472656,58.29999923706055,52.459999084472656,40.0,39.833333333333336,Services,Foreign
Norwegian Cruise Line Holdings Ltd.,NCLH,,2020-03-13 00:00:00,2020-03-20,29969,Personal,Email | Password | Other,Misconfiguration,8.229999542236326,11.489999771118164,12.43000030517578,18.21999931335449,14.890000343322756,15.68000030517578,16.25,16.450000762939453,21.020000457763672,25.18000030517578,25.29999923706055,26.85000038146973,29.70000076293945,20.0,22.0,Transportation & Public Utilities,US Southeast
ROGERS COMMUNICATIONS INC,RCI,,2020-02-26 00:00:00,2020-03-19,,Personal,Name | Address | Email | Phone Number | Other,Misconfiguration,37.91999816894531,42.959999084472656,39.97999954223633,42.02000045776367,42.16999816894531,42.61000061035156,39.27000045776367,40.0,45.34000015258789,46.66999816894531,47.31999969482422,44.38000106811523,48.93999862670898,69.0,68.57142857142857,Transportation & Public Utilities,Canada
TELUS CORP,TU,2020-02-13 00:00:00,,2020-03-18,,Personal,Phone Number,Unauthorized Access,15.529999732971193,16.229999542236328,16.219999313354492,17.09000015258789,17.569999694824222,18.229999542236328,18.15999984741211,18.200000762939453,18.950000762939453,19.959999084472656,20.84000015258789,20.729999542236328,20.93000030517578,16.45,18.753125,Transportation & Public Utilities,Canada
TANDEM DIABETES CARE INC,TNDM,1/17/2020 - 1/20/2020,2020-01-17 00:00:00,2020-03-17,,Personal,SSN | Other,Unauthorized Access,48.0099983215332,71.87000274658203,88.19999694824219,81.38999938964844,98.6500015258789,101.77999877929688,108.41000366210938,118.73999786376952,95.75,86.4000015258789,91.72000122070312,103.12000274658205,86.81999969482422,72.0,72.0,Manufacturing,US West
CARNIVAL CORP,CCL,4/11/2019 - 7/23/2019,Late May-2019,2020-03-13,372500,Financial,Name | Address | SSN | Credit Card | Other (Financial),Unauthorized Access,14.970000267028807,11.5,13.1899995803833,19.979999542236328,15.279999732971193,15.1899995803833,17.690000534057614,15.210000038146973,14.93000030517578,21.31999969482422,20.1299991607666,20.600000381469727,28.459999084472656,13.0,25.41119047619048,Transportation & Public Utilities,US Southeast
ENTERCOM COMMUNICATIONS CORP,ETM,2019-08-04 00:00:00,Sep-2019,2020-03-06,,Personal,Name | Username | Password,Unauthorized Access,3.3199999332427983,0.8100000023841858,1.0599999427795408,2.390000104904175,1.5299999713897705,1.4199999570846558,1.5900000333786009,1.5399999618530271,1.7100000381469729,2.859999895095825,2.700000047683716,5.389999866485597,5.019999980926514,1.0,2.1666666666666665,Transportation & Public Utilities,US Mid Atlantic
Liberty Global plc,LBTYB,Apr-2019,,2020-03-05,900000,Personal,Other,ND,21.190000534057614,17.510000228881836,41.099998474121094,22.21999931335449,23.0,23.38999938964844,23.38999938964844,21.399999618530273,20.59000015258789,22.709999084472656,24.10000038146973,24.0,22.57999992370605,,,Transportation & Public Utilities,Foreign
"T-Mobile US, Inc.",TMUS,,,2020-03-04,1027,Personal,Name | Address | Phone Number | Other,Unauthorized Access,89.37000274658203,81.9800033569336,88.95999908447266,101.20999908447266,106.01000213623048,106.87999725341795,114.83999633789062,113.41000366210938,111.12000274658205,131.19000244140622,132.42999267578122,129.3699951171875,118.83999633789062,110.0,106.85714285714286,Transportation & Public Utilities,US Southwest
CIRCOR INTERNATIONAL INC,CIR,,,2020-03-02,,ND,ND,ND,37.72999954223633,9.630000114440918,12.59000015258789,20.93000030517578,24.5,26.21999931335449,30.040000915527344,27.60000038146973,28.78000068664551,34.169998168945305,38.43999862670898,32.43000030517578,39.36000061035156,0.69,17.453333333333333,Manufacturing,US New England
"Walgreens Boots Alliance, Inc.",WBA,1/9/2020 - 1/15/2020,2020-01-15 00:00:00,2020-02-28,,Personal,Name | Address | Other,Misconfiguration,46.2400016784668,44.0,44.43000030517578,42.97000122070313,41.16999816894531,39.84000015258789,39.34000015258789,36.06999969482422,36.0,39.0,39.65999984741211,51.18000030517578,47.93000030517578,51.0,51.0,Retail Trade,US Midwest
CRYOLIFE INC,CRY,,2019-11-01 00:00:00,2020-02-19,,Other,Money,Phishing,27.149999618530273,20.5,19.8700008392334,22.450000762939453,17.379999160766598,18.959999084472656,20.51000022888184,17.379999160766598,18.670000076293945,20.06999969482422,21.920000076293945,24.18000030517578,25.0,,,Manufacturing,US Southeast
MGM Resorts International,MGM,,,2020-02-19,10683188,Personal,Email | Phone Number | Address | Other,Unauthorized Access,32.02000045776367,7.139999866485598,14.079999923706055,15.3100004196167,18.57999992370605,16.809999465942386,20.950000762939453,22.020000457763672,20.799999237060547,26.90999984741211,31.670000076293945,30.53000068664551,35.040000915527344,30.0,24.57142857142857,Services,US West
ESTEE LAUDER COMPANIES INC,EL,,,2020-02-11,,Personal,Email,Misconfiguration,208.67999267578125,187.3800048828125,164.8300018310547,169.9499969482422,200.42999267578125,189.69000244140625,204.4900054931641,214.6000061035156,224.6000061035156,247.3500061035156,246.52999877929688,258.1099853515625,284.3999938964844,142.0,150.33333333333334,Manufacturing,US Mid Atlantic
"Altice USA, Inc.",ATUS,2019-11-04 00:00:00,Jan-2020,2020-02-06,52846,Personal,Name | SSN | Address,Phishing,27.790000915527344,26.440000534057607,23.20000076293945,23.53000068664551,25.8700008392334,24.239999771118164,28.020000457763672,26.649999618530273,26.809999465942386,29.3700008392334,34.709999084472656,36.810001373291016,36.86999893188477,35.0,35.42857142857143,Transportation & Public Utilities,US Mid Atlantic
Alphabet Inc.,GOOGL,11/21/2019 - 11/25/2019,,2020-02-04,,Other,ND,Misconfiguration,1482.5999755859375,1337.719970703125,1092.699951171875,1322.9000244140625,1439.25,1469.9300537109375,1482.760009765625,1629.510009765625,1455.5999755859375,1645.6600341796875,1821.8399658203125,1726.1300048828125,2058.8798828125,1600.0,1612.75,Services,US West
Public Storage,PSA,,,2020-01-30,,Other,ND,ND,222.0800018310547,209.1199951171875,201.6300048828125,186.72000122070312,202.7400054931641,191.1000061035156,196.83999633789062,213.44000244140625,220.91000366210938,230.8600006103516,224.4600067138672,227.8000030517578,227.6199951171875,229.0,233.33333333333331,"Finance, Insurance, Real Estate",US West
UNITEDHEALTH GROUP INC,UNH,7/30/2019 - 11/13/2019,2019-12-10 00:00:00,2020-01-22,36,Personal,Name | Other,Unauthorized Access,300.5299987792969,301.42999267578125,206.58999633789062,274.19000244140625,286.9100036621094,292.6700134277344,305.1099853515625,314.1400146484375,299.19000244140625,322.7900085449219,334.70001220703125,336.0799865722656,355.0,362.0,362.0,"Finance, Insurance, Real Estate",US Midwest
MICROSOFT CORP,MSFT,12/5/2019 - 12/31/2019,2019-12-31 00:00:00,2020-01-22,,Personal,ND,Misconfiguration,166.5,178.58999633789062,137.35000610351562,167.82000732421875,183.42999267578125,200.57000732421875,208.75,213.0200042724609,202.5399932861328,214.8000030517578,210.38999938964844,222.58999633789062,224.97000122070312,200.0,197.59259259259255,Services,US West
UNITED PARCEL SERVICE INC,UPS,9/29/2019 - 1/13/2020,,2020-01-20,17094,Personal,Name | Other,Phishing,117.38999938964844,106.76000213623048,96.25,101.1999969482422,96.43000030517578,107.7699966430664,118.3499984741211,160.33999633789062,159.66000366210938,172.10000610351562,166.47999572753906,175.17999267578125,156.27999877929688,124.5,122.66666666666669,Transportation & Public Utilities,US Southeast
"AutoWeb, Inc.",AUTO,,2020-01-09 00:00:00,2020-01-13,,Other,ND,Malware,2.5,2.1300001144409184,1.940000057220459,0.7400000095367432,0.8799999952316284,1.0800000429153442,1.190000057220459,2.2100000381469727,3.609999895095825,4.5,2.400000095367432,2.720000028610229,2.9500000476837163,582.5,524.6,Services,US Southeast
"SMITH & WESSON BRANDS, INC.",SWBI,11/27/2019 - 12/3/2019,2019-12-16 00:00:00,2020-01-09,780,Financial,Credit Card,Malware,7.317448139190674,7.578785419464111,4.8501152992248535,5.841660499572754,7.432744026184082,11.821675300598145,17.271329879760742,20.238277435302734,17.350000381469727,16.690000534057614,15.8100004196167,15.479999542236328,19.270000457763672,,,Manufacturing,US New England
Cigna Corp,CI,,2019-12-10 00:00:00,2020-01-09,,Personal,Name | Address | Other,Misconfiguration,211.41000366210938,208.9199981689453,181.6000061035156,186.22000122070312,189.2700042724609,215.83999633789062,180.0800018310547,178.19000244140625,173.97999572753906,177.8699951171875,211.1999969482422,218.6699981689453,220.8000030517578,255.0,250.53333333333333,"Finance, Insurance, Real Estate",US New England
"PayPal Holdings, Inc.",PYPL,,2019-11-06 00:00:00,2020-01-09,,Financial,Name| Address | Phone Number | Email | Credit Card,Phishing,111.81999969482422,118.87999725341795,101.62999725341795,105.05999755859376,144.9600067138672,156.08999633789062,181.57000732421875,198.6300048828125,185.9499969482422,193.05999755859366,184.72000122070312,216.94000244140625,242.4600067138672,132.0,132.5,Services,US West
"Ollie's Bargain Outlet Holdings, Inc.",OLLI,10/9/2019 - 10/10/2019,2019-11-15 00:00:00,2019-12-31,,Personal,Name | SSN,Phishing,65.58000183105469,55.36999893188477,50.86999893188477,45.790000915527344,67.91000366210939,91.4499969482422,97.6500015258789,106.8000030517578,95.54000091552734,87.3499984741211,87.08999633789062,88.05999755859375,83.05999755859375,65.0,64.33333333333333,Retail Trade,US Mid Atlantic
Waitr Holdings Inc.,WTRH,1/18/2019 - 10/17/2019,,2019-12-31,,Financial,Name | Credit Card | Other,Malware,0.30000001192092896,0.3490000069141388,0.35899999737739563,1.2799999713897705,1.3400000333786009,2.470000028610229,2.630000114440918,5.320000171661377,4.0300002098083505,3.220000028610228,2.549999952316284,3.3199999332427983,2.9800000190734863,,,Services,US Southeast
GLOBAL PAYMENTS INC,GPN,10/1/2019 - 11/13/2019,,2019-12-30,,Financial,Name | Credit Card | Other,Unauthorized Access,181.3500061035156,199.2700042724609,183.97000122070312,151.22999572753906,169.82000732421875,179.49000549316406,166.57000732421875,177.36000061035156,177.27000427246094,177.5,156.1699981689453,195.19000244140625,209.7700042724609,216.0,219.33333333333331,Services,US Southeast
"AVID TECHNOLOGY, INC.",AVID,10/8/2018 - 10/12/2018,2018-09-24 00:00:00,2019-12-24,,Personal,ND,Unauthorized Access,8.359999656677246,8.949999809265137,8.470000267028809,5.809999942779541,6.9000000953674325,5.940000057220459,7.4000000953674325,8.220000267028809,8.060000419616701,7.800000190734862,9.350000381469727,12.06999969482422,13.800000190734865,,,Services,US New England
"TWITTER, INC.",TWTR,,,2019-12-21,,Other,ND,Malware,32.130001068115234,34.09000015258789,39.04999923706055,23.95000076293945,27.01000022888184,32.22999954223633,33.40999984741211,37.060001373291016,38.959999084472656,39.900001525878906,46.349998474121094,44.68000030517578,54.63999938964844,35.0,33.5,Services,US West
Unum Group,UNM,10/1/2019 - 10/10/2019,2019-10-10 00:00:00,2019-12-20,2927,Personal,Name | Address | SSN | Other,Unauthorized Access,29.34000015258789,29.3700008392334,29.70000076293945,10.81999969482422,15.149999618530273,14.470000267028807,16.479999542236328,17.09000015258789,18.21999931335449,18.26000022888184,18.450000762939453,21.440000534057614,21.6299991607666,32.0,31.0,"Finance, Insurance, Real Estate",US Southeast
HONDA MOTOR CO LTD,HMC,12/4/2019 - 12/12/2019,2019-12-12 00:00:00,2019-12-18,,Personal,Name | Address |Phone Number | Address | Other,Misconfiguration,29.18000030517578,27.78000068664551,27.04999923706055,21.280000686645508,22.6299991607666,23.8700008392334,27.21999931335449,26.229999542236328,25.739999771118164,24.93000030517578,24.239999771118164,29.190000534057607,29.31999969482422,,,Manufacturing,Foreign
NOVO NORDISK A S,NVO,,,2019-12-13,,Other,ND,ND,56.5,58.97000122070313,63.34000015258789,53.41999816894531,58.84000015258789,62.540000915527344,64.61000061035156,65.15000152587889,67.08999633789061,66.44999694824219,73.62000274658203,68.22000122070311,69.54000091552734,,,Manufacturing,Foreign
AT&T INC.,T,2019-12-02 00:00:00,2019-12-02 00:00:00,2019-12-11,,Financial,Name | Email | Phone Number | Address | Credit Card,Malware,38.060001373291016,38.56999969482422,38.34000015258789,35.849998474121094,30.729999542236328,29.3799991607666,32.139999389648445,30.1299991607666,30.20000076293945,28.90999984741211,28.31999969482422,28.85000038146973,30.690000534057607,29.875,29.875,Transportation & Public Utilities,US Southwest
"BIO-RAD LABORATORIES, INC.",BIO,,2019-12-05 00:00:00,2019-12-06,,Other,ND,Ransomware,369.0199890136719,372.0299987792969,371.1900024414063,386.67999267578125,381.2900085449219,443.0,452.5199890136719,465.4599914550781,527.2999877929689,484.2300109863281,530.6599731445311,630.5700073242188,559.4000244140625,,,Manufacturing,US West
StoneX Group Inc.,SNEX,,2019-05-08 00:00:00,2019-12-06,,Personal,Name | Address | SSN | Other,Phishing,41.27000045776367,48.52000045776367,49.11000061035156,43.58000183105469,36.25,39.54999923706055,56.09000015258789,59.22000122070313,56.52999877929688,55.77000045776367,52.41999816894531,56.04999923706055,64.19999694824219,,,"Finance, Insurance, Real Estate",US Mid Atlantic
MAGELLAN HEALTH INC,MGLN,2019-05-28 00:00:00,2019-07-05 00:00:00,2019-12-04,,Personal,Name | SSN | Other,Phishing,78.5,75.97000122070312,71.69000244140625,56.02999877929688,41.72999954223633,62.4900016784668,73.12999725341797,73.0,72.5999984741211,74.86000061035156,77.83000183105469,76.29000091552734,77.66999816894531,,,Services,US Southwest
"Primerica, Inc.",PRI,,,2019-12-04,,Personal,ND,ND,130.47999572753906,131.71000671386722,121.11000061035156,113.0199966430664,80.69000244140625,101.62000274658205,117.83000183105469,113.11000061035156,121.48999786376952,125.5199966430664,112.66999816894531,113.44000244140624,135.08000183105472,,,"Finance, Insurance, Real Estate",US Southeast
CHOICE HOTELS INTERNATIONAL INC /DE,CHH,6/1/2015 - 11/12/2019,2019-11-12 00:00:00,2019-11-29,88295,Financial,Name | Email | Credit Card | Other,Misconfiguration,97.25,104.8499984741211,100.2300033569336,91.27999877929688,63.81999969482422,74.56999969482422,81.87000274658203,78.4000015258789,84.3499984741211,101.19000244140624,88.31999969482422,84.05000305175781,102.4499969482422,99.0,98.0,Services,US Mid Atlantic
Palo Alto Networks Inc,PANW,,,2019-11-28,7,Personal,Name | SSN | Other,Misconfiguration,222.2700042724609,233.2700042724609,237.8500061035156,187.55999755859366,162.5399932861328,196.8800048828125,231.7899932861328,225.38999938964844,247.66000366210938,255.3699951171875,245.94000244140625,231.5399932861328,295.30999755859375,,,Manufacturing,US West
ADOBE INC.,ADBE,,2019-11-21 00:00:00,2019-11-28,,Personal,Email | Address | Phone Number | Other,ND,309.05999755859375,330.7900085449219,346.8999938964844,337.5199890136719,305.8299865722656,348.5,375.1700134277344,426.9200134277344,437.1000061035156,510.3200073242188,488.510009765625,478.55999755859375,477.0299987792969,350.0,343.38095238095235,Services,US West
UNITED PARCEL SERVICE INC,UPS,10/11/2019 - 10/22/2019,,2019-11-27,6400,Personal,Name | Other,Unauthorized Access,121.1999969482422,119.04000091552734,114.91999816894531,93.7300033569336,99.77999877929688,102.5500030517578,97.06999969482422,107.31999969482422,121.01000213623048,158.89999389648438,166.1199951171875,168.0,170.5,128.0,121.6,Transportation & Public Utilities,US Southeast
"T-Mobile US, Inc.",TMUS,,Early November 2019,2019-11-21,,Personal,Name | Address | Phone Number | Other,ND,77.63999938964844,77.4000015258789,82.02999877929688,99.5,74.55000305175781,89.94000244140625,98.13999938964844,106.9000015258789,106.13999938964844,115.4000015258789,110.56999969482422,113.06999969482422,129.67999267578122,101.0,102.0,Transportation & Public Utilities,US Southwest
Ingredion Inc,INGR,,,2019-11-19,,Personal,ND,Malware,82.9000015258789,89.9800033569336,92.58000183105469,96.33999633789062,60.79999923706055,80.69000244140625,79.98999786376953,86.18000030517578,85.61000061035156,79.08000183105469,81.30999755859375,78.55999755859375,76.7699966430664,,,Manufacturing,US Midwest
"Wayside Technology Group, Inc.",WSTG,,2019-06-20 00:00:00,2019-11-15,1228,Financial,Name | SSN | Bank Account | Other,Unauthorized Access,13.970000267028807,15.75,16.180000305175778,15.25,13.75,14.239999771118164,18.399999618530273,23.649999618530273,23.51000022888184,22.100000381469727,25.09000015258789,23.190000534057607,20.31999969482422,,,Wholesale Trade,US Mid Atlantic
US XPRESS ENTERPRISES INC,USX,Jul-2019,2019-08-08 00:00:00,2019-11-14,400,Personal,Name | SSN | Other,Phishing,4.980000019073486,4.949999809265137,5.389999866485597,6.300000190734862,3.559999942779541,3.630000114440918,3.5699999332427983,5.429999828338623,6.1500000953674325,10.6899995803833,8.149999618530272,10.350000381469727,7.760000228881836,6.0,6.0,Transportation & Public Utilities,US Southeast
"Macy's, Inc.",M,10/7/2019 - 10/15/2019,2019-10-15 00:00:00,2019-11-14,135152,Financial,Name | Phone Number | Address | Credit Card | Other,Malware,16.069999694824222,15.18000030517578,17.8799991607666,16.739999771118164,8.029999732971191,6.1599998474121085,5.019999980926514,7.300000190734862,6.570000171661378,6.96999979019165,7.199999809265138,6.130000114440918,7.360000133514402,15.5,17.75,Retail Trade,US Mid Atlantic
"HASBRO, INC.",HAS,,2019-11-14 00:00:00,2019-11-14,452000,Personal,Name | Email | Password,Misconfiguration,94.0,103.91999816894531,104.86000061035156,96.98999786376952,55.02000045776367,74.22000122070312,62.84000015258789,74.30000305175781,73.61000061035156,78.94000244140625,77.18000030517578,86.88999938964844,87.72000122070312,163.0,153.6,Manufacturing,US New England
"HELIUS MEDICAL TECHNOLOGIES, INC.",HSDT,,Oct-19,2019-11-12,,Other,ND,Phishing,36.71500015258789,16.135000228881836,33.25,34.825000762939446,18.899999618530273,9.204999923706056,14.875,16.344999313354492,16.800016403198242,18.445018768310547,14.7000150680542,15.154999732971193,14.699999809265135,,,Manufacturing,US Mid Atlantic
"T2 Biosystems, Inc.",TTOO,,,2019-11-12,,Other,ND,Ransomware,2.700000047683716,1.190000057220459,1.1799999475479126,0.8190000057220459,0.4950000047683716,0.4860000014305115,0.550000011920929,1.3899999856948853,1.3799999952316284,1.870000004768372,1.3200000524520874,1.3600000143051147,1.2000000476837158,3.0,3.0,Manufacturing,US New England
"GOLDEN ENTERTAINMENT, INC.",GDEN,5/30/2019 - 7/31/2019,2019-10-08 00:00:00,2019-11-07,5815,Financial,Name | SSN | Bank Accounting | Other,Phishing,15.329999923706055,18.170000076293945,19.18000030517578,19.600000381469727,12.270000457763672,6.239999771118164,7.3400001525878915,13.880000114440918,8.90999984741211,10.489999771118164,13.229999542236328,13.779999732971193,16.170000076293945,23.0,21.66666666666667,Services,US West
"ICHOR HOLDINGS, LTD.",ICHR,,,2019-11-06,,Other,ND,Phishing,31.440000534057607,30.95000076293945,32.56999969482422,35.689998626708984,29.65999984741211,20.225000381469727,22.3700008392334,26.489999771118164,27.709999084472656,32.0,23.43000030517578,22.809999465942386,27.36000061035156,37.0,37.66666666666666,Manufacturing,US West
HESKA CORP,HSKA,,,2019-11-06,,Other,ND,ND,94.3000030517578,94.45999908447266,95.66000366210938,100.58000183105469,95.37000274658205,56.02999877929688,69.73000335693361,91.02999877929688,92.16999816894531,107.61000061035156,97.69000244140624,98.58000183105469,121.91000366210938,121.1,121.1,Manufacturing,US West
MARRIOTT INTERNATIONAL INC /MD/,MAR,,2019-09-04 00:00:00,2019-10-30,2589,Personal,Name | Address | SSN,Unauthorized Access,126.52999877929688,140.36000061035156,151.8699951171875,142.61000061035156,124.0,76.16000366210938,95.98999786376952,88.5,86.5999984741211,87.13999938964844,106.26000213623048,93.22000122070312,93.33000183105469,133.0,139.33333333333334,Services,US Mid Atlantic
PRICE T ROWE GROUP INC,TROW,,2019-10-06 00:00:00,2019-10-29,,Personal,Name | Email | Phone Number | SSN | Other,Misconfiguration,117.08000183105469,123.70999908447266,122.81999969482422,131.30000305175778,118.01000213623048,98.43000030517578,113.88999938964844,120.66000366210938,120.81999969482422,133.92999267578122,139.11000061035156,128.55000305175778,137.13999938964844,131.0,131.0,"Finance, Insurance, Real Estate",US Mid Atlantic
BED BATH & BEYOND INC,BBBY,9/4/2019 - 9/27/2019,,2019-10-29,346,Personal,Email | Password,Unauthorized Access,14.779999732971193,14.65999984741211,17.079999923706055,16.120000839233402,10.8100004196167,4.650000095367432,6.6500000953674325,7.46999979019165,10.81999969482422,10.350000381469727,12.09000015258789,14.880000114440918,21.100000381469727,,,Retail Trade,US Mid Atlantic
ADOBE INC.,ADBE,,2019-10-19 00:00:00,2019-10-25,7500000,Personal,Email | Other,Unauthorized Access,269.70001220703125,305.2799987792969,329.6400146484375,351.3699951171875,357.4100036621094,310.0,344.1000061035156,385.260009765625,431.67999267578125,430.30999755859375,476.2999877929688,467.6700134277344,488.5,330.0,324.5555555555556,Services,US West
HENRY JACK & ASSOCIATES INC,JKHY,,,2019-10-24,,Personal,ND,Unauthorized Access,138.49000549316406,149.4499969482422,146.32000732421875,152.41000366210938,167.92999267578125,129.61000061035156,156.1999969482422,186.9199981689453,182.1199951171875,181.7700042724609,164.72999572753906,159.41000366210938,158.30999755859375,152.5,152.5,Services,US Southeast
PATRICK INDUSTRIES INC,PATK,,,2019-10-24,,Other,ND,Malware,46.27000045776367,49.97999954223633,53.13999938964844,54.599998474121094,59.77999877929688,20.149999618530273,31.93000030517578,53.31999969482422,60.97999954223633,64.91999816894531,62.52000045776367,52.790000915527344,57.099998474121094,54.0,57.33333333333334,Manufacturing,US Midwest
FERRO CORP,FOE,5/29/2019 - 8/19/2019,,2019-10-23,,Personal,ND,Phishing,11.270000457763672,12.710000038146973,15.0,14.350000381469727,14.670000076293945,8.229999542236326,8.930000305175781,11.779999732971193,11.460000038146973,12.010000228881836,12.539999961853027,11.649999618530273,13.670000076293945,15.0,14.666666666666664,Manufacturing,US Midwest
"Lumen Technologies, Inc.",LUMN,11/17/2018 - 9/17/2019,2019-09-15 00:00:00,2019-10-18,2800000,Personal,Name | Address | Email | Phone Number,Misconfiguration,10.100000381469727,10.100000381469727,10.100000381469727,10.100000381469727,10.100000381469727,10.100000381469727,10.25,9.6899995803833,10.220000267028807,9.800000190734863,10.800000190734863,11.0,9.859999656677246,,,Transportation & Public Utilities,US Southeast
Tribune Publishing Co,TPCO,,,2019-10-18,3476,Other,ND,ND,8.130000114440918,9.5600004196167,13.210000038146973,13.029999732971193,12.899999618530273,6.260000228881836,7.880000114440918,9.380000114440918,9.8100004196167,10.050000190734863,10.920000076293944,12.199999809265135,12.800000190734865,12.5,12.5,Manufacturing,US Midwest
Ingredion Inc,INGR,,,2019-10-15,,Other,ND,Malware,80.19999694824219,83.31999969482422,87.69000244140625,92.0,97.33999633789062,73.1500015258789,81.55000305175781,78.1500015258789,83.0199966430664,82.75,81.6500015258789,80.16000366210938,78.05999755859375,90.5,90.5,Manufacturing,US Midwest
PITNEY BOWES INC /DE/,PBI,2019-10-12 00:00:00,,2019-10-14,,Other,ND,Malware,4.460000038146973,4.920000076293945,4.239999771118163,3.9500000476837163,3.940000057220459,2.640000104904175,2.2100000381469727,2.200000047683716,2.759999990463257,2.490000009536743,6.110000133514402,5.559999942779541,6.010000228881836,6.0,6.0,Manufacturing,US New England
WHIRLPOOL CORP /DE/,WHR,,,2019-10-12,28151181,Personal,Other,Misconfiguration,158.22000122070312,155.94000244140625,146.1999969482422,149.67999267578125,151.97999572753906,110.48999786376952,104.75,108.66999816894531,122.4800033569336,135.63999938964844,176.3300018310547,172.8000030517578,200.91000366210938,142.0,148.75,Manufacturing,US Midwest
Walmart Inc.,WMT,7/5/2019 - 8/26/2019,2019-09-12 00:00:00,2019-10-11,,Financial,Name | Address | Phone Number | Email | Bank Account | SSN | Other,Unauthorized Access,119.61000061035156,119.04000091552734,119.13999938964844,116.37999725341795,115.25,119.79000091552734,121.8000030517578,123.66999816894531,121.16000366210938,130.67999267578122,131.8800048828125,136.80999755859378,142.77999877929688,130.0,131.57142857142858,Retail Trade,US Southeast
Aptevo Therapeutics Inc.,APVO,,2019-09-13 00:00:00,2019-10-10,,Personal,Name | Address | SSN,Unauthorized Access,7.980000019073486,9.170000076293944,8.581999778747559,9.477999687194824,7.027999877929688,4.760000228881836,3.839999914169312,6.289999961853027,6.440000057220459,8.409999847412111,8.279999732971191,7.760000228881836,7.170000076293945,,,Manufacturing,US West
TransUnion,TRU,,,2019-10-09,37000,Personal,Name | Addres | Other,Unauthorized Access,79.16000366210938,80.62000274658203,85.33999633789062,90.0199966430664,94.93000030517578,81.41000366210938,69.5,79.11000061035156,93.11000061035156,87.02999877929688,87.37999725341797,83.0199966430664,88.54000091552734,83.0,77.95333333333333,Services,US Midwest
Cronos Group Inc.,CRON,,,2019-10-07,,Personal,ND,ND,8.869999885559082,8.329999923706055,6.710000038146973,6.789999961853027,7.010000228881836,5.809999942779541,5.769999980926514,5.570000171661377,6.5999999046325675,6.449999809265138,5.869999885559082,5.389999866485597,5.039999961853027,14.0,13.887200000000002,Manufacturing,Canada
ELECTRONIC ARTS INC.,EA,2019-10-03 00:00:00,2019-10-03 00:00:00,2019-10-03,1600,Personal,ND,Misconfiguration,94.25,95.3000030517578,100.4000015258789,107.33999633789062,105.04000091552734,106.88999938964844,102.29000091552734,113.2699966430664,122.36000061035156,133.83999633789062,142.36000061035156,139.55999755859378,129.07000732421878,110.0,106.75,Services,US West
"Zendesk, Inc.",ZEN,2016-11-01 00:00:00,2019-09-24 00:00:00,2019-10-02,22000,Personal,Email | Name | Phone Number | Password (Hashed),Unauthorized Access,72.70999908447266,72.2300033569336,74.6500015258789,76.62999725341797,86.4000015258789,78.47000122070312,62.4900016784668,72.55000305175781,87.55999755859375,89.23999786376953,91.1500015258789,103.0999984741211,104.36000061035156,95.0,91.54545454545456,Services,US West
PAR TECHNOLOGY CORP,PAR,4/19/2019 - 6/20/2019,2019-05-31 00:00:00,2019-09-19,918,Financial,Name | SSN | Bank Account,Unauthorized Access,24.6299991607666,22.709999084472656,30.920000076293945,30.309999465942386,30.149999618530273,31.53000068664551,10.720000267028807,15.029999732971193,24.88999938964844,30.190000534057607,28.71999931335449,34.880001068115234,43.27000045776367,3.503,3.503,Manufacturing,US Mid Atlantic
"CHEGG, INC",CHGG,Apr-2018,,2019-09-19,40000000,Personal,Name | Email | Address | Password (Encrypted),Unauthorized Access,34.25,32.36999893188477,36.88999938964844,38.4900016784668,43.33000183105469,40.72000122070313,27.709999084472656,36.75,62.20000076293945,63.11000061035156,73.0,78.22000122070312,64.09999847412111,35.0,35.0,Services,US West
MAGELLAN HEALTH INC,MGLN,5/28/2019,2019-07-05 00:00:00,2019-09-17,589,Personal,Name | SSN,Phishing,63.22000122070313,61.20000076293945,72.5999984741211,77.25,77.91000366210938,72.79000091552734,38.7599983215332,51.79999923706055,68.59999847412111,73.30000305175781,75.62999725341797,75.73999786376953,75.37000274658203,65.0,65.0,Services,US Southwest
MAGELLAN HEALTH INC,MGLN,6/6/2019,2019-07-12 00:00:00,2019-09-17,55637,Personal,Name | SSN,Phishing,63.22000122070313,61.20000076293945,72.5999984741211,77.25,77.91000366210938,72.79000091552734,38.7599983215332,51.79999923706055,68.59999847412111,73.30000305175781,75.62999725341797,75.73999786376953,75.37000274658203,65.0,65.0,Services,US Southwest
Park Hotels & Resorts Inc.,PK,,2019-07-30 00:00:00,2019-09-16,469,Financial,Name | Address | SSN | Bank Account | Credit Card | Other,Phishing,26.11000061035156,23.35000038146973,22.6200008392334,24.940000534057607,24.559999465942386,23.6299991607666,6.889999866485598,7.9000000953674325,7.309999942779541,11.550000190734865,10.15999984741211,9.460000038146973,11.15999984741211,28.5,27.5,Services,US Mid Atlantic
BERKSHIRE HATHAWAY INC,BRK.A,2019-08-12 00:00:00,,2019-09-16,837,Personal,ND,ND,,,,,,,,,,,,,,333100.0,333100.0,"Finance, Insurance, Real Estate",US Midwest
"Forterra, Inc.",FRTA,,2019-07-30 00:00:00,2019-09-13,18,Personal,Name | Address | Other,Unauthorized Access,7.28000020980835,7.5900001525878915,11.029999732971193,10.56999969482422,12.0,14.130000114440918,7.320000171661378,6.559999942779541,7.8400001525878915,9.109999656677246,10.795000076293944,15.510000228881836,16.469999313354492,,,Manufacturing,US Southwest
ZYNGA INC,ZNGA,,2019-08-31 00:00:00,2019-09-12,218000000,Personal,Username | Password,ND,5.760000228881836,6.139999866485598,6.309999942779541,6.139999866485598,6.619999885559082,6.739999771118164,6.690000057220459,6.9099998474121085,7.940000057220459,9.18000030517578,10.380000114440918,9.010000228881836,8.350000381469728,8.0,8.0,Services,US West
"Cornerstone Building Brands, Inc.",CNR,4/1/2019 - 4/2/2019,2019-06-26 00:00:00,2019-09-11,7213,Personal,ND,Unauthorized Access,4.989999771118164,6.1599998474121085,6.78000020980835,7.869999885559082,8.380000114440918,8.949999809265137,6.119999885559082,4.690000057220459,4.769999980926514,6.0999999046325675,4.940000057220459,7.239999771118164,7.570000171661378,123.7235,117.37058333333334,Manufacturing,US Southeast
Brixmor Property Group Inc.,BRX,2019-05-26 00:00:00,,2019-09-09,,Personal,Name | Other,Unauthorized Access,19.51000022888184,20.440000534057614,21.56999969482422,21.8799991607666,20.459999084472656,20.8799991607666,16.5,9.760000228881836,11.359999656677244,16.040000915527347,12.25,12.18000030517578,12.68000030517578,21.25,21.25,"Finance, Insurance, Real Estate",US Mid Atlantic
CHASE CORP,CCF,,,2019-09-06,,Personal,Name | Other,Misconfiguration,101.37000274658205,104.56999969482422,123.9800033569336,120.25,111.38999938964844,100.01000213623048,87.16999816894531,83.80000305175781,90.97000122070312,107.5999984741211,101.73999786376952,101.76000213623048,99.44000244140624,,,Manufacturing,US New England
MGM Resorts International,MGM,2019-07-07 00:00:00,,2019-09-04,46542,Personal,Name | Address | Phone Number | Other,Unauthorized Access,27.09000015258789,27.25,29.770000457763672,31.6200008392334,33.290000915527344,31.209999084472656,23.29999923706055,10.579999923706056,14.779999732971193,20.26000022888184,16.860000610351562,16.319999694824222,23.06999969482422,35.0,32.38857142857143,Services,US West
ENTERCOM COMMUNICATIONS CORP,ETM,,,2019-09-04,,Other,ND,Malware,3.400000095367432,3.2000000476837163,3.5899999141693115,4.78000020980835,4.559999942779541,4.269999980926514,3.5,0.8299999833106995,1.0399999618530271,1.8899999856948853,1.5399999618530271,1.4299999475479126,1.5,4.0,4.0,Transportation & Public Utilities,US Mid Atlantic
DELUXE CORP,DLX,,,2019-08-29,153,Personal,ND,ND,44.41999816894531,48.88000106811523,53.75,52.15999984741211,50.06999969482422,48.61999893188477,33.299999237060554,25.209999084472656,28.82999992370605,25.559999465942386,24.04999923706055,20.729999542236328,29.35000038146973,7.75,7.75,Manufacturing,US Midwest
"Lumber Liquidators Holdings, Inc.",LL,,2019-08-21 00:00:00,2019-08-27,,Other,ND,Malware,8.930000305175781,9.4399995803833,9.59000015258789,8.829999923706055,9.989999771118164,7.199999809265138,10.5,5.789999961853027,6.289999961853027,8.760000228881836,13.3100004196167,23.1200008392334,26.8799991607666,14.0,14.0,Retail Trade,US Mid Atlantic
Mastercard Inc,MA,,2019-08-20 00:00:00,2019-08-22,89338,Personal,Name | Credit Card | Email | Address | Phone Number | Other,ND,282.010009765625,271.17001342773443,274.29998779296875,284.45001220703125,298.57000732421875,321.92999267578125,339.70001220703125,211.4199981689453,245.3500061035156,294.260009765625,304.44000244140625,307.6000061035156,337.1000061035156,315.0,313.0,Services,US Mid Atlantic
Helios & Matheson Analytics Inc.,HMNY,,,2019-08-20,161000000,Financial,Name | Address | Credit Card | Email,Misconfiguration,0.0017000000225380065,0.0024000001139938827,0.003000000026077032,0.0027000000700354576,0.0026499999221414328,0.0024500000290572643,0.0003000000142492353,0.0003000000142492353,0.00019999999494757506,0.0013000000035390258,0.0010000000474974509,0.000699999975040555,0.0005499999970197678,,,Services,US Mid Atlantic
"Cable One, Inc.",CABO,2019-03-19 00:00:00,May-2019,2019-08-16,7375,Financial,Name | Address | SSN | Bank Account | Other,Phishing,1242.4200439453125,1238.81005859375,1282.5400390625,1475.4599609375,1516.280029296875,1669.6099853515625,1774.0,1185.510009765625,1700.1400146484375,1835.239990234375,1737.969970703125,1776.1300048828125,1870.1700439453125,1441.0,1441.0,Transportation & Public Utilities,US Southwest
CHOICE HOTELS INTERNATIONAL INC /DE,CHH,2019-07-02 00:00:00,,2019-08-15,700000,Personal,Name | Email | Address | Phone Number,Misconfiguration,87.69999694824219,94.37999725341795,87.88999938964844,91.29000091552734,101.3499984741211,99.9000015258789,104.5999984741211,74.12999725341797,72.97000122070312,70.4000015258789,83.80000305175781,81.4000015258789,94.76000213623048,81.0,59.53333333333333,Services,US Mid Atlantic
"AzurRx BioPharma, Inc.",AZRX,,2019-08-08 00:00:00,2019-08-13,,Other,Money,Phishing,0.9900000095367432,1.1299999952316284,0.4889999926090241,0.6499999761581421,0.7889999747276306,1.690000057220459,0.9340000152587892,0.5120000243186951,0.6449999809265137,0.9100000262260436,0.9279999732971193,0.8389999866485596,1.1299999952316284,,,Manufacturing,US Southeast
AMARIN CORP PLC\UK,AMRN,5/2/2019 - 6/20/2019,2019-06-20 00:00:00,2019-08-05,78000,Personal,Name | Address | Email | Phone Number | Other,Misconfiguration,16.799999237060547,16.139999389648438,14.369999885559082,17.450000762939453,22.78000068664551,20.950000762939453,18.82999992370605,16.020000457763672,4.78000020980835,7.619999885559082,6.760000228881836,6.920000076293945,7.03000020980835,26.0,26.0,Manufacturing,Foreign
Atlassian Corp Plc,TEAM,,,2019-08-02,,Personal,ND,Misconfiguration,143.9199981689453,134.50999450683594,124.2699966430664,122.36000061035156,120.83999633789062,120.33999633789062,147.0,146.82000732421875,134.05000305175778,154.58999633789062,188.32000732421875,185.6100006103516,176.64999389648438,,,Services,US West
HONDA MOTOR CO LTD,HMC,7/4/2019 - 7/6/2019,2019-07-06 00:00:00,2019-07-31,,Personal,Name | Email | Other,Misconfiguration,25.31999969482422,23.65999984741211,26.07999992370605,27.420000076293945,28.1200008392334,28.270000457763672,26.40999984741211,25.65999984741211,23.40999984741211,24.04999923706055,26.04999923706055,25.559999465942386,25.309999465942386,27.63300000000001,27.63300000000001,Manufacturing,Foreign
PEARSON PLC,PSO,2018-11-01 00:00:00,Mar-2019,2019-07-31,,Personal,Name | Email,ND,10.84000015258789,10.09000015258789,9.039999961853027,8.84000015258789,8.359999656677246,8.460000038146973,7.4099998474121085,7.199999809265138,7.010000228881836,5.860000133514402,5.800000190734862,7.230000019073486,7.130000114440918,,,Manufacturing,Foreign
CORVEL CORP,CRVL,,,2019-07-30,,ND,ND,ND,93.0,86.08999633789062,75.69999694824219,79.52999877929688,82.51000213623047,87.20999908447266,93.51000213623048,68.94000244140625,55.0099983215332,54.52999877929688,67.88999938964844,72.55000305175781,79.06999969482422,,,"Finance, Insurance, Real Estate",US West
CAPITAL ONE FINANCIAL CORP,COF,2019-03-22 00:00:00,2019-07-19 00:00:00,2019-07-29,114385,Financial,Name | Address | Phone Number | Email | SSN|Bank Account | Other,Exploit,96.91999816894531,84.58999633789062,91.33999633789062,95.16999816894531,100.25,103.0,102.04000091552734,88.26000213623047,55.29999923706055,63.75,68.54000091552734,62.38000106811523,64.09999847412111,99.0,67.51666666666667,"Finance, Insurance, Real Estate",US Mid Atlantic
"ZIONS BANCORPORATION, NATIONAL ASSOCIATION /UT/",ZION,,2019-06-01 00:00:00,2019-07-27,,Financial,Name | Email | Bank Account,Unauthorized Access,45.15999984741211,40.20000076293945,43.959999084472656,47.95000076293945,49.65999984741211,51.65999984741211,46.459999084472656,41.81999969482422,27.3700008392334,30.790000915527344,32.93000030517578,32.290000915527344,32.40999984741211,45.0,46.0,"Finance, Insurance, Real Estate",US West
"Fossil Group, Inc.",FOSL,5/14/2019 - 6/18/2019,2019-06-18 00:00:00,2019-07-18,1393,Financial,Name | Address | Phone Number | Email | Credit Card,Unauthorized Access,11.029999732971193,9.420000076293944,12.510000228881836,11.380000114440918,7.309999942779541,7.53000020980835,8.319999694824219,6.119999885559082,3.150000095367432,3.5,3.240000009536743,4.8400001525878915,4.130000114440918,12.0,12.0,Manufacturing,US Southwest
TransUnion,TRU,Jul-2019,Jul-2019,2019-07-12,,Other,Money,Phishing,74.9800033569336,81.45999908447266,79.83000183105469,80.52999877929688,81.6500015258789,84.55000305175781,91.0199966430664,95.06999969482422,80.0,71.48999786376953,77.91000366210938,87.23999786376953,83.05000305175781,89.0,83.74285714285716,Services,US Midwest
Bluegreen Vacations Holding Corp,BVH,3/26/2019 - 3/28/2019,2019-03-27 00:00:00,2019-07-03,980,Financial,Name | Address | SSN | Bank Account,Malware,22.79999923706055,20.100000381469727,20.700000762939453,23.54999923706055,23.04999923706055,22.25,22.95000076293945,19.850000381469727,17.700000762939453,10.550000190734863,9.399999618530273,9.850000381469727,11.899999618530273,,,"Finance, Insurance, Real Estate",US Southeast
INNOSPEC INC.,IOSP,2019-06-27 00:00:00,,2019-07-01,,Other,ND,Malware,92.6500015258789,94.29000091552734,83.18000030517578,89.13999938964844,91.5500030517578,98.4000015258789,103.29000091552734,104.5500030517578,86.54000091552734,68.88999938964844,72.5199966430664,77.08999633789062,77.25,,,Manufacturing,US West
"TripAdvisor, Inc.",TRIP,,,2019-06-22,,Personal,Email | Password,ND,47.29999923706055,44.599998474121094,38.52000045776367,39.13000106811523,37.790000915527344,28.059999465942386,30.059999465942386,30.489999771118164,28.290000915527344,15.84000015258789,17.360000610351562,19.479999542236328,18.18000030517578,,,Services,US New England
"PayPal Holdings, Inc.",PYPL,,,2019-06-16,,Personal,Other,ND,117.16000366210938,120.9000015258789,104.9499969482422,106.5199966430664,103.58999633789062,104.1999969482422,109.56999969482422,114.8499984741211,122.98999786376952,92.72000122070312,107.9499969482422,145.50999450683594,157.5500030517578,129.0,130.14285714285714,Services,US West
Liberty Media Corp,LSXMA,2/22/2019 - 4/15/2019,2019-04-15 00:00:00,2019-06-11,10000000,Personal,Name | Username | Password | Phone Number | Address,ND,35.58505249023437,38.9478874206543,40.0,40.934120178222656,41.41592788696289,46.06686401367188,46.59783554077149,46.80432510375977,48.18092346191406,41.62241744995117,31.514257431030273,32.32054901123047,37.540000915527344,43.0,43.0,Transportation & Public Utilities,US West
"AVALARA, INC.",AVLR,5/22/2019,2019-05-22 00:00:00,2019-06-07,,Personal,Name | SSN | Other,Misconfiguration,72.75,79.55999755859375,79.33000183105469,81.0999984741211,70.58000183105469,72.30000305175781,75.58999633789062,80.06999969482422,88.63999938964844,77.0999984741211,71.0,93.11000061035156,99.0999984741211,,,Services,US West
PRUDENTIAL PLC,PUK,2019-04-01 00:00:00,,2019-05-31,31170,Personal,Name | Address | Phone Number | Email | Other,Unauthorized Access,40.88000106811523,44.540000915527344,41.959999084472656,33.389999389648445,36.38999938964844,40.540000915527344,35.47999954223633,37.77000045776367,36.33000183105469,33.080001831054695,24.739999771118164,28.26000022888184,25.68000030517578,,,"Finance, Insurance, Real Estate",Foreign
MICROCHIP TECHNOLOGY INC,MCHP,,,2019-05-31,,Other,ND,Malware,81.33999633789062,91.4000015258789,96.98999786376952,86.33000183105469,92.91000366210938,95.4000015258789,94.54000091552734,104.98999786376952,101.55999755859376,90.70999908447266,68.98999786376953,87.7300033569336,96.0199966430664,100.5,100.5,Manufacturing,US Southwest
RYDER SYSTEM INC,R,3/21/2019 - 4/17/2019,2019-05-07 00:00:00,2019-05-28,729,Personal,Name | SSN | Other,Unauthorized Access,53.27000045776367,56.4900016784668,59.09000015258789,45.11999893188477,50.86000061035156,55.11999893188477,53.31999969482422,53.88000106811523,49.72000122070313,36.900001525878906,26.489999771118164,30.3700008392334,34.939998626708984,69.0,69.0,Services,US Southeast
First American Financial Corp,FAF,,,2019-05-24,885000000,Financial,Bank Account | SSN | Other,Misconfiguration,54.88000106811523,55.02999877929688,55.61000061035156,57.66999816894531,59.09000015258789,60.45000076293945,62.61000061035156,58.27999877929688,61.209999084472656,63.790000915527344,34.72999954223633,42.2599983215332,49.47000122070313,29.15,32.21666666666667,"Finance, Insurance, Real Estate",US West
Facebook Inc,FB,,,2019-05-20,49000000,Personal,Email | Phone Number,Misconfiguration,182.72000122070312,187.47999572753903,198.3600006103516,186.1699981689453,190.13999938964844,185.8500061035156,199.32000732421875,206.05999755859366,222.13999938964844,217.4900054931641,153.1300048828125,178.24000549316406,216.8800048828125,119.0,148.11428571428567,Services,US West
Facebook Inc,FB,,,2019-05-14,,Personal,ND,Malware,181.5399932861328,177.47000122070312,204.8699951171875,188.4499969482422,187.19000244140625,183.27999877929688,193.19000244140625,194.1100006103516,221.91000366210938,213.13999938964844,170.27999877929688,174.7899932861328,205.1000061035156,125.0,148.97142857142856,Services,US West
"URBAN ONE, INC.",UONE,Feb-2019 - Mar-2019,,2019-05-10,18012,Other,ND,Unauthorized Access,1.8899999856948853,2.9300000667572017,2.309999942779541,2.049999952316284,1.9700000286102293,1.9800000190734863,2.2100000381469727,2.0,2.2100000381469727,2.1199998855590816,1.9299999475479128,1.190000057220459,1.2999999523162842,,,Transportation & Public Utilities,US Mid Atlantic
"BERRY GLOBAL GROUP, INC.",BERY,Jan-2019,2019-04-04 00:00:00,2019-05-09,1461,Financial,Address | SSN | Bank Account | Other,Phishing,51.47000122070313,50.31999969482422,54.31000137329102,42.47999954223633,38.209999084472656,37.52000045776367,41.91999816894531,47.20000076293945,44.77000045776367,41.95000076293945,31.82999992370605,35.970001220703125,43.86000061035156,61.5,61.5,Manufacturing,US Midwest
SHAW COMMUNICATIONS INC,SJR,,2019-04-17 00:00:00,2019-05-08,15000,Financial,Email | Phone Number | Credit Card | Other,ND,20.280000686645508,20.86000061035156,20.25,19.43000030517578,19.86000061035156,19.690000534057614,20.1200008392334,20.36000061035156,20.6200008392334,19.82999992370605,17.8700008392334,16.379999160766598,16.129999160766598,32.5,32.5,Transportation & Public Utilities,Canada
Eaton Corp plc,ETN,4/1/2019,2019-04-10 00:00:00,2019-05-08,,Financial,Name | SSN | Address | Email | Bank Account | Other,Unauthorized Access,81.02999877929688,79.08000183105469,81.26000213623047,78.08999633789062,83.25,78.30000305175781,90.9000015258789,93.08000183105469,94.83999633789062,101.95999908447266,92.7699966430664,76.16000366210938,80.26000213623047,81.0,82.75,Manufacturing,Foreign
AMC Networks Inc.,AMCX,,,2019-05-03,1600000,Financial,Name | Email | Other | Other (financial),Misconfiguration,57.36000061035156,54.38000106811523,55.06000137329102,53.18000030517578,46.7400016784668,47.93999862670898,43.08000183105469,37.47000122070313,39.150001525878906,36.560001373291016,31.06999969482422,22.299999237060547,24.040000915527344,52.0,52.0,Transportation & Public Utilities,US Mid Atlantic
"CHARLES RIVER LABORATORIES INTERNATIONAL, INC.",CRL,,Mar-2019,2019-04-30,,Personal,ND,Unauthorized Access,142.52000427246094,125.5199966430664,141.89999389648438,139.78999328613278,131.02999877929688,132.3699951171875,132.41999816894528,145.25,151.83999633789062,157.7100067138672,155.57000732421875,129.99000549316406,145.9600067138672,146.5,126.833,Services,US New England
MICROSOFT CORP,MSFT,,,2019-04-18,60000000,Personal,Email | Other,Misconfiguration,121.7699966430664,128.07000732421878,132.85000610351562,136.27000427246094,136.1300048828125,137.38999938964844,139.69000244140622,150.33999633789062,154.69000244140625,167.10000610351562,187.22999572753903,146.57000732421875,178.60000610351562,145.0,141.0,Services,US West
WIPRO LTD,WIT,,,2019-04-17,,Other,ND,Phishing,4.239999771118163,4.5,4.5,4.170000076293944,3.7999999523162837,3.670000076293945,3.7799999713897705,3.869999885559082,3.759999990463257,3.7999999523162837,3.7999999523162837,2.759999990463257,3.059999942779541,4.5,4.5,Services,Foreign
MICROSOFT CORP,MSFT,1/1/2019 - 3/29/2019,,2019-04-13,,Personal,Email | Other,ND,120.9499969482422,123.3499984741211,131.49000549316406,138.89999389648438,135.78999328613278,137.52000427246094,139.67999267578122,147.07000732421875,153.24000549316406,163.27999877929688,184.7100067138672,139.05999755859378,165.50999450683594,145.0,140.35294117647058,Services,US West
CORNING INC /NY,GLW,1/29/2019,2019-03-12 00:00:00,2019-04-12,,Personal,Name | Address | Email | SSN,Spoofing,34.59999847412109,30.790000915527344,30.959999084472656,32.549999237060554,27.75,29.979999542236328,29.059999465942386,29.940000534057607,28.020000457763672,30.11000061035156,28.040000915527344,23.149999618530273,21.18000030517578,38.1,37.8,Manufacturing,US Mid Atlantic
HUMANA INC,HUM,1/15/2016 - 2/21/2018,2019-02-14 00:00:00,2019-04-08,522,Personal,Name | Other,Spoofing,273.5599975585937,245.27999877929688,248.8699951171875,264.14999389648443,293.8900146484375,273.510009765625,255.2400054931641,315.1400146484375,348.1400146484375,366.8699951171875,353.260009765625,367.010009765625,320.04998779296875,314.0,316.75,"Finance, Insurance, Real Estate",US Mid Atlantic
"URBAN ONE, INC.",UONE,,2019-02-28 00:00:00,2019-04-05,18012,Personal,Name | Address | SSN | Password | Other,Unauthorized Access,2.049999952316284,2.259999990463257,1.9800000190734863,2.259999990463257,2.1099998950958248,1.7799999713897705,2.059999942779541,2.1600000858306885,2.009999990463257,1.9600000381469729,1.950000047683716,1.9099999666213991,1.2699999809265137,,,Transportation & Public Utilities,US Mid Atlantic
"RAVE RESTAURANT GROUP, INC.",RAVE,9/6/2018 - 12/2/2018,,2019-04-05,,Financial,Name | Credit Card | Other,Malware,1.5,1.6299999952316284,2.509999990463257,2.9800000190734863,2.549999952316284,2.4200000762939453,2.5,2.619999885559082,1.7100000381469729,1.820000052452088,1.5900000333786009,1.25,0.5899999737739563,,,Wholesale Trade,US Southwest
"AeroGrow International, Inc.",AERO,10/29/2018 - 3/4/2019,2019-03-04 00:00:00,2019-04-04,27488,Financial,Credit Card | Other,Malware,1.5499999523162842,1.6699999570846558,1.149999976158142,1.5800000429153442,1.2999999523162842,1.1299999952316284,0.9399999976158142,0.8999999761581421,1.0199999809265137,0.9700000286102296,1.1799999475479126,1.309999942779541,1.3400000333786009,,,Retail Trade,US West
Facebook Inc,FB,,,2019-04-04,540000000,Personal,Name | Other,Misconfiguration,173.5399932861328,195.47000122070312,164.14999389648438,197.1999969482422,189.0200042724609,182.38999938964844,179.3800048828125,194.72000122070312,198.82000732421875,208.6699981689453,204.19000244140625,185.88999938964844,154.17999267578125,220.0,212.02380952380955,Services,US West
"Forterra, Inc.",FRTA,1/17/2018 - 10/31/2018,2018-01-31 00:00:00,2019-04-02,763,Personal,Name,Phishing,4.099999904632568,4.6599998474121085,4.78000020980835,5.199999809265137,6.559999942779541,5.980000019073486,7.039999961853027,8.409999847412111,10.960000038146973,11.5600004196167,12.949999809265135,13.859999656677244,5.71999979019165,,,Manufacturing,US Southwest
"SANUWAVE Health, Inc.",SNWV,,,2019-04-01,,Other,ND,Phishing,0.20000000298023224,0.18000000715255735,0.1599999964237213,0.14000000059604645,0.12999999523162842,0.18000000715255735,0.15000000596046448,0.14000000059604645,0.1599999964237213,0.1599999964237213,0.1899999976158142,0.2700000107288361,0.20000000298023224,,,Manufacturing,US Southeast
TOYOTA MOTOR CORP/,TM,Feb-2019,,2019-03-29,3100000,Personal,ND,ND,119.06999969482422,123.80999755859376,119.4000015258789,123.98999786376952,131.72999572753906,130.28999328613278,136.27999877929688,138.33999633789062,141.66000366210938,141.27999877929688,142.5800018310547,130.75,127.23999786376952,75.215,75.215,Manufacturing,Foreign
HEXION INC.,HXOH,,,2019-03-22,,Other,ND,Ransomware,,,,,,,,,,,,,,,,Manufacturing,US Midwest
FirstService Corp,FSV,,Jan-2019,2019-03-22,,Personal,Name | SSN,ND,85.37000274658203,87.41999816894531,86.29000091552734,96.4800033569336,97.08999633789062,102.63999938964844,103.9499969482422,105.4499969482422,92.0,94.58999633789062,99.83000183105469,108.4499969482422,67.33000183105469,,,"Finance, Insurance, Real Estate",Canada
Apple Inc.,AAPL,12/22/2018,12/23/2018,2019-03-21,,Financial,Name | Address | Phone Number | Email | Credit Card | Other,Unauthorized Access,47.040000915527344,50.96500015258789,45.772499084472656,49.8650016784668,50.647499084472656,52.59000015258789,54.43249893188477,60.12749862670898,65.79750061035156,69.86000061035156,79.14250183105469,80.07499694824219,57.31000137329102,212.0,208.375,Manufacturing,US West
SHENANDOAH TELECOMMUNICATIONS CO/VA/,SHEN,Jun-2015 - Jan-2019,2019-01-18 00:00:00,2019-03-19,,Personal,Name | Address | Phone Number | Email | SSN | Other,Misconfiguration,46.58000183105469,42.29999923706055,41.93000030517578,39.4900016784668,38.5,32.799999237060554,32.90999984741211,30.770000457763672,36.04999923706055,38.86999893188477,44.060001373291016,48.349998474121094,47.540000915527344,,,Transportation & Public Utilities,US Mid Atlantic
"OneMain Holdings, Inc.",OMF,7/21/2012,,2019-03-14,465,Personal,Name | SSN,Unauthorized Access,33.40999984741211,33.419998168945305,32.59000015258789,31.56999969482422,34.59000015258789,39.060001373291016,38.810001373291016,35.36999893188477,41.060001373291016,43.38000106811523,42.09000015258789,46.9900016784668,31.57999992370605,44.0,44.0,"Finance, Insurance, Real Estate",US Midwest
ABM INDUSTRIES INC /DE/,ABM,1/8/2018 - 8/7/2018,2018-06-14 00:00:00,2019-03-12,42366,Financial,SSN | Bank Account | Credit Card | Other,Phishing,33.5,37.0,38.31999969482422,39.61999893188477,40.810001373291016,39.77999877929688,36.54999923706055,36.11999893188477,37.68000030517578,38.13000106811523,38.65999984741211,38.97999954223633,29.40999984741211,1.4,1.4,Services,US Mid Atlantic
CITRIX SYSTEMS INC,CTXS,10/13/2018 - 3/8/2019,2019-03-06 00:00:00,2019-03-08,15820,Financial,Name | SSN | Bank Account,Unauthorized Access,102.87000274658205,100.93000030517578,97.54000091552734,95.86000061035156,98.9800033569336,91.4000015258789,94.41000366210938,96.8000030517578,110.11000061035156,110.62000274658205,112.41000366210938,121.08000183105469,117.91000366210938,123.0,123.0,Services,US Southeast
Tribune Publishing Co,TPCO,11/1/2018,Dec-2018,2019-03-07,242,Financial,Username | Password | Bank Account,Unauthorized Access,11.520000457763672,12.149999618530273,11.100000381469727,9.649999618530273,8.289999961853027,8.0,7.670000076293945,8.579999923706055,9.399999618530273,12.289999961853027,12.970000267028807,12.520000457763672,10.020000457763672,12.0,12.0,Manufacturing,US Midwest
"Walker & Dunlop, Inc.",WD,,2018-11-05 00:00:00,2019-03-06,,Personal,Name | Address | SSN | Other,Unauthorized Access,54.88999938964844,51.36000061035156,55.290000915527344,51.9000015258789,55.65999984741211,54.95000076293945,57.33000183105469,55.52999877929688,63.4000015258789,64.91999816894531,63.540000915527344,74.9800033569336,66.77999877929689,70.0,70.0,"Finance, Insurance, Real Estate",US Mid Atlantic
Protective Insurance Corp,PTVCA,,2018-09-17 00:00:00,2019-03-01,,Personal,Name | Other,Unauthorized Access,20.770000457763672,19.5,16.450000762939453,15.859999656677244,16.5,16.399999618530273,15.5,15.890000343322756,15.399999618530273,15.0,15.550000190734865,15.0,15.09000015258789,,,"Finance, Insurance, Real Estate",US Midwest
TOYOTA MOTOR CORP/,TM,,,2019-02-21,,Personal,ND,ND,122.79000091552734,119.66999816894531,125.16000366210938,118.11000061035156,125.8000030517578,130.16999816894528,129.02999877929688,136.55999755859378,136.32000732421878,141.3699951171875,141.97000122070312,142.3800048828125,139.11000061035156,2.904,10.44,Manufacturing,Foreign
"Del Taco Restaurants, Inc.",TACO,,2019-01-28 00:00:00,2019-02-21,,Personal,Name | SSN | Other,Phishing,10.90999984741211,9.90999984741211,10.09000015258789,11.619999885559082,11.90999984741211,12.460000038146973,11.510000228881836,10.470000267028807,9.68000030517578,7.3499999046325675,7.730000019073486,8.0,7.800000190734862,14.0,13.6,Retail Trade,US West
"VOLT INFORMATION SCIENCES, INC.",VOLT,8/6/2018 - 10/4/2018,2018-10-16 00:00:00,2019-02-15,9064,Personal,Name | SSN,Unauthorized Access,3.920000076293945,4.309999942779541,5.0,4.2899999618530265,4.320000171661377,4.539999961853027,3.9600000381469727,3.1700000762939453,3.0,2.859999895095825,2.380000114440918,2.470000028610229,2.0999999046325684,,,Services,US West
"FIVE BELOW, INC",FIVE,11/13/2018 - 1/11/2019,2019-01-11 00:00:00,2019-02-14,56102,Financial,Name | Address | Credit Card,Unauthorized Access,130.66999816894528,116.91999816894531,134.97000122070312,127.79000091552734,132.19999694824222,128.25999450683594,111.5500030517578,133.47000122070312,129.36000061035156,122.77999877929688,123.86000061035156,107.45999908447266,114.93000030517578,143.5,702.25775,Retail Trade,US Mid Atlantic
"Coeur Mining, Inc.",CDE,12/14/2018 - 12/17/2018,2018-12-17 00:00:00,2019-02-14,,Financial,Name | SSN | Bank Account | Other,Phishing,4.960000038146973,4.889999866485597,3.940000057220459,3.220000028610228,3.490000009536743,4.630000114440918,5.289999961853027,4.519999980926514,4.670000076293945,6.369999885559082,7.269999980926514,6.429999828338622,6.110000133514402,6.375,6.375,Mining,US Midwest
FLANIGANS ENTERPRISES INC,BDL,,,2019-02-12,,Other,Money,Phishing,24.61000061035156,24.8700008392334,23.649999618530273,25.0,23.5,22.84000015258789,21.68000030517578,22.3700008392334,22.46999931335449,23.09000015258789,22.940000534057607,22.31999969482422,20.600000381469727,,,Retail Trade,US Southeast
Facebook Inc,FB,,,2019-02-08,14526602,Personal,Name | Other,Misconfiguration,166.3800048828125,169.1300048828125,174.92999267578125,189.7700042724609,173.35000610351562,195.75999450683602,185.1499938964844,187.4900054931641,179.67999267578125,190.4199981689453,201.0500030517578,213.05999755859366,212.3300018310547,192.475,192.475,Services,US West
SCIENTIFIC GAMES CORP,SGMS,10/12/2018 - 10/28/2018,2018-12-21 00:00:00,2019-02-06,58000,Personal,Name | Address | Phone Number | Email | Password,Malware,24.78000068664551,27.899999618530273,21.850000381469727,20.700000762939453,19.770000457763672,19.989999771118164,21.1299991607666,19.36000061035156,20.170000076293945,25.989999771118164,26.70000076293945,25.8700008392334,27.8799991607666,30.5,31.0,Services,US West
Keurig Dr Pepper Inc.,KDP,,,2019-02-04,,Other,ND,Malware,27.170000076293945,26.04999923706055,27.60000038146973,29.04999923706055,28.190000534057607,30.20000076293945,28.10000038146973,26.60000038146973,27.239999771118164,27.8700008392334,30.0,28.809999465942386,28.68000030517578,25.0,24.33333333333333,Manufacturing,US New England
REGENCY CENTERS CORP,REG,11/22/2018 - 11/28/2018,2018-12-20 00:00:00,2019-01-25,,Financial,Name | SSN | Bank Account | Other,Phishing,61.43999862670898,65.77999877929689,66.12999725341797,66.94000244140625,66.76000213623047,68.86000061035156,66.15000152587889,63.34000015258789,67.62000274658203,68.91999816894531,64.34999847412111,61.86999893188477,63.790000915527344,66.0,39.01076923076923,"Finance, Insurance, Real Estate",US Southeast
CVS HEALTH Corp,CVS,Jun-2018 - 10/19/2018,2018-12-11 00:00:00,2019-01-24,2334,Personal,Name | Address | SSN | Bank Account | Other,Phishing,66.11000061035156,61.95000076293945,56.040000915527344,52.959999084472656,52.790000915527344,53.13999938964844,56.27000045776367,60.2400016784668,63.349998474121094,65.59999847412111,75.30999755859375,74.37999725341797,73.52999877929688,76.0,76.7604375,Retail Trade,US New England
CITIGROUP INC,C,1/10/2019 - 1/15/2019,2019-01-10 00:00:00,2019-01-23,24349524,Personal,Other,Misconfiguration,61.849998474121094,64.13999938964844,60.97999954223633,69.08999633789061,64.66000366210939,67.97000122070311,71.11000061035156,63.90999984741211,69.55000305175781,72.05999755859375,74.87000274658203,78.76000213623047,80.0999984741211,76.5,74.83333333333333,"Finance, Insurance, Real Estate",US Mid Atlantic
BlackRock Inc.,BLK,,,2019-01-20,20000,Personal,Name | Email,Misconfiguration,413.6000061035156,431.0700073242188,434.5700073242188,465.6900024414063,438.0899963378906,454.95001220703125,473.239990234375,425.55999755859375,443.9800109863281,445.0400085449219,492.7999877929688,502.3399963378906,535.239990234375,470.0,470.75,"Finance, Insurance, Real Estate",US Mid Atlantic
Unum Group,UNM,6/1/2018 - 10/31/2018,2018-11-28 00:00:00,2019-01-18,2927,Personal,Name | SSN | Other,Unauthorized Access,33.61999893188477,36.31999969482422,36.77000045776367,37.41999816894531,34.790000915527344,32.400001525878906,32.669998168945305,26.690000534057607,29.540000915527344,28.04999923706055,29.239999771118164,30.51000022888184,29.3700008392334,39.0,39.16666666666666,"Finance, Insurance, Real Estate",US Southeast
UNITEDHEALTH GROUP INC,UNH,Jun-2018 - 10/11/2018,2018-11-07 00:00:00,2019-01-09,,Financial,Name | Address | Bank Account | SSN | Other,Phishing,243.2899932861328,261.89999389648443,237.2899932861328,248.75,239.1499938964844,246.7700042724609,247.83999633789062,247.6199951171875,230.67999267578125,220.1100006103516,256.97000122070307,277.54000854492193,295.8999938964844,295.0,299.3,"Finance, Insurance, Real Estate",US Midwest
HUMANA INC,HUM,2018-08-07 00:00:00,2018-08-21 00:00:00,2018-12-31,8400,Personal,Name | Other,Phishing,286.4800109863281,306.3900146484375,285.0400085449219,266.0,255.41000366210938,247.8600006103516,261.1400146484375,284.5199890136719,283.2099914550781,255.6699981689453,294.19000244140625,341.2300109863281,367.7699890136719,340.5,259.5549,"Finance, Insurance, Real Estate",US Mid Atlantic
Tribune Publishing Co,TPCO,2018-12-29 00:00:00,,2018-12-30,,Other,ND,Ransomware,11.34000015258789,11.960000038146973,12.0600004196167,11.789999961853027,10.760000228881836,9.5600004196167,7.96999979019165,8.039999961853027,7.710000038146973,8.579999923706055,8.5,12.520000457763672,12.9399995803833,20.0,20.0,Manufacturing,US Midwest
Infinera Corp,INFN,5/8/2018 - 6/8/2018,2018-06-01 00:00:00,2018-12-27,,Personal,ND,Phishing,3.7899999618530273,4.369999885559082,5.4099998474121085,4.320000171661377,4.2899999618530265,3.1600000858306885,2.9100000858306885,3.7000000476837163,4.880000114440918,5.460000038146973,5.429999828338623,6.420000076293945,7.760000228881836,,,Manufacturing,US West
"CBTX, Inc.",CBTX,,,2018-12-21,7703,Personal,Name | Address | Bank Account | SSN | Other,Phishing,29.770000457763672,32.290000915527344,33.779998779296875,32.110000610351555,32.150001525878906,27.95000076293945,28.07999992370605,29.149999618530273,28.34000015258789,29.270000457763672,29.209999084472656,29.70000076293945,30.649999618530273,,,"Finance, Insurance, Real Estate",US Southwest
"Discovery, Inc.",DISCA,,,2018-12-18,,Personal,Username | Password,Phishing,27.520000457763672,27.29999923706055,29.29999923706055,27.229999542236328,30.40999984741211,27.8700008392334,29.520000457763672,31.79999923706055,27.95000076293945,27.20000076293945,27.88999938964844,30.76000022888184,32.36999893188477,29.0,29.0,Transportation & Public Utilities,US Mid Atlantic
Facebook Inc,FB,,,2018-12-14,6800000,Personal,ND,Misconfiguration,145.00999450683594,145.38999938964844,164.07000732421875,173.3699951171875,179.10000610351562,181.5399932861328,177.47000122070312,204.8699951171875,188.4499969482422,187.19000244140625,183.27999877929688,193.19000244140625,194.1100006103516,160.0,145.0909090909091,Services,US West
Alphabet Inc.,GOOGL,,,2018-12-11,52500000,Personal,Name | Email | Other,Misconfiguration,1053.1800537109377,1078.8299560546877,1102.1199951171877,1179.260009765625,1206.449951171875,1167.6400146484375,1082.760009765625,1140.9100341796875,1188.9000244140625,1205.699951171875,1209.469970703125,1298.280029296875,1342.8900146484375,1250.0,1272.5,Services,US West
FARMER BROTHERS CO,FARM,,2018-09-18 00:00:00,2018-12-11,2412,Financial,Name | Address | SSN | Email | Phone Number | Bank Account | Credit Card | Other (Financial),Unauthorized Access,23.6200008392334,24.84000015258789,25.729999542236328,23.959999084472656,21.81999969482422,18.780000686645508,18.90999984741211,17.399999618530273,14.479999542236328,14.0,13.859999656677244,15.9399995803833,15.710000038146973,,,Manufacturing,US Southwest
"BROWN & BROWN, INC.",BRO,,,2018-12-11,1597,Personal,Name | Other,Unauthorized Access,27.53000068664551,27.989999771118164,28.1299991607666,29.170000076293945,29.96999931335449,32.189998626708984,32.689998626708984,34.779998779296875,36.7400016784668,34.86999893188477,35.939998626708984,37.88000106811523,37.959999084472656,29.5,29.5,"Finance, Insurance, Real Estate",US Southeast
"J2 GLOBAL, INC.",JCOM,,,2018-12-09,,Personal,Email,Misconfiguration,70.47000122070312,70.75,74.98999786376953,84.26000213623047,88.30000305175781,88.80000305175781,85.56999969482422,88.33999633789062,82.12999725341797,89.05999755859375,90.9499969482422,100.43000030517578,95.16000366210938,,,Transportation & Public Utilities,US West
SELECTIVE INSURANCE GROUP INC,SIGI,5/8/2018 - 9/18/2018,2018-09-18 00:00:00,2018-12-07,,Personal,Name | SSN | Other,Phishing,65.09999847412111,59.2599983215332,63.93999862670898,63.709999084472656,66.56999969482422,71.87000274658203,74.12999725341797,77.8499984741211,78.27999877929688,78.7699966430664,75.87999725341797,68.88999938964844,66.34999847412111,62.0,62.0,"Finance, Insurance, Real Estate",US Mid Atlantic
ROPER TECHNOLOGIES INC,ROP,,2018-10-06 00:00:00,2018-12-06,,Personal,Name | Address | Phone Number | Email | SSN | Other,Unauthorized Access,287.2200012207031,267.489990234375,297.8599853515625,319.9599914550781,345.489990234375,358.20001220703125,358.07000732421875,376.0799865722656,344.1300048828125,375.1099853515625,344.7300109863281,340.95001220703125,347.04998779296875,287.0,293.2,Manufacturing,US Southeast
ROYAL CARIBBEAN CRUISES LTD,RCL,4/4/2018 - 9/13/2018,2018-10-22 00:00:00,2018-12-06,,Financial,Name | SSN | Bank Account | Credit Card | Other,Phishing,110.23999786376952,98.76000213623048,118.22000122070312,119.41000366210938,117.2699966430664,129.16999816894528,118.47000122070312,115.4000015258789,107.69000244140624,106.94000244140624,103.30999755859376,113.51000213623048,121.0,141.5,141.5,Transportation & Public Utilities,US Southeast
"HARLEY-DAVIDSON, INC.",HOG,2018-09-27 00:00:00,2018-09-27 00:00:00,2018-12-06,959,Personal,Name | SSN,Unauthorized Access,39.45000076293945,34.68000030517578,36.61000061035156,38.79999923706055,40.310001373291016,36.63999938964844,34.36999893188477,36.02000045776367,33.299999237060554,32.580001831054695,35.36999893188477,39.45000076293945,35.880001068115234,40.0,40.333333333333336,Manufacturing,US Midwest
SIGNET JEWELERS LTD,SIG,,,2018-12-03,,Financial,Name | Address | Phone Number | Email | Other (Financial),Misconfiguration,53.040000915527344,33.06999969482422,23.96999931335449,28.79999923706055,27.649999618530273,22.76000022888184,19.1200008392334,16.379999160766598,17.270000457763672,11.079999923706056,15.850000381469727,16.200000762939453,17.399999618530273,42.0,36.806999999999995,Retail Trade,Foreign
MARRIOTT INTERNATIONAL INC /MD/,MAR,2014 - 9/10/2018,2018-09-08 00:00:00,2018-11-30,383000000,Financial,Name | Address | Phone Number | Email | Credit Card | Other,Unauthorized Access,121.83999633789062,107.23999786376952,111.12000274658205,125.2699966430664,125.08999633789062,135.97000122070312,124.41999816894531,140.28999328613278,141.22999572753906,125.7300033569336,124.37000274658205,126.52999877929688,140.36000061035156,119.0,120.66666666666669,Services,US Mid Atlantic
1 800 FLOWERS COM INC,FLWS,8/15/2014 - 9/15/2018,2018-10-30 00:00:00,2018-11-30,74548,Financial,Name | Credit Card | Other,Malware,12.8100004196167,11.920000076293945,13.279999732971193,17.84000015258789,18.229999542236328,19.40999984741211,18.100000381469727,18.8799991607666,19.68000030517578,15.130000114440918,14.800000190734865,13.579999923706055,13.470000267028807,13.5,13.5,Retail Trade,US Mid Atlantic
TransUnion,TRU,,,2018-11-29,,Personal,ND,ND,63.83000183105469,55.86999893188477,59.4000015258789,64.55999755859375,65.83999633789061,70.04000091552734,66.08000183105469,73.51000213623047,83.1500015258789,83.7699966430664,79.37999725341797,82.20999908447266,87.0,75.0,78.28,Services,US Midwest
Dell Technologies Inc.,DELL,,2018-11-09 00:00:00,2018-11-28,,Personal,Name | Email | Password (Hashed),Unauthorized Access,57.95127487182617,44.29678726196289,46.9000015258789,56.25,57.540000915527344,65.36000061035156,66.41000366210939,52.209999084472656,55.27999877929688,45.599998474121094,50.95000076293945,51.59000015258789,50.31999969482422,,,Manufacturing,US Southwest
Francesca's Holdings CORP,FRANQ,12/28/2017 - 7/9/2018,,2018-11-19,84275,Financial,Name | Address | Email | Password | Credit Card,Misconfiguration,,,,,,,,,,,,,,,,Retail Trade,US Southwest
Facebook Inc,FB,,,2018-11-18,,Personal,Password,Misconfiguration,131.55000305175778,140.19000244140622,148.3000030517578,162.5,160.47000122070312,178.77999877929688,185.3000030517578,189.00999450683602,201.8000030517578,183.6999969482422,188.0800018310547,190.38999938964844,197.3999938964844,145.0,132.75555555555556,Services,US West
LPL Financial Holdings Inc.,LPLA,,2018-11-01 00:00:00,2018-11-17,270000,Financial,Name | Bank Account | SSN,Unauthorized Access,63.02000045776367,58.16999816894531,69.52999877929689,77.0,74.54000091552734,74.45999908447266,82.61000061035156,82.5999984741211,85.69999694824219,71.58000183105469,83.69000244140625,76.98999786376953,90.77999877929688,82.5,82.5,"Finance, Insurance, Real Estate",US West
"Enveric Biosciences, Inc.",ENVB,,,2018-11-14,,ND,ND,Phishing,,,,,,,,,,,,,,,,Manufacturing,US Southeast
NORDSTROM INC,JWN,2018-10-09 00:00:00,,2018-11-09,107106,Personal,Name | SSN | Bank Account | Other,ND,66.54000091552734,49.36000061035156,49.02000045776367,45.47000122070313,43.88000106811523,45.06999969482422,39.93000030517578,31.670000076293945,31.81999969482422,30.1299991607666,32.77000045776367,32.959999084472656,36.650001525878906,58.0,60.5,Retail Trade,US West
ROYAL CARIBBEAN CRUISES LTD,RCL,4/4/2018 - 9/13/2018,2018-10-22 00:00:00,2018-11-09,,Personal,Name | Other,Phishing,107.69000244140624,104.91999816894531,103.93000030517578,114.83999633789062,116.54000091552734,118.41999816894531,127.31999969482422,120.97000122070312,111.88999938964844,109.73999786376952,110.61000061035156,101.02999877929688,114.52999877929688,,,Transportation & Public Utilities,US Southeast
HSBC HOLDINGS PLC,HSBC,10/4/2018 - 10/14/2018,,2018-11-02,6733,Personal,Name | Address | Phone Number | Email | Bank Account | Other,ND,41.560001373291016,42.540000915527344,41.11000061035156,41.709999084472656,40.61000061035156,41.7599983215332,43.20000076293945,40.77000045776367,41.86999893188477,39.72000122070313,35.900001525878906,37.86000061035156,38.06999969482422,49.645,49.645,"Finance, Insurance, Real Estate",Foreign
Facebook Inc,FB,,,2018-11-02,120000000,Personal,Email | Phone Number | Other,ND,151.75,140.61000061035156,131.08999633789062,165.7100067138672,162.27999877929688,168.6999969482422,193.02999877929688,177.47000122070312,193.0,192.72999572753903,185.6699981689453,175.80999755859375,193.6199951171875,162.5,154.119375,Services,US West
"CNO Financial Group, Inc.",CNO,5/30/2018 - 9/13/2018,2018-08-07 00:00:00,2018-10-25,566217,Personal,Name | Address | SSN (Partial) | Other,Unauthorized Access,18.549999237060547,17.81999969482422,13.829999923706055,17.469999313354492,17.040000915527347,15.899999618530273,16.799999237060547,16.450000762939453,16.280000686645508,16.729999542236328,14.260000228881836,16.149999618530273,15.68000030517578,23.0,23.0,"Finance, Insurance, Real Estate",US Midwest
US BANCORP \DE\,USB,9/26/2018 - 9/27/2018,,2018-10-23,,Financial,Name | Address | SSN | Bank Account | Other,ND,51.43000030517578,53.68000030517578,44.61000061035156,50.13999938964844,51.27999877929688,48.27999877929688,51.20000076293945,51.849998474121094,52.2599983215332,55.33000183105469,52.04999923706055,55.68000030517578,56.6500015258789,55.5,56.66666666666666,"Finance, Insurance, Real Estate",US Midwest
BIOMARIN PHARMACEUTICAL INC,BMRN,2018-06-18 00:00:00,2018-06-21 00:00:00,2018-10-11,,Personal,Name | SSN | Other,Phishing,98.44000244140624,95.66999816894531,93.83000183105469,93.94000244140624,92.6500015258789,91.2699966430664,92.3000030517578,82.43000030517578,81.11000061035156,85.11000061035156,76.98999786376953,73.58999633789062,66.51000213623047,118.0,121.1,Manufacturing,US West
KKR & Co. Inc.,KKR,2018-07-17 00:00:00,,2018-10-10,,Personal,Name | Bank Account | SSN | Other,Unauthorized Access,26.059999465942386,23.790000915527344,21.11000061035156,21.479999542236328,23.170000076293945,22.38999938964844,22.899999618530273,23.920000076293945,23.959999084472656,26.09000015258789,25.170000076293945,26.940000534057607,26.229999542236328,27.5,27.5,"Finance, Insurance, Real Estate",US Mid Atlantic
Alphabet Inc.,GOOGL,,Mar-2018,2018-10-08,500000,Personal,Name | Email | Address | Other,Unauthorized Access,1155.9200439453125,1108.239990234375,1046.5799560546877,1075.9200439453123,1105.9100341796877,1150.8499755859375,1208.280029296875,1178.8599853515625,1068.3699951171877,1116.7900390625,1175.9100341796875,1206.3199462890625,1208.25,1350.0,1334.4444444444443,Services,US West
